Bus Hound 7.04 capture. Complements of www.perisoft.net

  Device - Device ID (followed by the endpoint for USB devices)
            (3) Intel(R) USB 3.0 ┐╔└®š╣ų„╗·┐žųŲŲ„ - 1.0 (Microsoft)
            (7) USB Root Hub (USB 3.0)
            (21) USB Composite Device
            (27) MediaTek PreLoader USB VCOM (Android) (COM7)
  Phase  - Phase Type
            CTL   USB control transfer       
            IN    Data in transfer           
            OUT   Data out transfer          
            USTS  USB status                 
  Data   - Hex dump of the data transferred
  Descr  - Description of the phase
  Cmd... - Position in the captured data


Device  Phase  Data                      Description       Cmd.Phase.Ofs(rep)
------  -----  ------------------------  ----------------  ------------------
   7    OUT    40 00 00 00               @...                     1.1.0        
   7.0  CTL    a3 00 0000 0006 0004      get status               2.1.0        
   7.0  IN     00 01 01 00               ....                     2.2.0        
   7.0  CTL    23 01 0010 0006 0000      clear feature            3.1.0        
   7.0  CTL    a3 00 0000 0006 0004      get status               4.1.0        
   7.0  IN     00 01 00 00               ....                     4.2.0        
   7    OUT    00 00 00 00               ....                     5.1.0        
   7.0  CTL    23 01 0002 0002 0000      clear feature            6.1.0        
   7    OUT    04 00 00 00               ....                     7.1.0        
   7.0  CTL    a3 00 0000 0002 0004      get status               8.1.0        
   7.0  IN     03 05 04 00               ....                     8.2.0        
   7.0  CTL    23 01 0012 0002 0000      clear feature            9.1.0        
   7.0  CTL    a3 00 0000 0002 0004      get status              10.1.0        
   7.0  IN     03 05 00 00               ....                    10.2.0        
   7    OUT    00 00 00 00               ....                    11.1.0        
   7.0  CTL    23 03 0002 0002 0000      set feature             12.1.0        
   7    OUT    40 00 00 00               @...                    13.1.0        
   7.0  CTL    a3 00 0000 0006 0004      get status              14.1.0        
   7.0  IN     01 03 01 00               ....                    14.2.0        
   7.0  CTL    23 01 0010 0006 0000      clear feature           15.1.0        
   7.0  CTL    a3 00 0000 0006 0004      get status              16.1.0        
   7.0  IN     01 03 00 00               ....                    16.2.0        
   7    OUT    00 00 00 00               ....                    17.1.0        
   7.0  CTL    23 03 0004 0006 0000      set feature             18.1.0        
   7    OUT    40 00 00 00               @...                    19.1.0        
   7.0  CTL    a3 00 0000 0006 0004      get status              20.1.0        
   7.0  IN     03 05 10 00               ....                    20.2.0        
   7.0  CTL    23 01 0014 0006 0000      clear feature           21.1.0        
   7.0  CTL    a3 00 0000 0006 0004      get status              22.1.0        
   7.0  IN     03 05 00 00               ....                    22.2.0        
   7    OUT    00 00 00 00               ....                    23.1.0        
   7.0  CTL    80 06 0100 0000 0040      GET DESCRIPTOR          24.1.0        
   7.0  IN     12 01 10 01  02 00 00 40  .......@                24.2.0        
               8d 0e 01 20  00 01 00 00  ... ....                24.2.8        
               00 01                     ..                      24.2.16       
   7.0  CTL    80 06 0100 0000 0012      GET DESCRIPTOR          25.1.0        
   7.0  IN     12 01 10 01  02 00 00 40  .......@                25.2.0        
               8d 0e 01 20  00 01 00 00  ... ....                25.2.8        
               00 01                     ..                      25.2.16       
   7.0  CTL    80 06 0200 0000 00ff      GET DESCRIPTOR          26.1.0        
   7.0  IN     09 02 43 00  02 01 00 80  ..C.....                26.2.0        
               00 09 04 00  00 02 0a 00  ........                26.2.8        
               00 00 07 05  81 02 00 02  ........                26.2.16       
               00 07 05 01  02 00 02 00  ........                26.2.24       
   7.0  CTL    23 01 0002 0002 0000      clear feature           27.1.0        
   7    OUT    04 00 00 00               ....                    28.1.0        
   7.0  CTL    a3 00 0000 0002 0004      get status              29.1.0        
   7.0  IN     03 05 04 00               ....                    29.2.0        
   7.0  CTL    23 01 0012 0002 0000      clear feature           30.1.0        
   7.0  CTL    a3 00 0000 0002 0004      get status              31.1.0        
   7.0  IN     03 05 00 00               ....                    31.2.0        
   7    OUT    00 00 00 00               ....                    32.1.0        
   7.0  CTL    80 06 0100 0000 0012      GET DESCRIPTOR          33.1.0        
   7.0  IN     12 01 10 01  02 00 00 40  .......@                33.2.0        
               8d 0e 01 20  00 01 00 00  ... ....                33.2.8        
               00 01                     ..                      33.2.16       
   7.0  CTL    80 06 0200 0000 0009      GET DESCRIPTOR          34.1.0        
   7.0  IN     09 02 43 00  02 01 00 80  ..C.....                34.2.0        
               00                        .                       34.2.8        
   7.0  CTL    80 06 0200 0000 0043      GET DESCRIPTOR          35.1.0        
   7.0  IN     09 02 43 00  02 01 00 80  ..C.....                35.2.0        
               00 09 04 00  00 02 0a 00  ........                35.2.8        
               00 00 07 05  81 02 00 02  ........                35.2.16       
               00 07 05 01  02 00 02 00  ........                35.2.24       
   7.0  CTL    00 09 0001 0000 0000      SET CONFIG              36.1.0        
   7.0  CTL    a1 21 0000 0001 0007      CLASS REQ 21            37.1.0        
   7.0  IN     00 00 00 00  00 00 08     .......                 37.2.0        
   7.0  CTL    21 22 0000 0001 0000      CLASS REQ 22            38.1.0        
   7    USTS   c0010000                  canceled                39.1.0(9)     
   7.0  CTL    23 03 0002 0002 0000      set feature             48.1.0        
   7    OUT    40 00 00 00               @...                    49.1.0        
   7.0  CTL    a3 00 0000 0006 0004      get status              50.1.0        
   7.0  IN     00 01 01 00               ....                    50.2.0        
   7.0  CTL    23 01 0010 0006 0000      clear feature           51.1.0        
   7.0  CTL    a3 00 0000 0006 0004      get status              52.1.0        
   7.0  IN     00 01 00 00               ....                    52.2.0        
   7    OUT    00 00 00 00               ....                    53.1.0        
   7.0  CTL    23 01 0002 0002 0000      clear feature           54.1.0        
   7    OUT    04 00 00 00               ....                    55.1.0        
   7.0  CTL    a3 00 0000 0002 0004      get status              56.1.0        
   7.0  IN     03 05 04 00               ....                    56.2.0        
   7.0  CTL    23 01 0012 0002 0000      clear feature           57.1.0        
   7.0  CTL    a3 00 0000 0002 0004      get status              58.1.0        
   7.0  IN     03 05 00 00               ....                    58.2.0        
   7    OUT    00 00 00 00               ....                    59.1.0        
   7.0  CTL    23 03 0002 0002 0000      set feature             60.1.0        
   7    OUT    40 00 00 00               @...                    61.1.0        
   7.0  CTL    a3 00 0000 0006 0004      get status              62.1.0        
   7.0  IN     01 01 01 00               ....                    62.2.0        
   7.0  CTL    23 01 0010 0006 0000      clear feature           63.1.0        
   7.0  CTL    a3 00 0000 0006 0004      get status              64.1.0        
   7.0  IN     01 01 00 00               ....                    64.2.0        
   7    OUT    00 00 00 00               ....                    65.1.0        
   7.0  CTL    23 03 0004 0006 0000      set feature             66.1.0        
   7    OUT    40 00 00 00               @...                    67.1.0        
   7.0  CTL    a3 00 0000 0006 0004      get status              68.1.0        
   7.0  IN     03 05 10 00               ....                    68.2.0        
   7.0  CTL    23 01 0014 0006 0000      clear feature           69.1.0        
   7.0  CTL    a3 00 0000 0006 0004      get status              70.1.0        
   7.0  IN     03 05 00 00               ....                    70.2.0        
   7    OUT    00 00 00 00               ....                    71.1.0        
   7.0  CTL    80 06 0100 0000 0040      GET DESCRIPTOR          72.1.0        
   7.0  IN     12 01 10 02  02 00 00 40  .......@                72.2.0        
               d9 22 06 00  00 01 01 02  ."......                72.2.8        
               00 01                     ..                      72.2.16       
   7.0  CTL    80 06 0100 0000 0012      GET DESCRIPTOR          73.1.0        
   7.0  IN     12 01 10 02  02 00 00 40  .......@                73.2.0        
               d9 22 06 00  00 01 01 02  ."......                73.2.8        
               00 01                     ..                      73.2.16       
   7.0  CTL    80 06 0200 0000 00ff      GET DESCRIPTOR          74.1.0        
   7.0  IN     09 02 43 00  02 01 03 c0  ..C.....                74.2.0        
               fa 09 04 00  00 01 02 02  ........                74.2.8        
               01 05 05 24  00 10 01 04  ...$....                74.2.16       
               24 02 0f 05  24 06 01 00  $...$...                74.2.24       
   7.0  CTL    80 06 0f00 0000 00ff      GET DESCRIPTOR          75.1.0        
   7.0  IN     05 0f 16 00  02 07 10 02  ........                75.2.0        
               02 00 00 00  0a 10 03 00  ........                75.2.8        
               0e 00 02 01  f4 01        ......                  75.2.16       
   7.0  CTL    80 06 0300 0000 00ff      GET DESCRIPTOR          76.1.0        
   7.0  IN     04 03 09 04               ....                    76.2.0        
   7.0  CTL    80 06 0302 0409 00ff      GET DESCRIPTOR          77.1.0        
   7.0  IN     20 03 4f 00  50 00 4c 00   .O.P.L.                77.2.0        
               55 00 53 00  20 00 50 00  U.S. .P.                77.2.8        
               72 00 65 00  6c 00 6f 00  r.e.l.o.                77.2.16       
               61 00 64 00  65 00 72 00  a.d.e.r.                77.2.24       
   7.0  CTL    23 01 0002 0002 0000      clear feature           78.1.0        
   7    OUT    04 00 00 00               ....                    79.1.0        
   7.0  CTL    a3 00 0000 0002 0004      get status              80.1.0        
   7.0  IN     03 05 04 00               ....                    80.2.0        
   7.0  CTL    23 01 0012 0002 0000      clear feature           81.1.0        
   7.0  CTL    a3 00 0000 0002 0004      get status              82.1.0        
   7.0  IN     03 05 00 00               ....                    82.2.0        
   7    OUT    00 00 00 00               ....                    83.1.0        
   7.0  CTL    00 09 0001 0000 0000      SET CONFIG              84.1.0        
   7.0  CTL    a1 21 0000 0000 0007      CLASS REQ 21            85.1.0        
   7.0  IN     00 10 0e 00  00 00 08     .......                 85.2.0        
   7.0  CTL    21 22 0000 0000 0000      CLASS REQ 22            86.1.0        
   7    USTS   c0010000                  canceled                87.1.0(9)     
   7.0  CTL    a1 21 0000 0000 0007      CLASS REQ 21            96.1.0(3)     
   7.0  IN     00 10 0e 00  00 00 08     .......                 96.2.0        
   7.0  CTL    a1 21 0000 0000 0007      CLASS REQ 21            99.1.0        
   7.0  CTL    23 03 0002 0002 0000      set feature            100.1.0        
   7.0  IN     00 10 0e 00  00 00 08     .......                 99.2.0        
   7.0  CTL    a1 21 0000 0000 0007      CLASS REQ 21           101.1.0        
   7.0  IN     00 10 0e 00  00 00 08     .......                101.2.0        
   7.0  CTL    21 20 0000 0000 0007      CLASS REQ 20           102.1.0        
   7.0  OUT    00 c2 01 00  00 00 08     .......                102.2.0        
   7    IN     52 45 41 44  59           READY                  103.1.0        
   7.0  CTL    21 22 0002 0000 0000      CLASS REQ 22           104.1.0        
   7    IN     52 45 41 44  59           READY                  105.1.0        
   7.0  CTL    21 22 0003 0000 0000      CLASS REQ 22           106.1.0        
   7    IN     52 45 41 44  59           READY                  107.1.0        
   7.0  CTL    a1 21 0000 0000 0007      CLASS REQ 21           108.1.0        
   7    IN     52 45 41 44  59           READY                  109.1.0        
   7.0  IN     00 10 0e 00  00 00 08     .......                108.2.0        
   7.0  CTL    21 20 0000 0000 0007      CLASS REQ 20           110.1.0        
   7    IN     52 45 41 44  59           READY                  111.1.0        
   7.0  OUT    00 10 0e 00  00 00 08     .......                110.2.0        
   7.0  CTL    21 23 0000 0000 0000      CLASS REQ 23           112.1.0        
   7    IN     52 45 41 44  59           READY                  113.1.0(2)     
   7.0  CTL    21 22 0003 0000 0000      CLASS REQ 22           114.1.0(2)     
   7    IN     52 45 41 44  59           READY                  117.1.0        
   7    OUT    a0                        .                      118.1.0        
  27    OUT    a0                        .                      119.1.0        
   7    IN     52 45 41 44  59           READY                  120.1.0        
  27    IN     52                        R                      121.1.0        
  27    IN     45 41 44 59               EADY                   122.1.0        
   7    OUT    a0                        .                      123.1.0        
  27    OUT    a0                        .                      124.1.0        
   7    IN     5f                        _                      125.1.0        
  27    IN     5f                        _                      126.1.0        
   7    OUT    0a                        .                      127.1.0        
  27    OUT    0a                        .                      128.1.0        
   7    IN     f5                        .                      129.1.0        
  27    IN     f5                        .                      130.1.0        
   7    OUT    50                        P                      131.1.0        
  27    OUT    50                        P                      132.1.0        
   7    IN     af                        .                      133.1.0        
  27    IN     af                        .                      134.1.0        
   7    OUT    05                        .                      135.1.0        
  27    OUT    05                        .                      136.1.0        
   7    IN     fa                        .                      137.1.0        
  27    IN     fa                        .                      138.1.0        
   7    OUT    fd                        .                      139.1.0        
  27    OUT    fd                        .                      140.1.0        
   7    IN     fd                        .                      141.1.0        
   7    IN     12 09                     ..                     142.1.0        
  27    IN     fd                        .                      143.1.0        
  27    IN     12 09                     ..                     144.1.0        
   7    IN     00 00                     ..                     145.1.0        
  27    IN     00 00                     ..                     146.1.0        
   7    OUT    fc                        .                      147.1.0        
  27    OUT    fc                        .                      148.1.0        
   7    IN     fc                        .                      149.1.0        
  27    IN     fc                        .                      150.1.0        
   7    IN     8a 00                     ..                     151.1.0        
  27    IN     8a 00                     ..                     152.1.0        
   7    IN     ca 01                     ..                     153.1.0        
  27    IN     ca 01                     ..                     154.1.0        
   7    IN     00 00                     ..                     155.1.0(2)     
  27    IN     00 00                     ..                     157.1.0(2)     
   7    OUT    e7                        .                      159.1.0        
  27    OUT    e7                        .                      160.1.0        
   7    IN     e7                        .                      161.1.0        
  27    IN     e7                        .                      162.1.0        
   7    IN     00 00 00 20               ...                    163.1.0        
   7    IN     87 8e 37 3f  a7 25 c2 90  ..7?.%..               164.1.0        
               fb 30 22 5c  7b 1c 10 6d  .0"\...m               164.1.8        
               9d ee a7 4c  65 da 55 5e  ...Le.U^               164.1.16       
               38 e0 09 5d  fb d0 bb 6c  8..]...l               164.1.24       
   7    IN     00 00                     ..                     165.1.0        
  27    IN     00 00 00 20               ...                    166.1.0        
  27    IN     87 8e 37 3f  a7 25 c2 90  ..7?.%..               167.1.0        
               fb 30 22 5c  7b 1c 10 6d  .0"\...m               167.1.8        
               9d ee a7 4c  65 da 55 5e  ...Le.U^               167.1.16       
               38 e0 09 5d  fb d0 bb 6c  8..]...l               167.1.24       
  27    IN     00 00                     ..                     168.1.0        
   7    OUT    fe                        .                      169.1.0        
  27    OUT    fe                        .                      170.1.0        
   7    IN     03                        .                      171.1.0        
  27    IN     03                        .                      172.1.0        
   7    OUT    fd                        .                      173.1.0        
  27    OUT    fd                        .                      174.1.0        
   7    IN     fd                        .                      175.1.0        
   7    IN     12 09                     ..                     176.1.0        
  27    IN     fd                        .                      177.1.0        
  27    IN     12 09                     ..                     178.1.0        
   7    IN     00 00                     ..                     179.1.0        
  27    IN     00 00                     ..                     180.1.0        
   7    OUT    fc                        .                      181.1.0        
  27    OUT    fc                        .                      182.1.0        
   7    IN     fc                        .                      183.1.0        
  27    IN     fc                        .                      184.1.0        
   7    IN     8a 00                     ..                     185.1.0        
   7    IN     ca 01                     ..                     186.1.0        
  27    IN     8a 00                     ..                     187.1.0        
  27    IN     ca 01                     ..                     188.1.0        
   7    IN     00 00                     ..                     189.1.0(2)     
  27    IN     00 00                     ..                     191.1.0(2)     
   7    OUT    e7                        .                      193.1.0        
  27    OUT    e7                        .                      194.1.0        
   7    IN     e7                        .                      195.1.0        
   7    IN     00 00 00 20               ...                    196.1.0        
  27    IN     e7                        .                      197.1.0        
  27    IN     00 00 00 20               ...                    198.1.0        
   7    IN     87 8e 37 3f  a7 25 c2 90  ..7?.%..               199.1.0        
               fb 30 22 5c  7b 1c 10 6d  .0"\...m               199.1.8        
               9d ee a7 4c  65 da 55 5e  ...Le.U^               199.1.16       
               38 e0 09 5d  fb d0 bb 6c  8..]...l               199.1.24       
  27    IN     87 8e 37 3f  a7 25 c2 90  ..7?.%..               200.1.0        
               fb 30 22 5c  7b 1c 10 6d  .0"\...m               200.1.8        
               9d ee a7 4c  65 da 55 5e  ...Le.U^               200.1.16       
               38 e0 09 5d  fb d0 bb 6c  8..]...l               200.1.24       
   7    IN     00 00                     ..                     201.1.0        
  27    IN     00 00                     ..                     202.1.0        
   7    OUT    d8                        .                      203.1.0        
  27    OUT    d8                        .                      204.1.0        
   7    IN     d8                        .                      205.1.0        
  27    IN     d8                        .                      206.1.0        
   7    IN     00 00 00 05               ....                   207.1.0        
   7    IN     00 00                     ..                     208.1.0        
  27    IN     00 00 00 05               ....                   209.1.0        
  27    IN     00 00                     ..                     210.1.0        
   7    OUT    fe                        .                      211.1.0        
  27    OUT    fe                        .                      212.1.0        
   7    IN     03                        .                      213.1.0        
  27    IN     03                        .                      214.1.0        
   7    OUT    fd                        .                      215.1.0        
  27    OUT    fd                        .                      216.1.0        
   7    IN     fd                        .                      217.1.0        
   7    IN     12 09                     ..                     218.1.0        
  27    IN     fd                        .                      219.1.0        
  27    IN     12 09                     ..                     220.1.0        
   7    IN     00 00                     ..                     221.1.0        
  27    IN     00 00                     ..                     222.1.0        
   7    OUT    fc                        .                      223.1.0        
  27    OUT    fc                        .                      224.1.0        
   7    IN     fc                        .                      225.1.0        
  27    IN     fc                        .                      226.1.0        
   7    IN     8a 00                     ..                     227.1.0        
   7    IN     ca 01                     ..                     228.1.0        
  27    IN     8a 00                     ..                     229.1.0        
   7    IN     00 00                     ..                     230.1.0        
  27    IN     ca 01                     ..                     231.1.0        
  27    IN     00 00                     ..                     232.1.0        
   7    IN     00 00                     ..                     233.1.0        
  27    IN     00 00                     ..                     234.1.0        
   7    OUT    e7                        .                      235.1.0        
  27    OUT    e7                        .                      236.1.0        
   7    IN     e7                        .                      237.1.0        
   7    IN     00 00 00 20               ...                    238.1.0        
   7    IN     87 8e 37 3f  a7 25 c2 90  ..7?.%..               239.1.0        
               fb 30 22 5c  7b 1c 10 6d  .0"\...m               239.1.8        
               9d ee a7 4c  65 da 55 5e  ...Le.U^               239.1.16       
               38 e0 09 5d  fb d0 bb 6c  8..]...l               239.1.24       
  27    IN     e7                        .                      240.1.0        
  27    IN     00 00 00 20               ...                    241.1.0        
  27    IN     87 8e 37 3f  a7 25 c2 90  ..7?.%..               242.1.0        
               fb 30 22 5c  7b 1c 10 6d  .0"\...m               242.1.8        
               9d ee a7 4c  65 da 55 5e  ...Le.U^               242.1.16       
               38 e0 09 5d  fb d0 bb 6c  8..]...l               242.1.24       
   7    IN     00 00                     ..                     243.1.0        
  27    IN     00 00                     ..                     244.1.0        
   7    OUT    d8                        .                      245.1.0        
  27    OUT    d8                        .                      246.1.0        
   7    IN     d8                        .                      247.1.0        
  27    IN     d8                        .                      248.1.0        
   7    IN     00 00 00 05               ....                   249.1.0        
  27    IN     00 00 00 05               ....                   250.1.0        
   7    IN     00 00                     ..                     251.1.0        
  27    IN     00 00                     ..                     252.1.0        
   7    OUT    fd                        .                      253.1.0        
  27    OUT    fd                        .                      254.1.0        
   7    IN     fd                        .                      255.1.0        
  27    IN     fd                        .                      256.1.0        
   7    IN     12 09                     ..                     257.1.0        
  27    IN     12 09                     ..                     258.1.0        
   7    IN     00 00                     ..                     259.1.0        
  27    IN     00 00                     ..                     260.1.0        
   7    OUT    fc                        .                      261.1.0        
  27    OUT    fc                        .                      262.1.0        
   7    IN     fc                        .                      263.1.0        
  27    IN     fc                        .                      264.1.0        
   7    IN     8a 00                     ..                     265.1.0        
   7    IN     ca 01                     ..                     266.1.0        
   7    IN     00 00                     ..                     267.1.0        
  27    IN     8a 00                     ..                     268.1.0        
  27    IN     ca 01                     ..                     269.1.0        
   7    IN     00 00                     ..                     270.1.0        
  27    IN     00 00                     ..                     271.1.0(2)     
   7    OUT    d7                        .                      273.1.0        
  27    OUT    d7                        .                      274.1.0        
   7    IN     d7                        .                      275.1.0        
  27    IN     d7                        .                      276.1.0        
   7    OUT    02 00 00 00               ....                   277.1.0        
  27    OUT    02 00 00 00               ....                   278.1.0        
   7    IN     02 00 00 00               ....                   279.1.0        
  27    IN     02 00 00 00               ....                   280.1.0        
   7    OUT    00 06 ab 7c               ....                   281.1.0        
  27    OUT    00 06 ab 7c               ....                   282.1.0        
   7    IN     00 06 ab 7c               ....                   283.1.0        
  27    IN     00 06 ab 7c               ....                   284.1.0        
   7    OUT    00 00 01 00               ....                   285.1.0        
  27    OUT    00 00 01 00               ....                   286.1.0        
   7    IN     00 00 01 00               ....                   287.1.0        
  27    IN     00 00 01 00               ....                   288.1.0        
   7    IN     00 00                     ..                     289.1.0        
  27    IN     00 00                     ..                     290.1.0        
   7    OUT    ff ff ff ea  00 00 0f e1  ........               291.1.0        
               c0 10 a0 e3  01 00 80 e1  ........               291.1.8        
               00 f0 2f e1  04 b0 a0 e1  ../.....               291.1.16       
               05 c0 a0 e1  24 00 4f e2  ....$.O.               291.1.24       
  27    OUT    ff ff ff ea  00 00 0f e1  ........               292.1.0        
               c0 10 a0 e3  01 00 80 e1  ........               292.1.8        
               00 f0 2f e1  04 b0 a0 e1  ../.....               292.1.16       
               05 c0 a0 e1  24 00 4f e2  ....$.O.               292.1.24       
   7    OUT                                                     293.1.0        
   7    OUT    00 8f 4f e3  7f 60 88 e3  ..O..`..               294.1.0        
               00 7d 40 e3  3c 10 89 e2  ..@.<...               294.1.8        
               04 00 a0 e1  07 20 a0 e1  ..... ..               294.1.16       
               06 30 a0 e1  e1 84 00 eb  .0......               294.1.24       
  27    OUT    00 8f 4f e3  7f 60 88 e3  ..O..`..               295.1.0        
               00 7d 40 e3  3c 10 89 e2  ..@.<...               295.1.8        
               04 00 a0 e1  07 20 a0 e1  ..... ..               295.1.16       
               06 30 a0 e1  e1 84 00 eb  .0......               295.1.24       
   7    OUT                                                     296.1.0        
   7    OUT    7a fd ff ea  01 ec 8d e2  z.......               297.1.0        
               5f 10 a0 e3  b0 01 de e1  _.......               297.1.8        
               01 ec 8d e2  90 01 00 e0  ........               297.1.16       
               1f 15 08 e3  eb 11 45 e3  ......E.               297.1.24       
  27    OUT    7a fd ff ea  01 ec 8d e2  z.......               298.1.0        
               5f 10 a0 e3  b0 01 de e1  _.......               298.1.8        
               01 ec 8d e2  90 01 00 e0  ........               298.1.16       
               1f 15 08 e3  eb 11 45 e3  ......E.               298.1.24       
   7    OUT                                                     299.1.0        
   7    OUT    58 80 80 e5  4f f0 7f f5  X...O...               300.1.0        
               90 80 80 e5  4f f0 7f f5  ....O...               300.1.8        
               98 20 80 e5  88 21 07 e3  . ...!..               300.1.16       
               60 22 42 e3  4f f0 7f f5  `"B.O...               300.1.24       
  27    OUT    58 80 80 e5  4f f0 7f f5  X...O...               301.1.0        
               90 80 80 e5  4f f0 7f f5  ....O...               301.1.8        
               98 20 80 e5  88 21 07 e3  . ...!..               301.1.16       
               60 22 42 e3  4f f0 7f f5  `"B.O...               301.1.24       
   7    OUT                                                     302.1.0        
   7    OUT    36 0a 00 eb  b4 00 dd e1  6.......               303.1.0        
               08 d0 4b e2  10 8c bd e8  ..K.....               303.1.8        
               30 48 2d e9  08 b0 8d e2  0H-.....               303.1.16       
               00 40 a0 e1  00 02 03 e3  .@......               303.1.24       
  27    OUT    36 0a 00 eb  b4 00 dd e1  6.......               304.1.0        
               08 d0 4b e2  10 8c bd e8  ..K.....               304.1.8        
               30 48 2d e9  08 b0 8d e2  0H-.....               304.1.16       
               00 40 a0 e1  00 02 03 e3  .@......               304.1.24       
   7    OUT                                                     305.1.0        
   7    OUT    84 00 86 e5  41 c9 fe eb  ....A...               306.1.0        
               02 00 50 e3  06 00 00 8a  ..P.....               306.1.8        
               80 20 96 e5  4b 0b 02 e3  . ..K...               306.1.16       
               84 30 96 e5  85 1b 02 e3  .0......               306.1.24       
  27    OUT    84 00 86 e5  41 c9 fe eb  ....A...               307.1.0        
               02 00 50 e3  06 00 00 8a  ..P.....               307.1.8        
               80 20 96 e5  4b 0b 02 e3  . ..K...               307.1.16       
               84 30 96 e5  85 1b 02 e3  .0......               307.1.24       
   7    OUT                                                     308.1.0        
   7    OUT    20 77 61 73  20 6e 6f 74   was not               309.1.0        
               20 63 6c 65  61 72 65 64   cleared               309.1.8        
               20 62 79 20  74 68 65 20   by the                309.1.16       
               64 65 76 69  63 65 0a 00  device..               309.1.24       
  27    OUT    20 77 61 73  20 6e 6f 74   was not               310.1.0        
               20 63 6c 65  61 72 65 64   cleared               310.1.8        
               20 62 79 20  74 68 65 20   by the                310.1.16       
               64 65 76 69  63 65 0a 00  device..               310.1.24       
   7    IN     f8 53                     .S                     311.1.0        
  27    IN     f8 53                     .S                     312.1.0        
   7    IN     00 00                     ..                     313.1.0        
  27    IN     00 00                     ..                     314.1.0        
   7    OUT    d5                        .                      315.1.0        
  27    OUT    d5                        .                      316.1.0        
   7    IN     d5                        .                      317.1.0        
  27    IN     d5                        .                      318.1.0        
   7    OUT    02 00 00 00               ....                   319.1.0        
  27    OUT    02 00 00 00               ....                   320.1.0        
   7    IN     02 00 00 00               ....                   321.1.0        
   7    IN     00 00                     ..                     322.1.0        
  27    IN     02 00 00 00               ....                   323.1.0        
  27    IN     00 00                     ..                     324.1.0        
   7    IN     ef ee ee fe  01 00 00 00  ........               325.1.0        
               66 00 00 00               f...                   325.1.8        
   7    IN     3c 3f 78 6d  6c 20 76 65  <?xml ve               326.1.0        
               72 73 69 6f  6e 3d 22 31  rsion="1               326.1.8        
               2e 30 22 20  65 6e 63 6f  .0" enco               326.1.16       
               64 69 6e 67  3d 22 75 74  ding="ut               326.1.24       
  27    IN     ef ee ee fe  01 00 00 00  ........               327.1.0        
               66 00 00 00               f...                   327.1.8        
  27    IN     3c 3f 78 6d  6c 20 76 65  <?xml ve               328.1.0        
               72 73 69 6f  6e 3d 22 31  rsion="1               328.1.8        
               2e 30 22 20  65 6e 63 6f  .0" enco               328.1.16       
               64 69 6e 67  3d 22 75 74  ding="ut               328.1.24       
   7    OUT    ef ee ee fe  01 00 00 00  ........               329.1.0        
               03 00 00 00               ....                   329.1.8        
  27    OUT    ef ee ee fe  01 00 00 00  ........               330.1.0        
               03 00 00 00               ....                   330.1.8        
   7    OUT    4f 4b 00                  OK.                    331.1.0        
  27    OUT    4f 4b 00                  OK.                    332.1.0        
   7    OUT    ef ee ee fe  01 00 00 00  ........               333.1.0        
               75 01 00 00               u...                   333.1.8        
  27    OUT    ef ee ee fe  01 00 00 00  ........               334.1.0        
               75 01 00 00               u...                   334.1.8        
   7    OUT    3c 3f 78 6d  6c 20 76 65  <?xml ve               335.1.0        
               72 73 69 6f  6e 3d 22 31  rsion="1               335.1.8        
               2e 30 22 20  65 6e 63 6f  .0" enco               335.1.16       
               64 69 6e 67  3d 22 75 74  ding="ut               335.1.24       
  27    OUT    3c 3f 78 6d  6c 20 76 65  <?xml ve               336.1.0        
               72 73 69 6f  6e 3d 22 31  rsion="1               336.1.8        
               2e 30 22 20  65 6e 63 6f  .0" enco               336.1.16       
               64 69 6e 67  3d 22 75 74  ding="ut               336.1.24       
   7    IN     ef ee ee fe  01 00 00 00  ........               337.1.0        
               03 00 00 00               ....                   337.1.8        
   7    IN     4f 4b 00                  OK.                    338.1.0        
  27    IN     ef ee ee fe  01 00 00 00  ........               339.1.0        
               03 00 00 00               ....                   339.1.8        
  27    IN     4f 4b 00                  OK.                    340.1.0        
   7    IN     ef ee ee fe  01 00 00 00  ........               341.1.0        
               95 00 00 00               ....                   341.1.8        
  27    IN     ef ee ee fe  01 00 00 00  ........               342.1.0        
               95 00 00 00               ....                   342.1.8        
   7    IN     3c 3f 78 6d  6c 20 76 65  <?xml ve               343.1.0        
               72 73 69 6f  6e 3d 22 31  rsion="1               343.1.8        
               2e 30 22 20  65 6e 63 6f  .0" enco               343.1.16       
               64 69 6e 67  3d 22 75 74  ding="ut               343.1.24       
  27    IN     3c 3f 78 6d  6c 20 76 65  <?xml ve               344.1.0        
               72 73 69 6f  6e 3d 22 31  rsion="1               344.1.8        
               2e 30 22 20  65 6e 63 6f  .0" enco               344.1.16       
               64 69 6e 67  3d 22 75 74  ding="ut               344.1.24       
   7    OUT    ef ee ee fe  01 00 00 00  ........               345.1.0        
               03 00 00 00               ....                   345.1.8        
  27    OUT    ef ee ee fe  01 00 00 00  ........               346.1.0        
               03 00 00 00               ....                   346.1.8        
   7    OUT    4f 4b 00                  OK.                    347.1.0        
  27    OUT    4f 4b 00                  OK.                    348.1.0        
   7    IN     ef ee ee fe  01 00 00 00  ........               349.1.0        
               66 00 00 00               f...                   349.1.8        
  27    IN     ef ee ee fe  01 00 00 00  ........               350.1.0        
               66 00 00 00               f...                   350.1.8        
   7    IN     3c 3f 78 6d  6c 20 76 65  <?xml ve               351.1.0        
               72 73 69 6f  6e 3d 22 31  rsion="1               351.1.8        
               2e 30 22 20  65 6e 63 6f  .0" enco               351.1.16       
               64 69 6e 67  3d 22 75 74  ding="ut               351.1.24       
  27    IN     3c 3f 78 6d  6c 20 76 65  <?xml ve               352.1.0        
               72 73 69 6f  6e 3d 22 31  rsion="1               352.1.8        
               2e 30 22 20  65 6e 63 6f  .0" enco               352.1.16       
               64 69 6e 67  3d 22 75 74  ding="ut               352.1.24       
   7    OUT    ef ee ee fe  01 00 00 00  ........               353.1.0        
               03 00 00 00               ....                   353.1.8        
  27    OUT    ef ee ee fe  01 00 00 00  ........               354.1.0        
               03 00 00 00               ....                   354.1.8        
   7    OUT    4f 4b 00                  OK.                    355.1.0        
  27    OUT    4f 4b 00                  OK.                    356.1.0        
   7    OUT    ef ee ee fe  01 00 00 00  ........               357.1.0        
               21 01 00 00               !...                   357.1.8        
  27    OUT    ef ee ee fe  01 00 00 00  ........               358.1.0        
               21 01 00 00               !...                   358.1.8        
   7    OUT    3c 3f 78 6d  6c 20 76 65  <?xml ve               359.1.0        
               72 73 69 6f  6e 3d 22 31  rsion="1               359.1.8        
               2e 30 22 20  65 6e 63 6f  .0" enco               359.1.16       
               64 69 6e 67  3d 22 75 74  ding="ut               359.1.24       
  27    OUT    3c 3f 78 6d  6c 20 76 65  <?xml ve               360.1.0        
               72 73 69 6f  6e 3d 22 31  rsion="1               360.1.8        
               2e 30 22 20  65 6e 63 6f  .0" enco               360.1.16       
               64 69 6e 67  3d 22 75 74  ding="ut               360.1.24       
   7    IN     ef ee ee fe  01 00 00 00  ........               361.1.0        
               03 00 00 00               ....                   361.1.8        
   7    IN     4f 4b 00                  OK.                    362.1.0        
  27    IN     ef ee ee fe  01 00 00 00  ........               363.1.0        
               03 00 00 00               ....                   363.1.8        
  27    IN     4f 4b 00                  OK.                    364.1.0        
   7    IN     ef ee ee fe  01 00 00 00  ........               365.1.0        
               95 00 00 00               ....                   365.1.8        
  27    IN     ef ee ee fe  01 00 00 00  ........               366.1.0        
               95 00 00 00               ....                   366.1.8        
   7    IN     3c 3f 78 6d  6c 20 76 65  <?xml ve               367.1.0        
               72 73 69 6f  6e 3d 22 31  rsion="1               367.1.8        
               2e 30 22 20  65 6e 63 6f  .0" enco               367.1.16       
               64 69 6e 67  3d 22 75 74  ding="ut               367.1.24       
  27    IN     3c 3f 78 6d  6c 20 76 65  <?xml ve               368.1.0        
               72 73 69 6f  6e 3d 22 31  rsion="1               368.1.8        
               2e 30 22 20  65 6e 63 6f  .0" enco               368.1.16       
               64 69 6e 67  3d 22 75 74  ding="ut               368.1.24       
   7    OUT    ef ee ee fe  01 00 00 00  ........               369.1.0        
               03 00 00 00               ....                   369.1.8        
  27    OUT    ef ee ee fe  01 00 00 00  ........               370.1.0        
               03 00 00 00               ....                   370.1.8        
   7    OUT    4f 4b 00                  OK.                    371.1.0        
  27    OUT    4f 4b 00                  OK.                    372.1.0        
   7    IN     ef ee ee fe  01 00 00 00  ........               373.1.0        
               66 00 00 00               f...                   373.1.8        
  27    IN     ef ee ee fe  01 00 00 00  ........               374.1.0        
               66 00 00 00               f...                   374.1.8        
   7    IN     3c 3f 78 6d  6c 20 76 65  <?xml ve               375.1.0        
               72 73 69 6f  6e 3d 22 31  rsion="1               375.1.8        
               2e 30 22 20  65 6e 63 6f  .0" enco               375.1.16       
               64 69 6e 67  3d 22 75 74  ding="ut               375.1.24       
  27    IN     3c 3f 78 6d  6c 20 76 65  <?xml ve               376.1.0        
               72 73 69 6f  6e 3d 22 31  rsion="1               376.1.8        
               2e 30 22 20  65 6e 63 6f  .0" enco               376.1.16       
               64 69 6e 67  3d 22 75 74  ding="ut               376.1.24       
   7    OUT    ef ee ee fe  01 00 00 00  ........               377.1.0        
               03 00 00 00               ....                   377.1.8        
  27    OUT    ef ee ee fe  01 00 00 00  ........               378.1.0        
               03 00 00 00               ....                   378.1.8        
   7    OUT    4f 4b 00                  OK.                    379.1.0        
  27    OUT    4f 4b 00                  OK.                    380.1.0        
   7    OUT    ef ee ee fe  01 00 00 00  ........               381.1.0        
               76 00 00 00               v...                   381.1.8        
  27    OUT    ef ee ee fe  01 00 00 00  ........               382.1.0        
               76 00 00 00               v...                   382.1.8        
   7    OUT    3c 3f 78 6d  6c 20 76 65  <?xml ve               383.1.0        
               72 73 69 6f  6e 3d 22 31  rsion="1               383.1.8        
               2e 30 22 20  65 6e 63 6f  .0" enco               383.1.16       
               64 69 6e 67  3d 22 75 74  ding="ut               383.1.24       
  27    OUT    3c 3f 78 6d  6c 20 76 65  <?xml ve               384.1.0        
               72 73 69 6f  6e 3d 22 31  rsion="1               384.1.8        
               2e 30 22 20  65 6e 63 6f  .0" enco               384.1.16       
               64 69 6e 67  3d 22 75 74  ding="ut               384.1.24       
   7    IN     ef ee ee fe  01 00 00 00  ........               385.1.0        
               03 00 00 00               ....                   385.1.8        
   7    IN     4f 4b 00                  OK.                    386.1.0        
  27    IN     ef ee ee fe  01 00 00 00  ........               387.1.0        
               03 00 00 00               ....                   387.1.8        
  27    IN     4f 4b 00                  OK.                    388.1.0        
   7    IN     ef ee ee fe  01 00 00 00  ........               389.1.0        
               95 00 00 00               ....                   389.1.8        
  27    IN     ef ee ee fe  01 00 00 00  ........               390.1.0        
               95 00 00 00               ....                   390.1.8        
   7    IN     3c 3f 78 6d  6c 20 76 65  <?xml ve               391.1.0        
               72 73 69 6f  6e 3d 22 31  rsion="1               391.1.8        
               2e 30 22 20  65 6e 63 6f  .0" enco               391.1.16       
               64 69 6e 67  3d 22 75 74  ding="ut               391.1.24       
  27    IN     3c 3f 78 6d  6c 20 76 65  <?xml ve               392.1.0        
               72 73 69 6f  6e 3d 22 31  rsion="1               392.1.8        
               2e 30 22 20  65 6e 63 6f  .0" enco               392.1.16       
               64 69 6e 67  3d 22 75 74  ding="ut               392.1.24       
   7    OUT    ef ee ee fe  01 00 00 00  ........               393.1.0        
               03 00 00 00               ....                   393.1.8        
  27    OUT    ef ee ee fe  01 00 00 00  ........               394.1.0        
               03 00 00 00               ....                   394.1.8        
   7    OUT    4f 4b 00                  OK.                    395.1.0        
  27    OUT    4f 4b 00                  OK.                    396.1.0        
   7    IN     ef ee ee fe  01 00 00 00  ........               397.1.0        
               07 00 00 00               ....                   397.1.8        
   7    IN     4f 4b 21 45  4f 54 00     OK!EOT.                398.1.0        
  27    IN     ef ee ee fe  01 00 00 00  ........               399.1.0        
               07 00 00 00               ....                   399.1.8        
  27    IN     4f 4b 21 45  4f 54 00     OK!EOT.                400.1.0        
   7    OUT    ef ee ee fe  01 00 00 00  ........               401.1.0        
               03 00 00 00               ....                   401.1.8        
  27    OUT    ef ee ee fe  01 00 00 00  ........               402.1.0        
               03 00 00 00               ....                   402.1.8        
   7    OUT    4f 4b 00                  OK.                    403.1.0        
  27    OUT    4f 4b 00                  OK.                    404.1.0        
   7    IN     ef ee ee fe  01 00 00 00  ........               405.1.0        
               95 00 00 00               ....                   405.1.8        
  27    IN     ef ee ee fe  01 00 00 00  ........               406.1.0        
               95 00 00 00               ....                   406.1.8        
   7    IN     3c 3f 78 6d  6c 20 76 65  <?xml ve               407.1.0        
               72 73 69 6f  6e 3d 22 31  rsion="1               407.1.8        
               2e 30 22 20  65 6e 63 6f  .0" enco               407.1.16       
               64 69 6e 67  3d 22 75 74  ding="ut               407.1.24       
  27    IN     3c 3f 78 6d  6c 20 76 65  <?xml ve               408.1.0        
               72 73 69 6f  6e 3d 22 31  rsion="1               408.1.8        
               2e 30 22 20  65 6e 63 6f  .0" enco               408.1.16       
               64 69 6e 67  3d 22 75 74  ding="ut               408.1.24       
   7    OUT    ef ee ee fe  01 00 00 00  ........               409.1.0        
               03 00 00 00               ....                   409.1.8        
  27    OUT    ef ee ee fe  01 00 00 00  ........               410.1.0        
               03 00 00 00               ....                   410.1.8        
   7    OUT    4f 4b 00                  OK.                    411.1.0        
  27    OUT    4f 4b 00                  OK.                    412.1.0        
   7    IN     ef ee ee fe  01 00 00 00  ........               413.1.0        
               66 00 00 00               f...                   413.1.8        
  27    IN     ef ee ee fe  01 00 00 00  ........               414.1.0        
               66 00 00 00               f...                   414.1.8        
   7    IN     3c 3f 78 6d  6c 20 76 65  <?xml ve               415.1.0        
               72 73 69 6f  6e 3d 22 31  rsion="1               415.1.8        
               2e 30 22 20  65 6e 63 6f  .0" enco               415.1.16       
               64 69 6e 67  3d 22 75 74  ding="ut               415.1.24       
  27    IN     3c 3f 78 6d  6c 20 76 65  <?xml ve               416.1.0        
               72 73 69 6f  6e 3d 22 31  rsion="1               416.1.8        
               2e 30 22 20  65 6e 63 6f  .0" enco               416.1.16       
               64 69 6e 67  3d 22 75 74  ding="ut               416.1.24       
   7    OUT    ef ee ee fe  01 00 00 00  ........               417.1.0        
               03 00 00 00               ....                   417.1.8        
  27    OUT    ef ee ee fe  01 00 00 00  ........               418.1.0        
               03 00 00 00               ....                   418.1.8        
   7    OUT    4f 4b 00                  OK.                    419.1.0        
  27    OUT    4f 4b 00                  OK.                    420.1.0        
   7    OUT    ef ee ee fe  01 00 00 00  ........               421.1.0        
               91 00 00 00               ....                   421.1.8        
  27    OUT    ef ee ee fe  01 00 00 00  ........               422.1.0        
               91 00 00 00               ....                   422.1.8        
   7    OUT    3c 3f 78 6d  6c 20 76 65  <?xml ve               423.1.0        
               72 73 69 6f  6e 3d 22 31  rsion="1               423.1.8        
               2e 30 22 20  65 6e 63 6f  .0" enco               423.1.16       
               64 69 6e 67  3d 22 75 74  ding="ut               423.1.24       
  27    OUT    3c 3f 78 6d  6c 20 76 65  <?xml ve               424.1.0        
               72 73 69 6f  6e 3d 22 31  rsion="1               424.1.8        
               2e 30 22 20  65 6e 63 6f  .0" enco               424.1.16       
               64 69 6e 67  3d 22 75 74  ding="ut               424.1.24       
   7    IN     ef ee ee fe  01 00 00 00  ........               425.1.0        
               03 00 00 00               ....                   425.1.8        
   7    IN     4f 4b 00                  OK.                    426.1.0        
  27    IN     ef ee ee fe  01 00 00 00  ........               427.1.0        
               03 00 00 00               ....                   427.1.8        
  27    IN     4f 4b 00                  OK.                    428.1.0        
   7    IN     ef ee ee fe  01 00 00 00  ........               429.1.0        
               95 00 00 00               ....                   429.1.8        
  27    IN     ef ee ee fe  01 00 00 00  ........               430.1.0        
               95 00 00 00               ....                   430.1.8        
   7    IN     3c 3f 78 6d  6c 20 76 65  <?xml ve               431.1.0        
               72 73 69 6f  6e 3d 22 31  rsion="1               431.1.8        
               2e 30 22 20  65 6e 63 6f  .0" enco               431.1.16       
               64 69 6e 67  3d 22 75 74  ding="ut               431.1.24       
  27    IN     3c 3f 78 6d  6c 20 76 65  <?xml ve               432.1.0        
               72 73 69 6f  6e 3d 22 31  rsion="1               432.1.8        
               2e 30 22 20  65 6e 63 6f  .0" enco               432.1.16       
               64 69 6e 67  3d 22 75 74  ding="ut               432.1.24       
   7    OUT    ef ee ee fe  01 00 00 00  ........               433.1.0        
               03 00 00 00               ....                   433.1.8        
  27    OUT    ef ee ee fe  01 00 00 00  ........               434.1.0        
               03 00 00 00               ....                   434.1.8        
   7    OUT    4f 4b 00                  OK.                    435.1.0        
  27    OUT    4f 4b 00                  OK.                    436.1.0        
   7    IN     ef ee ee fe  01 00 00 00  ........               437.1.0        
               66 00 00 00               f...                   437.1.8        
  27    IN     ef ee ee fe  01 00 00 00  ........               438.1.0        
               66 00 00 00               f...                   438.1.8        
   7    IN     3c 3f 78 6d  6c 20 76 65  <?xml ve               439.1.0        
               72 73 69 6f  6e 3d 22 31  rsion="1               439.1.8        
               2e 30 22 20  65 6e 63 6f  .0" enco               439.1.16       
               64 69 6e 67  3d 22 75 74  ding="ut               439.1.24       
  27    IN     3c 3f 78 6d  6c 20 76 65  <?xml ve               440.1.0        
               72 73 69 6f  6e 3d 22 31  rsion="1               440.1.8        
               2e 30 22 20  65 6e 63 6f  .0" enco               440.1.16       
               64 69 6e 67  3d 22 75 74  ding="ut               440.1.24       
   7    OUT    ef ee ee fe  01 00 00 00  ........               441.1.0        
               03 00 00 00               ....                   441.1.8        
  27    OUT    ef ee ee fe  01 00 00 00  ........               442.1.0        
               03 00 00 00               ....                   442.1.8        
   7    OUT    4f 4b 00                  OK.                    443.1.0        
  27    OUT    4f 4b 00                  OK.                    444.1.0        
   7    OUT    ef ee ee fe  01 00 00 00  ........               445.1.0        
               eb 00 00 00               ....                   445.1.8        
  27    OUT    ef ee ee fe  01 00 00 00  ........               446.1.0        
               eb 00 00 00               ....                   446.1.8        
   7    OUT    3c 3f 78 6d  6c 20 76 65  <?xml ve               447.1.0        
               72 73 69 6f  6e 3d 22 31  rsion="1               447.1.8        
               2e 30 22 20  65 6e 63 6f  .0" enco               447.1.16       
               64 69 6e 67  3d 22 75 74  ding="ut               447.1.24       
  27    OUT    3c 3f 78 6d  6c 20 76 65  <?xml ve               448.1.0        
               72 73 69 6f  6e 3d 22 31  rsion="1               448.1.8        
               2e 30 22 20  65 6e 63 6f  .0" enco               448.1.16       
               64 69 6e 67  3d 22 75 74  ding="ut               448.1.24       
   7    IN     ef ee ee fe  01 00 00 00  ........               449.1.0        
               03 00 00 00               ....                   449.1.8        
  27    IN     ef ee ee fe  01 00 00 00  ........               450.1.0        
               03 00 00 00               ....                   450.1.8        
   7    IN     4f 4b 00                  OK.                    451.1.0        
  27    IN     4f 4b 00                  OK.                    452.1.0        
   7    IN     ef ee ee fe  01 00 00 00  ........               453.1.0        
               00 01 00 00               ....                   453.1.8        
  27    IN     ef ee ee fe  01 00 00 00  ........               454.1.0        
               00 01 00 00               ....                   454.1.8        
   7    IN     3c 3f 78 6d  6c 20 76 65  <?xml ve               455.1.0        
               72 73 69 6f  6e 3d 22 31  rsion="1               455.1.8        
               2e 30 22 20  65 6e 63 6f  .0" enco               455.1.16       
               64 69 6e 67  3d 22 75 74  ding="ut               455.1.24       
  27    IN     3c 3f 78 6d  6c 20 76 65  <?xml ve               456.1.0        
               72 73 69 6f  6e 3d 22 31  rsion="1               456.1.8        
               2e 30 22 20  65 6e 63 6f  .0" enco               456.1.16       
               64 69 6e 67  3d 22 75 74  ding="ut               456.1.24       
   7    OUT    ef ee ee fe  01 00 00 00  ........               457.1.0        
               03 00 00 00               ....                   457.1.8        
  27    OUT    ef ee ee fe  01 00 00 00  ........               458.1.0        
               03 00 00 00               ....                   458.1.8        
   7    OUT    4f 4b 00                  OK.                    459.1.0        
  27    OUT    4f 4b 00                  OK.                    460.1.0        
   7    OUT    ef ee ee fe  01 00 00 00  ........               461.1.0        
               0b 00 00 00               ....                   461.1.8        
  27    OUT    ef ee ee fe  01 00 00 00  ........               462.1.0        
               0b 00 00 00               ....                   462.1.8        
   7    OUT    4f 4b 40 30  78 35 63 36  OK@0x5c6               463.1.0        
               31 30 00                  10.                    463.1.8        
  27    OUT    4f 4b 40 30  78 35 63 36  OK@0x5c6               464.1.0        
               31 30 00                  10.                    464.1.8        
   7    IN     ef ee ee fe  01 00 00 00  ........               465.1.0        
               03 00 00 00               ....                   465.1.8        
   7    IN     4f 4b 00                  OK.                    466.1.0        
  27    IN     ef ee ee fe  01 00 00 00  ........               467.1.0        
               03 00 00 00               ....                   467.1.8        
  27    IN     4f 4b 00                  OK.                    468.1.0        
   7    OUT    ef ee ee fe  01 00 00 00  ........               469.1.0        
               0e 00 00 00               ....                   469.1.8        
  27    OUT    ef ee ee fe  01 00 00 00  ........               470.1.0        
               0e 00 00 00               ....                   470.1.8        
   7    OUT    4f 4b 40 30  78 37 33 38  OK@0x738               471.1.0        
               64 38 62 62  66 00        d8bbf.                 471.1.8        
  27    OUT    4f 4b 40 30  78 37 33 38  OK@0x738               472.1.0        
               64 38 62 62  66 00        d8bbf.                 472.1.8        
   7    IN     ef ee ee fe  01 00 00 00  ........               473.1.0        
               03 00 00 00               ....                   473.1.8        
   7    IN     4f 4b 00                  OK.                    474.1.0        
  27    IN     ef ee ee fe  01 00 00 00  ........               475.1.0        
               03 00 00 00               ....                   475.1.8        
  27    IN     4f 4b 00                  OK.                    476.1.0        
   7    OUT    ef ee ee fe  01 00 00 00  ........               477.1.0        
               00 10 00 00               ....                   477.1.8        
  27    OUT    ef ee ee fe  01 00 00 00  ........               478.1.0        
               00 10 00 00               ....                   478.1.8        
   7    OUT    07 00 00 ea  74 01 00 ea  ....t...               479.1.0        
               7a 01 00 ea  80 01 00 ea  z.......               479.1.8        
               86 01 00 ea  8c 01 00 ea  ........               479.1.16       
               8c 01 00 ea  a3 01 00 ea  ........               479.1.24       
  27    OUT    07 00 00 ea  74 01 00 ea  ....t...               480.1.0        
               7a 01 00 ea  80 01 00 ea  z.......               480.1.8        
               86 01 00 ea  8c 01 00 ea  ........               480.1.16       
               8c 01 00 ea  a3 01 00 ea  ........               480.1.24       
   7    OUT                                                     481.1.0        
   7    IN     ef ee ee fe  01 00 00 00  ........               482.1.0        
               03 00 00 00               ....                   482.1.8        
   7    IN     4f 4b 00                  OK.                    483.1.0        
  27    IN     ef ee ee fe  01 00 00 00  ........               484.1.0        
               03 00 00 00               ....                   484.1.8        
  27    IN     4f 4b 00                  OK.                    485.1.0        
   7    OUT    ef ee ee fe  01 00 00 00  ........               486.1.0        
               0e 00 00 00               ....                   486.1.8        
  27    OUT    ef ee ee fe  01 00 00 00  ........               487.1.0        
               0e 00 00 00               ....                   487.1.8        
   7    OUT    4f 4b 40 30  78 31 31 63  OK@0x11c               488.1.0        
               31 38 30 65  39 00        180e9.                 488.1.8        
  27    OUT    4f 4b 40 30  78 31 31 63  OK@0x11c               489.1.0        
               31 38 30 65  39 00        180e9.                 489.1.8        
   7    IN     ef ee ee fe  01 00 00 00  ........               490.1.0        
               03 00 00 00               ....                   490.1.8        
  27    IN     ef ee ee fe  01 00 00 00  ........               491.1.0        
               03 00 00 00               ....                   491.1.8        
   7    IN     4f 4b 00                  OK.                    492.1.0        
  27    IN     4f 4b 00                  OK.                    493.1.0        
   7    OUT    ef ee ee fe  01 00 00 00  ........               494.1.0        
               00 10 00 00               ....                   494.1.8        
  27    OUT    ef ee ee fe  01 00 00 00  ........               495.1.0        
               00 10 00 00               ....                   495.1.8        
   7    OUT    05 00 44 e3  00 00 90 e5  ..D.....               496.1.0        
               00 00 50 e3  1e ff 2f 01  ..P.../.               496.1.8        
               08 00 80 e2  58 20 a0 e3  ....X ..               496.1.16       
               33 2b 00 ea  e0 06 0e e3  3+......               496.1.24       
  27    OUT    05 00 44 e3  00 00 90 e5  ..D.....               497.1.0        
               00 00 50 e3  1e ff 2f 01  ..P.../.               497.1.8        
               08 00 80 e2  58 20 a0 e3  ....X ..               497.1.16       
               33 2b 00 ea  e0 06 0e e3  3+......               497.1.24       
   7    IN     ef ee ee fe  01 00 00 00  ........               498.1.0        
               03 00 00 00               ....                   498.1.8        
  27    IN     ef ee ee fe  01 00 00 00  ........               499.1.0        
               03 00 00 00               ....                   499.1.8        
   7    IN     4f 4b 00                  OK.                    500.1.0        
   7    OUT                                                     501.1.0        
  27    IN     4f 4b 00                  OK.                    502.1.0        
   7    OUT    ef ee ee fe  01 00 00 00  ........               503.1.0        
               0e 00 00 00               ....                   503.1.8        
  27    OUT    ef ee ee fe  01 00 00 00  ........               504.1.0        
               0e 00 00 00               ....                   504.1.8        
   7    OUT    4f 4b 40 30  78 65 36 66  OK@0xe6f               505.1.0        
               32 32 38 36  36 00        22866.                 505.1.8        
  27    OUT    4f 4b 40 30  78 65 36 66  OK@0xe6f               506.1.0        
               32 32 38 36  36 00        22866.                 506.1.8        
   7    IN     ef ee ee fe  01 00 00 00  ........               507.1.0        
               03 00 00 00               ....                   507.1.8        
   7    IN     4f 4b 00                  OK.                    508.1.0        
  27    IN     ef ee ee fe  01 00 00 00  ........               509.1.0        
               03 00 00 00               ....                   509.1.8        
  27    IN     4f 4b 00                  OK.                    510.1.0        
   7    OUT    ef ee ee fe  01 00 00 00  ........               511.1.0        
               00 10 00 00               ....                   511.1.8        
  27    OUT    ef ee ee fe  01 00 00 00  ........               512.1.0        
               00 10 00 00               ....                   512.1.8        
   7    OUT    10 50 9d e5  06 00 a0 e1  .P......               513.1.0        
               07 10 a0 e1  40 20 a0 e3  ....@ ..               513.1.8        
               33 28 00 eb  00 00 50 e3  3(....P.               513.1.16       
               03 00 00 0a  58 60 86 e2  ....X`..               513.1.24       
  27    OUT    10 50 9d e5  06 00 a0 e1  .P......               514.1.0        
               07 10 a0 e1  40 20 a0 e3  ....@ ..               514.1.8        
               33 28 00 eb  00 00 50 e3  3(....P.               514.1.16       
               03 00 00 0a  58 60 86 e2  ....X`..               514.1.24       
   7    OUT                                                     515.1.0        
   7    IN     ef ee ee fe  01 00 00 00  ........               516.1.0        
               03 00 00 00               ....                   516.1.8        
   7    IN     4f 4b 00                  OK.                    517.1.0        
  27    IN     ef ee ee fe  01 00 00 00  ........               518.1.0        
               03 00 00 00               ....                   518.1.8        
  27    IN     4f 4b 00                  OK.                    519.1.0        
   7    OUT    ef ee ee fe  01 00 00 00  ........               520.1.0        
               0e 00 00 00               ....                   520.1.8        
  27    OUT    ef ee ee fe  01 00 00 00  ........               521.1.0        
               0e 00 00 00               ....                   521.1.8        
   7    OUT    4f 4b 40 30  78 36 30 34  OK@0x604               522.1.0        
               66 65 61 32  63 00        fea2c.                 522.1.8        
  27    OUT    4f 4b 40 30  78 36 30 34  OK@0x604               523.1.0        
               66 65 61 32  63 00        fea2c.                 523.1.8        
   7    IN     ef ee ee fe  01 00 00 00  ........               524.1.0        
               03 00 00 00               ....                   524.1.8        
   7    IN     4f 4b 00                  OK.                    525.1.0        
  27    IN     ef ee ee fe  01 00 00 00  ........               526.1.0        
               03 00 00 00               ....                   526.1.8        
  27    IN     4f 4b 00                  OK.                    527.1.0        
   7    OUT    ef ee ee fe  01 00 00 00  ........               528.1.0        
               00 10 00 00               ....                   528.1.8        
  27    OUT    ef ee ee fe  01 00 00 00  ........               529.1.0        
               00 10 00 00               ....                   529.1.8        
   7    OUT    7c 14 00 eb  0a 60 a0 e1  .....`..               530.1.0        
               28 30 8d e2  05 00 a0 e1  (0......               530.1.8        
               01 10 a0 e3  06 20 a0 e1  ..... ..               530.1.16       
               69 a6 00 eb  01 00 70 e3  i.....p.               530.1.24       
  27    OUT    7c 14 00 eb  0a 60 a0 e1  .....`..               531.1.0        
               28 30 8d e2  05 00 a0 e1  (0......               531.1.8        
               01 10 a0 e3  06 20 a0 e1  ..... ..               531.1.16       
               69 a6 00 eb  01 00 70 e3  i.....p.               531.1.24       
   7    OUT                                                     532.1.0        
   7    IN     ef ee ee fe  01 00 00 00  ........               533.1.0        
               03 00 00 00               ....                   533.1.8        
  27    IN     ef ee ee fe  01 00 00 00  ........               534.1.0        
               03 00 00 00               ....                   534.1.8        
   7    IN     4f 4b 00                  OK.                    535.1.0        
  27    IN     4f 4b 00                  OK.                    536.1.0        
   7    OUT    ef ee ee fe  01 00 00 00  ........               537.1.0        
               0e 00 00 00               ....                   537.1.8        
  27    OUT    ef ee ee fe  01 00 00 00  ........               538.1.0        
               0e 00 00 00               ....                   538.1.8        
   7    OUT    4f 4b 40 30  78 65 62 37  OK@0xeb7               539.1.0        
               30 31 33 64  31 00        013d1.                 539.1.8        
  27    OUT    4f 4b 40 30  78 65 62 37  OK@0xeb7               540.1.0        
               30 31 33 64  31 00        013d1.                 540.1.8        
   7    IN     ef ee ee fe  01 00 00 00  ........               541.1.0        
               03 00 00 00               ....                   541.1.8        
   7    IN     4f 4b 00                  OK.                    542.1.0        
  27    IN     ef ee ee fe  01 00 00 00  ........               543.1.0        
               03 00 00 00               ....                   543.1.8        
  27    IN     4f 4b 00                  OK.                    544.1.0        
   7    OUT    ef ee ee fe  01 00 00 00  ........               545.1.0        
               00 10 00 00               ....                   545.1.8        
  27    OUT    ef ee ee fe  01 00 00 00  ........               546.1.0        
               00 10 00 00               ....                   546.1.8        
   7    OUT    fc 00 00 0a  b4 1e 04 e3  ........               547.1.0        
               00 40 a0 e1  04 10 44 e3  .@....D.               547.1.8        
               06 00 a0 e1  15 f8 ff eb  ........               547.1.16       
               00 00 50 e3  3c 00 8d e5  ..P.<...               547.1.24       
  27    OUT    fc 00 00 0a  b4 1e 04 e3  ........               548.1.0        
               00 40 a0 e1  04 10 44 e3  .@....D.               548.1.8        
               06 00 a0 e1  15 f8 ff eb  ........               548.1.16       
               00 00 50 e3  3c 00 8d e5  ..P.<...               548.1.24       
   7    OUT                                                     549.1.0        
   7    IN     ef ee ee fe  01 00 00 00  ........               550.1.0        
               03 00 00 00               ....                   550.1.8        
  27    IN     ef ee ee fe  01 00 00 00  ........               551.1.0        
               03 00 00 00               ....                   551.1.8        
   7    IN     4f 4b 00                  OK.                    552.1.0        
  27    IN     4f 4b 00                  OK.                    553.1.0        
   7    OUT    ef ee ee fe  01 00 00 00  ........               554.1.0        
               0e 00 00 00               ....                   554.1.8        
  27    OUT    ef ee ee fe  01 00 00 00  ........               555.1.0        
               0e 00 00 00               ....                   555.1.8        
   7    OUT    4f 4b 40 30  78 64 38 32  OK@0xd82               556.1.0        
               38 37 63 64  31 00        87cd1.                 556.1.8        
  27    OUT    4f 4b 40 30  78 64 38 32  OK@0xd82               557.1.0        
               38 37 63 64  31 00        87cd1.                 557.1.8        
   7    IN     ef ee ee fe  01 00 00 00  ........               558.1.0        
               03 00 00 00               ....                   558.1.8        
  27    IN     ef ee ee fe  01 00 00 00  ........               559.1.0        
               03 00 00 00               ....                   559.1.8        
   7    IN     4f 4b 00                  OK.                    560.1.0        
  27    IN     4f 4b 00                  OK.                    561.1.0        
   7    OUT    ef ee ee fe  01 00 00 00  ........               562.1.0        
               00 10 00 00               ....                   562.1.8        
  27    OUT    ef ee ee fe  01 00 00 00  ........               563.1.0        
               00 10 00 00               ....                   563.1.8        
   7    OUT    00 20 44 e3  04 10 a0 e1  . D.....               564.1.0        
               1a 23 00 eb  00 00 50 e3  .#....P.               564.1.8        
               52 00 00 0a  1f 13 05 e3  R.......               564.1.16       
               00 40 a0 e1  04 10 44 e3  .@....D.               564.1.24       
  27    OUT    00 20 44 e3  04 10 a0 e1  . D.....               565.1.0        
               1a 23 00 eb  00 00 50 e3  .#....P.               565.1.8        
               52 00 00 0a  1f 13 05 e3  R.......               565.1.16       
               00 40 a0 e1  04 10 44 e3  .@....D.               565.1.24       
   7    OUT                                                     566.1.0        
   7    IN     ef ee ee fe  01 00 00 00  ........               567.1.0        
               03 00 00 00               ....                   567.1.8        
  27    IN     ef ee ee fe  01 00 00 00  ........               568.1.0        
               03 00 00 00               ....                   568.1.8        
   7    IN     4f 4b 00                  OK.                    569.1.0        
  27    IN     4f 4b 00                  OK.                    570.1.0        
   7    OUT    ef ee ee fe  01 00 00 00  ........               571.1.0        
               0e 00 00 00               ....                   571.1.8        
  27    OUT    ef ee ee fe  01 00 00 00  ........               572.1.0        
               0e 00 00 00               ....                   572.1.8        
   7    OUT    4f 4b 40 30  78 65 38 30  OK@0xe80               573.1.0        
               30 37 39 64  65 00        079de.                 573.1.8        
  27    OUT    4f 4b 40 30  78 65 38 30  OK@0xe80               574.1.0        
               30 37 39 64  65 00        079de.                 574.1.8        
   7    IN     ef ee ee fe  01 00 00 00  ........               575.1.0        
               03 00 00 00               ....                   575.1.8        
   7    IN     4f 4b 00                  OK.                    576.1.0        
  27    IN     ef ee ee fe  01 00 00 00  ........               577.1.0        
               03 00 00 00               ....                   577.1.8        
  27    IN     4f 4b 00                  OK.                    578.1.0        
   7    OUT    ef ee ee fe  01 00 00 00  ........               579.1.0        
               00 10 00 00               ....                   579.1.8        
  27    OUT    ef ee ee fe  01 00 00 00  ........               580.1.0        
               00 10 00 00               ....                   580.1.8        
   7    OUT    06 00 00 ba  44 10 a0 e3  ....D...               581.1.0        
               01 20 96 e7  02 00 52 e3  . ....R.               581.1.8        
               80 00 00 0a  48 10 81 e2  ....H...               581.1.16       
               01 00 50 e2  f9 ff ff 1a  ..P.....               581.1.24       
  27    OUT    06 00 00 ba  44 10 a0 e3  ....D...               582.1.0        
               01 20 96 e7  02 00 52 e3  . ....R.               582.1.8        
               80 00 00 0a  48 10 81 e2  ....H...               582.1.16       
               01 00 50 e2  f9 ff ff 1a  ..P.....               582.1.24       
   7    IN     ef ee ee fe  01 00 00 00  ........               583.1.0        
               03 00 00 00               ....                   583.1.8        
   7    IN     4f 4b 00                  OK.                    584.1.0        
   7    OUT                                                     585.1.0        
  27    IN     ef ee ee fe  01 00 00 00  ........               586.1.0        
               03 00 00 00               ....                   586.1.8        
  27    IN     4f 4b 00                  OK.                    587.1.0        
   7    OUT    ef ee ee fe  01 00 00 00  ........               588.1.0        
               0e 00 00 00               ....                   588.1.8        
  27    OUT    ef ee ee fe  01 00 00 00  ........               589.1.0        
               0e 00 00 00               ....                   589.1.8        
   7    OUT    4f 4b 40 30  78 36 39 64  OK@0x69d               590.1.0        
               66 63 65 39  31 00        fce91.                 590.1.8        
  27    OUT    4f 4b 40 30  78 36 39 64  OK@0x69d               591.1.0        
               66 63 65 39  31 00        fce91.                 591.1.8        
   7    IN     ef ee ee fe  01 00 00 00  ........               592.1.0        
               03 00 00 00               ....                   592.1.8        
   7    IN     4f 4b 00                  OK.                    593.1.0        
  27    IN     ef ee ee fe  01 00 00 00  ........               594.1.0        
               03 00 00 00               ....                   594.1.8        
  27    IN     4f 4b 00                  OK.                    595.1.0        
   7    OUT    ef ee ee fe  01 00 00 00  ........               596.1.0        
               00 10 00 00               ....                   596.1.8        
  27    OUT    ef ee ee fe  01 00 00 00  ........               597.1.0        
               00 10 00 00               ....                   597.1.8        
   7    OUT    06 00 44 e3  00 70 8d e5  ..D..p..               598.1.0        
               00 10 90 e5  f8 06 04 e3  ........               598.1.8        
               06 00 44 e3  04 70 8d e5  ..D..p..               598.1.16       
               00 20 90 e5  30 00 a0 e3  . ..0...               598.1.24       
  27    OUT    06 00 44 e3  00 70 8d e5  ..D..p..               599.1.0        
               00 10 90 e5  f8 06 04 e3  ........               599.1.8        
               06 00 44 e3  04 70 8d e5  ..D..p..               599.1.16       
               00 20 90 e5  30 00 a0 e3  . ..0...               599.1.24       
   7    OUT                                                     600.1.0        
   7    IN     ef ee ee fe  01 00 00 00  ........               601.1.0        
               03 00 00 00               ....                   601.1.8        
  27    IN     ef ee ee fe  01 00 00 00  ........               602.1.0        
               03 00 00 00               ....                   602.1.8        
   7    IN     4f 4b 00                  OK.                    603.1.0        
  27    IN     4f 4b 00                  OK.                    604.1.0        
   7    OUT    ef ee ee fe  01 00 00 00  ........               605.1.0        
               0e 00 00 00               ....                   605.1.8        
  27    OUT    ef ee ee fe  01 00 00 00  ........               606.1.0        
               0e 00 00 00               ....                   606.1.8        
   7    OUT    4f 4b 40 30  78 65 34 36  OK@0xe46               607.1.0        
               36 37 32 32  61 00        6722a.                 607.1.8        
  27    OUT    4f 4b 40 30  78 65 34 36  OK@0xe46               608.1.0        
               36 37 32 32  61 00        6722a.                 608.1.8        
   7    IN     ef ee ee fe  01 00 00 00  ........               609.1.0        
               03 00 00 00               ....                   609.1.8        
   7    IN     4f 4b 00                  OK.                    610.1.0        
  27    IN     ef ee ee fe  01 00 00 00  ........               611.1.0        
               03 00 00 00               ....                   611.1.8        
  27    IN     4f 4b 00                  OK.                    612.1.0        
   7    OUT    ef ee ee fe  01 00 00 00  ........               613.1.0        
               00 10 00 00               ....                   613.1.8        
  27    OUT    ef ee ee fe  01 00 00 00  ........               614.1.0        
               00 10 00 00               ....                   614.1.8        
   7    OUT    a7 00 00 eb  04 00 50 e3  ......P.               615.1.0        
               05 00 00 8a  cc 05 06 e3  ........               615.1.8        
               da 15 06 e3  04 00 44 e3  ......D.               615.1.16       
               04 10 44 e3  72 20 a0 e3  ..D.r ..               615.1.24       
  27    OUT    a7 00 00 eb  04 00 50 e3  ......P.               616.1.0        
               05 00 00 8a  cc 05 06 e3  ........               616.1.8        
               da 15 06 e3  04 00 44 e3  ......D.               616.1.16       
               04 10 44 e3  72 20 a0 e3  ..D.r ..               616.1.24       
   7    OUT                                                     617.1.0        
   7    IN     ef ee ee fe  01 00 00 00  ........               618.1.0        
               03 00 00 00               ....                   618.1.8        
   7    IN     4f 4b 00                  OK.                    619.1.0        
  27    IN     ef ee ee fe  01 00 00 00  ........               620.1.0        
               03 00 00 00               ....                   620.1.8        
  27    IN     4f 4b 00                  OK.                    621.1.0        
   7    OUT    ef ee ee fe  01 00 00 00  ........               622.1.0        
               0e 00 00 00               ....                   622.1.8        
  27    OUT    ef ee ee fe  01 00 00 00  ........               623.1.0        
               0e 00 00 00               ....                   623.1.8        
   7    OUT    4f 4b 40 30  78 35 32 62  OK@0x52b               624.1.0        
               35 36 33 33  38 00        56338.                 624.1.8        
  27    OUT    4f 4b 40 30  78 35 32 62  OK@0x52b               625.1.0        
               35 36 33 33  38 00        56338.                 625.1.8        
   7    IN     ef ee ee fe  01 00 00 00  ........               626.1.0        
               03 00 00 00               ....                   626.1.8        
  27    IN     ef ee ee fe  01 00 00 00  ........               627.1.0        
               03 00 00 00               ....                   627.1.8        
   7    IN     4f 4b 00                  OK.                    628.1.0        
  27    IN     4f 4b 00                  OK.                    629.1.0        
   7    OUT    ef ee ee fe  01 00 00 00  ........               630.1.0        
               00 10 00 00               ....                   630.1.8        
  27    OUT    ef ee ee fe  01 00 00 00  ........               631.1.0        
               00 10 00 00               ....                   631.1.8        
   7    OUT    14 00 a0 e3  0e 50 a0 e1  .....P..               632.1.0        
               02 40 a0 e1  01 70 a0 e1  .@...p..               632.1.8        
               f5 07 00 eb  00 00 50 e3  ......P.               632.1.16       
               64 26 09 13  00 10 a0 13  d&......               632.1.24       
  27    OUT    14 00 a0 e3  0e 50 a0 e1  .....P..               633.1.0        
               02 40 a0 e1  01 70 a0 e1  .@...p..               633.1.8        
               f5 07 00 eb  00 00 50 e3  ......P.               633.1.16       
               64 26 09 13  00 10 a0 13  d&......               633.1.24       
   7    OUT                                                     634.1.0        
   7    IN     ef ee ee fe  01 00 00 00  ........               635.1.0        
               03 00 00 00               ....                   635.1.8        
  27    IN     ef ee ee fe  01 00 00 00  ........               636.1.0        
               03 00 00 00               ....                   636.1.8        
   7    IN     4f 4b 00                  OK.                    637.1.0        
  27    IN     4f 4b 00                  OK.                    638.1.0        
   7    OUT    ef ee ee fe  01 00 00 00  ........               639.1.0        
               0e 00 00 00               ....                   639.1.8        
  27    OUT    ef ee ee fe  01 00 00 00  ........               640.1.0        
               0e 00 00 00               ....                   640.1.8        
   7    OUT    4f 4b 40 30  78 61 63 30  OK@0xac0               641.1.0        
               35 66 63 63  31 00        5fcc1.                 641.1.8        
  27    OUT    4f 4b 40 30  78 61 63 30  OK@0xac0               642.1.0        
               35 66 63 63  31 00        5fcc1.                 642.1.8        
   7    IN     ef ee ee fe  01 00 00 00  ........               643.1.0        
               03 00 00 00               ....                   643.1.8        
  27    IN     ef ee ee fe  01 00 00 00  ........               644.1.0        
               03 00 00 00               ....                   644.1.8        
   7    IN     4f 4b 00                  OK.                    645.1.0        
  27    IN     4f 4b 00                  OK.                    646.1.0        
   7    OUT    ef ee ee fe  01 00 00 00  ........               647.1.0        
               00 10 00 00               ....                   647.1.8        
  27    OUT    ef ee ee fe  01 00 00 00  ........               648.1.0        
               00 10 00 00               ....                   648.1.8        
   7    OUT    b7 fe ff eb  97 9a 00 eb  ........               649.1.0        
               00 46 09 e3  05 40 44 e3  .F...@D.               649.1.8        
               00 00 94 e5  30 ff 2f e1  ....0./.               649.1.16       
               04 00 94 e5  30 ff 2f e1  ....0./.               649.1.24       
  27    OUT    b7 fe ff eb  97 9a 00 eb  ........               650.1.0        
               00 46 09 e3  05 40 44 e3  .F...@D.               650.1.8        
               00 00 94 e5  30 ff 2f e1  ....0./.               650.1.16       
               04 00 94 e5  30 ff 2f e1  ....0./.               650.1.24       
   7    OUT                                                     651.1.0        
   7    IN     ef ee ee fe  01 00 00 00  ........               652.1.0        
               03 00 00 00               ....                   652.1.8        
   7    IN     4f 4b 00                  OK.                    653.1.0        
  27    IN     ef ee ee fe  01 00 00 00  ........               654.1.0        
               03 00 00 00               ....                   654.1.8        
  27    IN     4f 4b 00                  OK.                    655.1.0        
   7    OUT    ef ee ee fe  01 00 00 00  ........               656.1.0        
               0e 00 00 00               ....                   656.1.8        
  27    OUT    ef ee ee fe  01 00 00 00  ........               657.1.0        
               0e 00 00 00               ....                   657.1.8        
   7    OUT    4f 4b 40 30  78 34 37 30  OK@0x470               658.1.0        
               33 31 64 30  31 00        31d01.                 658.1.8        
  27    OUT    4f 4b 40 30  78 34 37 30  OK@0x470               659.1.0        
               33 31 64 30  31 00        31d01.                 659.1.8        
   7    IN     ef ee ee fe  01 00 00 00  ........               660.1.0        
               03 00 00 00               ....                   660.1.8        
  27    IN     ef ee ee fe  01 00 00 00  ........               661.1.0        
               03 00 00 00               ....                   661.1.8        
   7    IN     4f 4b 00                  OK.                    662.1.0        
  27    IN     4f 4b 00                  OK.                    663.1.0        
   7    OUT    ef ee ee fe  01 00 00 00  ........               664.1.0        
               00 10 00 00               ....                   664.1.8        
  27    OUT    ef ee ee fe  01 00 00 00  ........               665.1.0        
               00 10 00 00               ....                   665.1.8        
   7    OUT    e2 f9 ff ea  30 48 2d e9  ....0H-.               666.1.0        
               08 b0 8d e2  91 00 04 e0  ........               666.1.8        
               00 10 a0 e3  04 00 a0 e1  ........               666.1.16       
               dc f9 ff eb  00 50 a0 e1  .....P..               666.1.24       
  27    OUT    e2 f9 ff ea  30 48 2d e9  ....0H-.               667.1.0        
               08 b0 8d e2  91 00 04 e0  ........               667.1.8        
               00 10 a0 e3  04 00 a0 e1  ........               667.1.16       
               dc f9 ff eb  00 50 a0 e1  .....P..               667.1.24       
   7    OUT                                                     668.1.0        
   7    IN     ef ee ee fe  01 00 00 00  ........               669.1.0        
               03 00 00 00               ....                   669.1.8        
   7    IN     4f 4b 00                  OK.                    670.1.0        
  27    IN     ef ee ee fe  01 00 00 00  ........               671.1.0        
               03 00 00 00               ....                   671.1.8        
  27    IN     4f 4b 00                  OK.                    672.1.0        
   7    OUT    ef ee ee fe  01 00 00 00  ........               673.1.0        
               0e 00 00 00               ....                   673.1.8        
  27    OUT    ef ee ee fe  01 00 00 00  ........               674.1.0        
               0e 00 00 00               ....                   674.1.8        
   7    OUT    4f 4b 40 30  78 34 38 61  OK@0x48a               675.1.0        
               65 37 31 34  63 00        e714c.                 675.1.8        
  27    OUT    4f 4b 40 30  78 34 38 61  OK@0x48a               676.1.0        
               65 37 31 34  63 00        e714c.                 676.1.8        
   7    IN     ef ee ee fe  01 00 00 00  ........               677.1.0        
               03 00 00 00               ....                   677.1.8        
   7    IN     4f 4b 00                  OK.                    678.1.0        
  27    IN     ef ee ee fe  01 00 00 00  ........               679.1.0        
               03 00 00 00               ....                   679.1.8        
  27    IN     4f 4b 00                  OK.                    680.1.0        
   7    OUT    ef ee ee fe  01 00 00 00  ........               681.1.0        
               00 10 00 00               ....                   681.1.8        
  27    OUT    ef ee ee fe  01 00 00 00  ........               682.1.0        
               00 10 00 00               ....                   682.1.8        
   7    OUT    00 40 a0 e1  02 00 00 ea  .@......               683.1.0        
               05 00 a0 e1  1a 00 00 eb  ........               683.1.8        
               00 60 a0 e1  04 00 86 e0  .`......               683.1.16       
               f0 88 bd e8  00 00 52 e3  ......R.               683.1.24       
  27    OUT    00 40 a0 e1  02 00 00 ea  .@......               684.1.0        
               05 00 a0 e1  1a 00 00 eb  ........               684.1.8        
               00 60 a0 e1  04 00 86 e0  .`......               684.1.16       
               f0 88 bd e8  00 00 52 e3  ......R.               684.1.24       
   7    OUT                                                     685.1.0        
   7    IN     ef ee ee fe  01 00 00 00  ........               686.1.0        
               03 00 00 00               ....                   686.1.8        
   7    IN     4f 4b 00                  OK.                    687.1.0        
  27    IN     ef ee ee fe  01 00 00 00  ........               688.1.0        
               03 00 00 00               ....                   688.1.8        
  27    IN     4f 4b 00                  OK.                    689.1.0        
   7    OUT    ef ee ee fe  01 00 00 00  ........               690.1.0        
               0e 00 00 00               ....                   690.1.8        
  27    OUT    ef ee ee fe  01 00 00 00  ........               691.1.0        
               0e 00 00 00               ....                   691.1.8        
   7    OUT    4f 4b 40 30  78 36 30 34  OK@0x604               692.1.0        
               33 61 30 31  39 00        3a019.                 692.1.8        
  27    OUT    4f 4b 40 30  78 36 30 34  OK@0x604               693.1.0        
               33 61 30 31  39 00        3a019.                 693.1.8        
   7    IN     ef ee ee fe  01 00 00 00  ........               694.1.0        
               03 00 00 00               ....                   694.1.8        
   7    IN     4f 4b 00                  OK.                    695.1.0        
  27    IN     ef ee ee fe  01 00 00 00  ........               696.1.0        
               03 00 00 00               ....                   696.1.8        
  27    IN     4f 4b 00                  OK.                    697.1.0        
   7    OUT    ef ee ee fe  01 00 00 00  ........               698.1.0        
               00 10 00 00               ....                   698.1.8        
  27    OUT    ef ee ee fe  01 00 00 00  ........               699.1.0        
               00 10 00 00               ....                   699.1.8        
   7    OUT    0c 00 9d 05  00 00 84 05  ........               700.1.0        
               f4 ff ff ea  00 48 2d e9  .....H-.               700.1.8        
               0d b0 a0 e1  00 00 50 e3  ......P.               700.1.16       
               f0 05 09 e3  a0 17 06 e3  ........               700.1.24       
  27    OUT    0c 00 9d 05  00 00 84 05  ........               701.1.0        
               f4 ff ff ea  00 48 2d e9  .....H-.               701.1.8        
               0d b0 a0 e1  00 00 50 e3  ......P.               701.1.16       
               f0 05 09 e3  a0 17 06 e3  ........               701.1.24       
   7    IN     ef ee ee fe  01 00 00 00  ........               702.1.0        
               03 00 00 00               ....                   702.1.8        
   7    OUT                                                     703.1.0        
  27    IN     ef ee ee fe  01 00 00 00  ........               704.1.0        
               03 00 00 00               ....                   704.1.8        
   7    IN     4f 4b 00                  OK.                    705.1.0        
  27    IN     4f 4b 00                  OK.                    706.1.0        
   7    OUT    ef ee ee fe  01 00 00 00  ........               707.1.0        
               0e 00 00 00               ....                   707.1.8        
  27    OUT    ef ee ee fe  01 00 00 00  ........               708.1.0        
               0e 00 00 00               ....                   708.1.8        
   7    OUT    4f 4b 40 30  78 61 36 61  OK@0xa6a               709.1.0        
               64 62 32 65  39 00        db2e9.                 709.1.8        
  27    OUT    4f 4b 40 30  78 61 36 61  OK@0xa6a               710.1.0        
               64 62 32 65  39 00        db2e9.                 710.1.8        
   7    IN     ef ee ee fe  01 00 00 00  ........               711.1.0        
               03 00 00 00               ....                   711.1.8        
   7    IN     4f 4b 00                  OK.                    712.1.0        
  27    IN     ef ee ee fe  01 00 00 00  ........               713.1.0        
               03 00 00 00               ....                   713.1.8        
  27    IN     4f 4b 00                  OK.                    714.1.0        
   7    OUT    ef ee ee fe  01 00 00 00  ........               715.1.0        
               00 10 00 00               ....                   715.1.8        
  27    OUT    ef ee ee fe  01 00 00 00  ........               716.1.0        
               00 10 00 00               ....                   716.1.8        
   7    OUT    2f 00 5a e3  04 00 00 1a  /.Z.....               717.1.0        
               28 00 9d e5  24 10 9d e5  (...$...               717.1.8        
               00 00 51 e1  13 00 00 9a  ..Q.....               717.1.16       
               30 00 00 ea  3c 00 5a e3  0...<.Z.               717.1.24       
  27    OUT    2f 00 5a e3  04 00 00 1a  /.Z.....               718.1.0        
               28 00 9d e5  24 10 9d e5  (...$...               718.1.8        
               00 00 51 e1  13 00 00 9a  ..Q.....               718.1.16       
               30 00 00 ea  3c 00 5a e3  0...<.Z.               718.1.24       
   7    OUT                                                     719.1.0        
   7    IN     ef ee ee fe  01 00 00 00  ........               720.1.0        
               03 00 00 00               ....                   720.1.8        
  27    IN     ef ee ee fe  01 00 00 00  ........               721.1.0        
               03 00 00 00               ....                   721.1.8        
   7    IN     4f 4b 00                  OK.                    722.1.0        
  27    IN     4f 4b 00                  OK.                    723.1.0        
   7    OUT    ef ee ee fe  01 00 00 00  ........               724.1.0        
               0e 00 00 00               ....                   724.1.8        
  27    OUT    ef ee ee fe  01 00 00 00  ........               725.1.0        
               0e 00 00 00               ....                   725.1.8        
   7    OUT    4f 4b 40 30  78 32 61 34  OK@0x2a4               726.1.0        
               61 30 63 36  32 00        a0c62.                 726.1.8        
  27    OUT    4f 4b 40 30  78 32 61 34  OK@0x2a4               727.1.0        
               61 30 63 36  32 00        a0c62.                 727.1.8        
   7    IN     ef ee ee fe  01 00 00 00  ........               728.1.0        
               03 00 00 00               ....                   728.1.8        
   7    IN     4f 4b 00                  OK.                    729.1.0        
  27    IN     ef ee ee fe  01 00 00 00  ........               730.1.0        
               03 00 00 00               ....                   730.1.8        
  27    IN     4f 4b 00                  OK.                    731.1.0        
   7    OUT    ef ee ee fe  01 00 00 00  ........               732.1.0        
               00 10 00 00               ....                   732.1.8        
  27    OUT    ef ee ee fe  01 00 00 00  ........               733.1.0        
               00 10 00 00               ....                   733.1.8        
   7    OUT    79 00 00 ea  00 80 e0 e3  y.......               734.1.0        
               02 00 54 e3  76 00 00 1a  ..T.v...               734.1.8        
               00 60 a0 e3  01 10 83 e2  .`......               734.1.16       
               00 10 80 e5  03 00 00 ea  ........               734.1.24       
  27    OUT    79 00 00 ea  00 80 e0 e3  y.......               735.1.0        
               02 00 54 e3  76 00 00 1a  ..T.v...               735.1.8        
               00 60 a0 e3  01 10 83 e2  .`......               735.1.16       
               00 10 80 e5  03 00 00 ea  ........               735.1.24       
   7    OUT                                                     736.1.0        
   7    IN     ef ee ee fe  01 00 00 00  ........               737.1.0        
               03 00 00 00               ....                   737.1.8        
   7    IN     4f 4b 00                  OK.                    738.1.0        
  27    IN     ef ee ee fe  01 00 00 00  ........               739.1.0        
               03 00 00 00               ....                   739.1.8        
  27    IN     4f 4b 00                  OK.                    740.1.0        
   7    OUT    ef ee ee fe  01 00 00 00  ........               741.1.0        
               0e 00 00 00               ....                   741.1.8        
  27    OUT    ef ee ee fe  01 00 00 00  ........               742.1.0        
               0e 00 00 00               ....                   742.1.8        
   7    OUT    4f 4b 40 30  78 38 62 30  OK@0x8b0               743.1.0        
               31 64 30 33  65 00        1d03e.                 743.1.8        
  27    OUT    4f 4b 40 30  78 38 62 30  OK@0x8b0               744.1.0        
               31 64 30 33  65 00        1d03e.                 744.1.8        
   7    IN     ef ee ee fe  01 00 00 00  ........               745.1.0        
               03 00 00 00               ....                   745.1.8        
  27    IN     ef ee ee fe  01 00 00 00  ........               746.1.0        
               03 00 00 00               ....                   746.1.8        
   7    IN     4f 4b 00                  OK.                    747.1.0        
  27    IN     4f 4b 00                  OK.                    748.1.0        
   7    OUT    ef ee ee fe  01 00 00 00  ........               749.1.0        
               00 10 00 00               ....                   749.1.8        
  27    OUT    ef ee ee fe  01 00 00 00  ........               750.1.0        
               00 10 00 00               ....                   750.1.8        
   7    OUT    1c 00 8d e5  07 00 a0 e1  ........               751.1.0        
               0e ec ff eb  07 00 a0 e1  ........               751.1.8        
               19 f0 ff eb  20 10 9d e5  .... ...               751.1.16       
               00 00 56 e3  01 10 80 e0  ..V.....               751.1.24       
  27    OUT    1c 00 8d e5  07 00 a0 e1  ........               752.1.0        
               0e ec ff eb  07 00 a0 e1  ........               752.1.8        
               19 f0 ff eb  20 10 9d e5  .... ...               752.1.16       
               00 00 56 e3  01 10 80 e0  ..V.....               752.1.24       
   7    OUT                                                     753.1.0        
   7    IN     ef ee ee fe  01 00 00 00  ........               754.1.0        
               03 00 00 00               ....                   754.1.8        
   7    IN     4f 4b 00                  OK.                    755.1.0        
  27    IN     ef ee ee fe  01 00 00 00  ........               756.1.0        
               03 00 00 00               ....                   756.1.8        
  27    IN     4f 4b 00                  OK.                    757.1.0        
   7    OUT    ef ee ee fe  01 00 00 00  ........               758.1.0        
               0e 00 00 00               ....                   758.1.8        
  27    OUT    ef ee ee fe  01 00 00 00  ........               759.1.0        
               0e 00 00 00               ....                   759.1.8        
   7    OUT    4f 4b 40 30  78 65 36 39  OK@0xe69               760.1.0        
               39 66 66 39  32 00        9ff92.                 760.1.8        
  27    OUT    4f 4b 40 30  78 65 36 39  OK@0xe69               761.1.0        
               39 66 66 39  32 00        9ff92.                 761.1.8        
   7    IN     ef ee ee fe  01 00 00 00  ........               762.1.0        
               03 00 00 00               ....                   762.1.8        
   7    IN     4f 4b 00                  OK.                    763.1.0        
  27    IN     ef ee ee fe  01 00 00 00  ........               764.1.0        
               03 00 00 00               ....                   764.1.8        
  27    IN     4f 4b 00                  OK.                    765.1.0        
   7    OUT    ef ee ee fe  01 00 00 00  ........               766.1.0        
               00 10 00 00               ....                   766.1.8        
  27    OUT    ef ee ee fe  01 00 00 00  ........               767.1.0        
               00 10 00 00               ....                   767.1.8        
   7    OUT    04 00 44 e3  7b dc ff eb  ..D.....               768.1.0        
               04 00 a0 e1  1c d0 4b e2  ......K.               768.1.8        
               f0 8f bd e8  04 00 50 e3  ......P.               768.1.16       
               02 00 00 8a  8d 0d 08 e3  ........               768.1.24       
  27    OUT    04 00 44 e3  7b dc ff eb  ..D.....               769.1.0        
               04 00 a0 e1  1c d0 4b e2  ......K.               769.1.8        
               f0 8f bd e8  04 00 50 e3  ......P.               769.1.16       
               02 00 00 8a  8d 0d 08 e3  ........               769.1.24       
   7    IN     ef ee ee fe  01 00 00 00  ........               770.1.0        
               03 00 00 00               ....                   770.1.8        
  27    IN     ef ee ee fe  01 00 00 00  ........               771.1.0        
               03 00 00 00               ....                   771.1.8        
   7    IN     4f 4b 00                  OK.                    772.1.0        
   7    OUT                                                     773.1.0        
  27    IN     4f 4b 00                  OK.                    774.1.0        
   7    OUT    ef ee ee fe  01 00 00 00  ........               775.1.0        
               0e 00 00 00               ....                   775.1.8        
  27    OUT    ef ee ee fe  01 00 00 00  ........               776.1.0        
               0e 00 00 00               ....                   776.1.8        
   7    OUT    4f 4b 40 30  78 39 33 34  OK@0x934               777.1.0        
               35 35 66 64  64 00        55fdd.                 777.1.8        
  27    OUT    4f 4b 40 30  78 39 33 34  OK@0x934               778.1.0        
               35 35 66 64  64 00        55fdd.                 778.1.8        
   7    IN     ef ee ee fe  01 00 00 00  ........               779.1.0        
               03 00 00 00               ....                   779.1.8        
   7    IN     4f 4b 00                  OK.                    780.1.0        
  27    IN     ef ee ee fe  01 00 00 00  ........               781.1.0        
               03 00 00 00               ....                   781.1.8        
  27    IN     4f 4b 00                  OK.                    782.1.0        
   7    OUT    ef ee ee fe  01 00 00 00  ........               783.1.0        
               00 10 00 00               ....                   783.1.8        
  27    OUT    ef ee ee fe  01 00 00 00  ........               784.1.0        
               00 10 00 00               ....                   784.1.8        
   7    OUT    00 a0 a0 e1  f3 05 00 eb  ........               785.1.0        
               00 00 50 e3  41 00 00 0a  ..P.A...               785.1.8        
               00 50 a0 e1  10 00 8d e2  .P......               785.1.16       
               20 10 80 e2  04 40 8d e5   ....@..               785.1.24       
  27    OUT    00 a0 a0 e1  f3 05 00 eb  ........               786.1.0        
               00 00 50 e3  41 00 00 0a  ..P.A...               786.1.8        
               00 50 a0 e1  10 00 8d e2  .P......               786.1.16       
               20 10 80 e2  04 40 8d e5   ....@..               786.1.24       
   7    OUT                                                     787.1.0        
   7    IN     ef ee ee fe  01 00 00 00  ........               788.1.0        
               03 00 00 00               ....                   788.1.8        
   7    IN     4f 4b 00                  OK.                    789.1.0        
  27    IN     ef ee ee fe  01 00 00 00  ........               790.1.0        
               03 00 00 00               ....                   790.1.8        
  27    IN     4f 4b 00                  OK.                    791.1.0        
   7    OUT    ef ee ee fe  01 00 00 00  ........               792.1.0        
               0e 00 00 00               ....                   792.1.8        
  27    OUT    ef ee ee fe  01 00 00 00  ........               793.1.0        
               0e 00 00 00               ....                   793.1.8        
   7    OUT    4f 4b 40 30  78 34 35 30  OK@0x450               794.1.0        
               62 35 39 63  31 00        b59c1.                 794.1.8        
  27    OUT    4f 4b 40 30  78 34 35 30  OK@0x450               795.1.0        
               62 35 39 63  31 00        b59c1.                 795.1.8        
   7    IN     ef ee ee fe  01 00 00 00  ........               796.1.0        
               03 00 00 00               ....                   796.1.8        
   7    IN     4f 4b 00                  OK.                    797.1.0        
  27    IN     ef ee ee fe  01 00 00 00  ........               798.1.0        
               03 00 00 00               ....                   798.1.8        
  27    IN     4f 4b 00                  OK.                    799.1.0        
   7    OUT    ef ee ee fe  01 00 00 00  ........               800.1.0        
               00 10 00 00               ....                   800.1.8        
  27    OUT    ef ee ee fe  01 00 00 00  ........               801.1.0        
               00 10 00 00               ....                   801.1.8        
   7    OUT    00 10 a0 e3  5c 20 a0 e3  ....\ ..               802.1.0        
               bf e3 ff eb  14 00 9d e5  ........               802.1.8        
               00 10 a0 e3  06 2a a0 e3  .....*..               802.1.16       
               bb e3 ff eb  a0 d4 ff eb  ........               802.1.24       
  27    OUT    00 10 a0 e3  5c 20 a0 e3  ....\ ..               803.1.0        
               bf e3 ff eb  14 00 9d e5  ........               803.1.8        
               00 10 a0 e3  06 2a a0 e3  .....*..               803.1.16       
               bb e3 ff eb  a0 d4 ff eb  ........               803.1.24       
   7    OUT                                                     804.1.0        
   7    IN     ef ee ee fe  01 00 00 00  ........               805.1.0        
               03 00 00 00               ....                   805.1.8        
   7    IN     4f 4b 00                  OK.                    806.1.0        
  27    IN     ef ee ee fe  01 00 00 00  ........               807.1.0        
               03 00 00 00               ....                   807.1.8        
  27    IN     4f 4b 00                  OK.                    808.1.0        
   7    OUT    ef ee ee fe  01 00 00 00  ........               809.1.0        
               0e 00 00 00               ....                   809.1.8        
  27    OUT    ef ee ee fe  01 00 00 00  ........               810.1.0        
               0e 00 00 00               ....                   810.1.8        
   7    OUT    4f 4b 40 30  78 34 62 61  OK@0x4ba               811.1.0        
               66 34 30 61  32 00        f40a2.                 811.1.8        
  27    OUT    4f 4b 40 30  78 34 62 61  OK@0x4ba               812.1.0        
               66 34 30 61  32 00        f40a2.                 812.1.8        
   7    IN     ef ee ee fe  01 00 00 00  ........               813.1.0        
               03 00 00 00               ....                   813.1.8        
   7    IN     4f 4b 00                  OK.                    814.1.0        
  27    IN     ef ee ee fe  01 00 00 00  ........               815.1.0        
               03 00 00 00               ....                   815.1.8        
  27    IN     4f 4b 00                  OK.                    816.1.0        
   7    OUT    ef ee ee fe  01 00 00 00  ........               817.1.0        
               00 10 00 00               ....                   817.1.8        
  27    OUT    ef ee ee fe  01 00 00 00  ........               818.1.0        
               00 10 00 00               ....                   818.1.8        
   7    OUT    30 00 00 ea  00 70 a0 e3  0....p..               819.1.0        
               00 70 85 e5  2d 00 00 ea  .p..-...               819.1.8        
               04 10 96 e5  ff 00 51 e3  ......Q.               819.1.16       
               04 00 00 ca  01 00 51 e3  ......Q.               819.1.24       
  27    OUT    30 00 00 ea  00 70 a0 e3  0....p..               820.1.0        
               00 70 85 e5  2d 00 00 ea  .p..-...               820.1.8        
               04 10 96 e5  ff 00 51 e3  ......Q.               820.1.16       
               04 00 00 ca  01 00 51 e3  ......Q.               820.1.24       
   7    OUT                                                     821.1.0        
   7    IN     ef ee ee fe  01 00 00 00  ........               822.1.0        
               03 00 00 00               ....                   822.1.8        
  27    IN     ef ee ee fe  01 00 00 00  ........               823.1.0        
               03 00 00 00               ....                   823.1.8        
   7    IN     4f 4b 00                  OK.                    824.1.0        
  27    IN     4f 4b 00                  OK.                    825.1.0        
   7    OUT    ef ee ee fe  01 00 00 00  ........               826.1.0        
               0d 00 00 00               ....                   826.1.8        
  27    OUT    ef ee ee fe  01 00 00 00  ........               827.1.0        
               0d 00 00 00               ....                   827.1.8        
   7    OUT    4f 4b 40 30  78 39 35 61  OK@0x95a               828.1.0        
               31 64 36 36  00           1d66.                  828.1.8        
  27    OUT    4f 4b 40 30  78 39 35 61  OK@0x95a               829.1.0        
               31 64 36 36  00           1d66.                  829.1.8        
   7    IN     ef ee ee fe  01 00 00 00  ........               830.1.0        
               03 00 00 00               ....                   830.1.8        
  27    IN     ef ee ee fe  01 00 00 00  ........               831.1.0        
               03 00 00 00               ....                   831.1.8        
   7    IN     4f 4b 00                  OK.                    832.1.0        
  27    IN     4f 4b 00                  OK.                    833.1.0        
   7    OUT    ef ee ee fe  01 00 00 00  ........               834.1.0        
               00 10 00 00               ....                   834.1.8        
  27    OUT    ef ee ee fe  01 00 00 00  ........               835.1.0        
               00 10 00 00               ....                   835.1.8        
   7    OUT    01 20 a0 e3  a5 00 00 e0  . ......               836.1.0        
               12 11 a0 e1  04 20 05 e3  ..... ..               836.1.8        
               00 20 41 e3  00 00 54 e3  . A...T.               836.1.16       
               01 00 00 0a  02 10 80 e7  ........               836.1.24       
  27    OUT    01 20 a0 e3  a5 00 00 e0  . ......               837.1.0        
               12 11 a0 e1  04 20 05 e3  ..... ..               837.1.8        
               00 20 41 e3  00 00 54 e3  . A...T.               837.1.16       
               01 00 00 0a  02 10 80 e7  ........               837.1.24       
   7    OUT                                                     838.1.0        
   7    IN     ef ee ee fe  01 00 00 00  ........               839.1.0        
               03 00 00 00               ....                   839.1.8        
  27    IN     ef ee ee fe  01 00 00 00  ........               840.1.0        
               03 00 00 00               ....                   840.1.8        
   7    IN     4f 4b 00                  OK.                    841.1.0        
  27    IN     4f 4b 00                  OK.                    842.1.0        
   7    OUT    ef ee ee fe  01 00 00 00  ........               843.1.0        
               0e 00 00 00               ....                   843.1.8        
  27    OUT    ef ee ee fe  01 00 00 00  ........               844.1.0        
               0e 00 00 00               ....                   844.1.8        
   7    OUT    4f 4b 40 30  78 66 64 35  OK@0xfd5               845.1.0        
               36 34 66 37  32 00        64f72.                 845.1.8        
  27    OUT    4f 4b 40 30  78 66 64 35  OK@0xfd5               846.1.0        
               36 34 66 37  32 00        64f72.                 846.1.8        
   7    IN     ef ee ee fe  01 00 00 00  ........               847.1.0        
               03 00 00 00               ....                   847.1.8        
  27    IN     ef ee ee fe  01 00 00 00  ........               848.1.0        
               03 00 00 00               ....                   848.1.8        
   7    IN     4f 4b 00                  OK.                    849.1.0        
  27    IN     4f 4b 00                  OK.                    850.1.0        
   7    OUT    ef ee ee fe  01 00 00 00  ........               851.1.0        
               00 10 00 00               ....                   851.1.8        
  27    OUT    ef ee ee fe  01 00 00 00  ........               852.1.0        
               00 10 00 00               ....                   852.1.8        
   7    OUT    60 10 c5 e5  05 00 a0 e1  `.......               853.1.0        
               04 10 a0 e1  3f 13 00 eb  ....?...               853.1.8        
               00 00 50 e3  0e 00 50 13  ..P...P.               853.1.16       
               01 00 00 0a  01 60 56 e2  .....`V.               853.1.24       
  27    OUT    60 10 c5 e5  05 00 a0 e1  `.......               854.1.0        
               04 10 a0 e1  3f 13 00 eb  ....?...               854.1.8        
               00 00 50 e3  0e 00 50 13  ..P...P.               854.1.16       
               01 00 00 0a  01 60 56 e2  .....`V.               854.1.24       
   7    OUT                                                     855.1.0        
   7    IN     ef ee ee fe  01 00 00 00  ........               856.1.0        
               03 00 00 00               ....                   856.1.8        
  27    IN     ef ee ee fe  01 00 00 00  ........               857.1.0        
               03 00 00 00               ....                   857.1.8        
   7    IN     4f 4b 00                  OK.                    858.1.0        
  27    IN     4f 4b 00                  OK.                    859.1.0        
   7    OUT    ef ee ee fe  01 00 00 00  ........               860.1.0        
               0e 00 00 00               ....                   860.1.8        
  27    OUT    ef ee ee fe  01 00 00 00  ........               861.1.0        
               0e 00 00 00               ....                   861.1.8        
   7    OUT    4f 4b 40 30  78 66 39 37  OK@0xf97               862.1.0        
               66 66 37 33  32 00        ff732.                 862.1.8        
  27    OUT    4f 4b 40 30  78 66 39 37  OK@0xf97               863.1.0        
               66 66 37 33  32 00        ff732.                 863.1.8        
   7    IN     ef ee ee fe  01 00 00 00  ........               864.1.0        
               03 00 00 00               ....                   864.1.8        
   7    IN     4f 4b 00                  OK.                    865.1.0        
  27    IN     ef ee ee fe  01 00 00 00  ........               866.1.0        
               03 00 00 00               ....                   866.1.8        
  27    IN     4f 4b 00                  OK.                    867.1.0        
   7    OUT    ef ee ee fe  01 00 00 00  ........               868.1.0        
               00 10 00 00               ....                   868.1.8        
  27    OUT    ef ee ee fe  01 00 00 00  ........               869.1.0        
               00 10 00 00               ....                   869.1.8        
   7    OUT    d9 ff ff 3a  11 00 00 ea  ...:....               870.1.0        
               00 00 58 e3  fa ff ff 1a  ..X.....               870.1.8        
               14 90 9d e5  20 70 8d e2  .... p..               870.1.16       
               08 50 9d e5  04 00 a0 e1  .P......               870.1.24       
  27    OUT    d9 ff ff 3a  11 00 00 ea  ...:....               871.1.0        
               00 00 58 e3  fa ff ff 1a  ..X.....               871.1.8        
               14 90 9d e5  20 70 8d e2  .... p..               871.1.16       
               08 50 9d e5  04 00 a0 e1  .P......               871.1.24       
   7    OUT                                                     872.1.0        
   7    IN     ef ee ee fe  01 00 00 00  ........               873.1.0        
               03 00 00 00               ....                   873.1.8        
   7    IN     4f 4b 00                  OK.                    874.1.0        
  27    IN     ef ee ee fe  01 00 00 00  ........               875.1.0        
               03 00 00 00               ....                   875.1.8        
  27    IN     4f 4b 00                  OK.                    876.1.0        
   7    OUT    ef ee ee fe  01 00 00 00  ........               877.1.0        
               0d 00 00 00               ....                   877.1.8        
  27    OUT    ef ee ee fe  01 00 00 00  ........               878.1.0        
               0d 00 00 00               ....                   878.1.8        
   7    OUT    4f 4b 40 30  78 65 62 66  OK@0xebf               879.1.0        
               62 34 32 36  00           b426.                  879.1.8        
  27    OUT    4f 4b 40 30  78 65 62 66  OK@0xebf               880.1.0        
               62 34 32 36  00           b426.                  880.1.8        
   7    IN     ef ee ee fe  01 00 00 00  ........               881.1.0        
               03 00 00 00               ....                   881.1.8        
  27    IN     ef ee ee fe  01 00 00 00  ........               882.1.0        
               03 00 00 00               ....                   882.1.8        
   7    IN     4f 4b 00                  OK.                    883.1.0        
  27    IN     4f 4b 00                  OK.                    884.1.0        
   7    OUT    ef ee ee fe  01 00 00 00  ........               885.1.0        
               00 10 00 00               ....                   885.1.8        
  27    OUT    ef ee ee fe  01 00 00 00  ........               886.1.0        
               00 10 00 00               ....                   886.1.8        
   7    OUT    11 00 91 e8  b0 70 d0 e1  .....p..               887.1.0        
               b4 50 d0 e1  01 00 a0 e3  .P......               887.1.8        
               03 00 57 e3  05 00 00 1a  ..W.....               887.1.16       
               00 00 8d e5  08 00 a0 e1  ........               887.1.24       
  27    OUT    11 00 91 e8  b0 70 d0 e1  .....p..               888.1.0        
               b4 50 d0 e1  01 00 a0 e3  .P......               888.1.8        
               03 00 57 e3  05 00 00 1a  ..W.....               888.1.16       
               00 00 8d e5  08 00 a0 e1  ........               888.1.24       
   7    OUT                                                     889.1.0        
   7    IN     ef ee ee fe  01 00 00 00  ........               890.1.0        
               03 00 00 00               ....                   890.1.8        
  27    IN     ef ee ee fe  01 00 00 00  ........               891.1.0        
               03 00 00 00               ....                   891.1.8        
   7    IN     4f 4b 00                  OK.                    892.1.0        
  27    IN     4f 4b 00                  OK.                    893.1.0        
   7    OUT    ef ee ee fe  01 00 00 00  ........               894.1.0        
               0d 00 00 00               ....                   894.1.8        
  27    OUT    ef ee ee fe  01 00 00 00  ........               895.1.0        
               0d 00 00 00               ....                   895.1.8        
   7    OUT    4f 4b 40 30  78 64 36 36  OK@0xd66               896.1.0        
               62 30 66 30  00           b0f0.                  896.1.8        
  27    OUT    4f 4b 40 30  78 64 36 36  OK@0xd66               897.1.0        
               62 30 66 30  00           b0f0.                  897.1.8        
   7    IN     ef ee ee fe  01 00 00 00  ........               898.1.0        
               03 00 00 00               ....                   898.1.8        
   7    IN     4f 4b 00                  OK.                    899.1.0        
  27    IN     ef ee ee fe  01 00 00 00  ........               900.1.0        
               03 00 00 00               ....                   900.1.8        
  27    IN     4f 4b 00                  OK.                    901.1.0        
   7    OUT    ef ee ee fe  01 00 00 00  ........               902.1.0        
               00 10 00 00               ....                   902.1.8        
  27    OUT    ef ee ee fe  01 00 00 00  ........               903.1.0        
               00 10 00 00               ....                   903.1.8        
   7    OUT    04 00 88 e5  02 00 59 e0  ......Y.               904.1.0        
               02 80 a0 e1  04 00 d7 e0  ........               904.1.8        
               00 00 a0 e3  01 00 00 33  .......3               904.1.16       
               00 00 50 e3  07 50 a0 11  ..P..P..               904.1.24       
  27    OUT    04 00 88 e5  02 00 59 e0  ......Y.               905.1.0        
               02 80 a0 e1  04 00 d7 e0  ........               905.1.8        
               00 00 a0 e3  01 00 00 33  .......3               905.1.16       
               00 00 50 e3  07 50 a0 11  ..P..P..               905.1.24       
   7    OUT                                                     906.1.0        
   7    IN     ef ee ee fe  01 00 00 00  ........               907.1.0        
               03 00 00 00               ....                   907.1.8        
   7    IN     4f 4b 00                  OK.                    908.1.0        
  27    IN     ef ee ee fe  01 00 00 00  ........               909.1.0        
               03 00 00 00               ....                   909.1.8        
  27    IN     4f 4b 00                  OK.                    910.1.0        
   7    OUT    ef ee ee fe  01 00 00 00  ........               911.1.0        
               0e 00 00 00               ....                   911.1.8        
  27    OUT    ef ee ee fe  01 00 00 00  ........               912.1.0        
               0e 00 00 00               ....                   912.1.8        
   7    OUT    4f 4b 40 30  78 35 61 63  OK@0x5ac               913.1.0        
               34 35 62 31  33 00        45b13.                 913.1.8        
  27    OUT    4f 4b 40 30  78 35 61 63  OK@0x5ac               914.1.0        
               34 35 62 31  33 00        45b13.                 914.1.8        
   7    IN     ef ee ee fe  01 00 00 00  ........               915.1.0        
               03 00 00 00               ....                   915.1.8        
   7    IN     4f 4b 00                  OK.                    916.1.0        
  27    IN     ef ee ee fe  01 00 00 00  ........               917.1.0        
               03 00 00 00               ....                   917.1.8        
  27    IN     4f 4b 00                  OK.                    918.1.0        
   7    OUT    ef ee ee fe  01 00 00 00  ........               919.1.0        
               00 10 00 00               ....                   919.1.8        
  27    OUT    ef ee ee fe  01 00 00 00  ........               920.1.0        
               00 10 00 00               ....                   920.1.8        
   7    OUT    6b 05 00 eb  bc 07 0a e3  k.......               921.1.0        
               5d 30 d4 e5  54 2f 09 e3  ]0..T/..               921.1.8        
               04 00 44 e3  00 10 a0 e3  ..D.....               921.1.16       
               04 00 8d e5  00 10 8d e5  ........               921.1.24       
  27    OUT    6b 05 00 eb  bc 07 0a e3  k.......               922.1.0        
               5d 30 d4 e5  54 2f 09 e3  ]0..T/..               922.1.8        
               04 00 44 e3  00 10 a0 e3  ..D.....               922.1.16       
               04 00 8d e5  00 10 8d e5  ........               922.1.24       
   7    OUT                                                     923.1.0        
   7    IN     ef ee ee fe  01 00 00 00  ........               924.1.0        
               03 00 00 00               ....                   924.1.8        
   7    IN     4f 4b 00                  OK.                    925.1.0        
  27    IN     ef ee ee fe  01 00 00 00  ........               926.1.0        
               03 00 00 00               ....                   926.1.8        
  27    IN     4f 4b 00                  OK.                    927.1.0        
   7    OUT    ef ee ee fe  01 00 00 00  ........               928.1.0        
               0e 00 00 00               ....                   928.1.8        
  27    OUT    ef ee ee fe  01 00 00 00  ........               929.1.0        
               0e 00 00 00               ....                   929.1.8        
   7    OUT    4f 4b 40 30  78 36 38 65  OK@0x68e               930.1.0        
               31 32 66 62  30 00        12fb0.                 930.1.8        
  27    OUT    4f 4b 40 30  78 36 38 65  OK@0x68e               931.1.0        
               31 32 66 62  30 00        12fb0.                 931.1.8        
   7    IN     ef ee ee fe  01 00 00 00  ........               932.1.0        
               03 00 00 00               ....                   932.1.8        
   7    IN     4f 4b 00                  OK.                    933.1.0        
  27    IN     ef ee ee fe  01 00 00 00  ........               934.1.0        
               03 00 00 00               ....                   934.1.8        
  27    IN     4f 4b 00                  OK.                    935.1.0        
   7    OUT    ef ee ee fe  01 00 00 00  ........               936.1.0        
               00 10 00 00               ....                   936.1.8        
  27    OUT    ef ee ee fe  01 00 00 00  ........               937.1.0        
               00 10 00 00               ....                   937.1.8        
   7    OUT    4f f0 7f f5  14 00 8d e5  O.......               938.1.0        
               14 00 9d e5  08 00 8d e5  ........               938.1.8        
               3e 0e a0 e3  63 09 00 eb  >...c...               938.1.16       
               00 80 a0 e1  2c 00 94 e5  ....,...               938.1.24       
  27    OUT    4f f0 7f f5  14 00 8d e5  O.......               939.1.0        
               14 00 9d e5  08 00 8d e5  ........               939.1.8        
               3e 0e a0 e3  63 09 00 eb  >...c...               939.1.16       
               00 80 a0 e1  2c 00 94 e5  ....,...               939.1.24       
   7    IN     ef ee ee fe  01 00 00 00  ........               940.1.0        
               03 00 00 00               ....                   940.1.8        
   7    OUT                                                     941.1.0        
  27    IN     ef ee ee fe  01 00 00 00  ........               942.1.0        
               03 00 00 00               ....                   942.1.8        
   7    IN     4f 4b 00                  OK.                    943.1.0        
  27    IN     4f 4b 00                  OK.                    944.1.0        
   7    OUT    ef ee ee fe  01 00 00 00  ........               945.1.0        
               0e 00 00 00               ....                   945.1.8        
  27    OUT    ef ee ee fe  01 00 00 00  ........               946.1.0        
               0e 00 00 00               ....                   946.1.8        
   7    OUT    4f 4b 40 30  78 63 31 65  OK@0xc1e               947.1.0        
               36 64 39 37  31 00        6d971.                 947.1.8        
  27    OUT    4f 4b 40 30  78 63 31 65  OK@0xc1e               948.1.0        
               36 64 39 37  31 00        6d971.                 948.1.8        
   7    IN     ef ee ee fe  01 00 00 00  ........               949.1.0        
               03 00 00 00               ....                   949.1.8        
   7    IN     4f 4b 00                  OK.                    950.1.0        
  27    IN     ef ee ee fe  01 00 00 00  ........               951.1.0        
               03 00 00 00               ....                   951.1.8        
  27    IN     4f 4b 00                  OK.                    952.1.0        
   7    OUT    ef ee ee fe  01 00 00 00  ........               953.1.0        
               00 10 00 00               ....                   953.1.8        
  27    OUT    ef ee ee fe  01 00 00 00  ........               954.1.0        
               00 10 00 00               ....                   954.1.8        
   7    OUT    00 10 a0 e3  01 30 a0 e3  .....0..               955.1.0        
               c9 f8 ff eb  b0 00 98 e5  ........               955.1.8        
               4f f0 7f f5  20 10 9d e5  O... ...               955.1.16       
               00 00 51 e3  07 00 00 0a  ..Q.....               955.1.24       
  27    OUT    00 10 a0 e3  01 30 a0 e3  .....0..               956.1.0        
               c9 f8 ff eb  b0 00 98 e5  ........               956.1.8        
               4f f0 7f f5  20 10 9d e5  O... ...               956.1.16       
               00 00 51 e3  07 00 00 0a  ..Q.....               956.1.24       
   7    OUT                                                     957.1.0        
   7    IN     ef ee ee fe  01 00 00 00  ........               958.1.0        
               03 00 00 00               ....                   958.1.8        
   7    IN     4f 4b 00                  OK.                    959.1.0        
  27    IN     ef ee ee fe  01 00 00 00  ........               960.1.0        
               03 00 00 00               ....                   960.1.8        
  27    IN     4f 4b 00                  OK.                    961.1.0        
   7    OUT    ef ee ee fe  01 00 00 00  ........               962.1.0        
               0e 00 00 00               ....                   962.1.8        
  27    OUT    ef ee ee fe  01 00 00 00  ........               963.1.0        
               0e 00 00 00               ....                   963.1.8        
   7    OUT    4f 4b 40 30  78 32 63 35  OK@0x2c5               964.1.0        
               37 61 32 30  37 00        7a207.                 964.1.8        
  27    OUT    4f 4b 40 30  78 32 63 35  OK@0x2c5               965.1.0        
               37 61 32 30  37 00        7a207.                 965.1.8        
   7    IN     ef ee ee fe  01 00 00 00  ........               966.1.0        
               03 00 00 00               ....                   966.1.8        
  27    IN     ef ee ee fe  01 00 00 00  ........               967.1.0        
               03 00 00 00               ....                   967.1.8        
   7    IN     4f 4b 00                  OK.                    968.1.0        
  27    IN     4f 4b 00                  OK.                    969.1.0        
   7    OUT    ef ee ee fe  01 00 00 00  ........               970.1.0        
               00 10 00 00               ....                   970.1.8        
  27    OUT    ef ee ee fe  01 00 00 00  ........               971.1.0        
               00 10 00 00               ....                   971.1.8        
   7    OUT    eb 3b 40 e3  78 a0 85 e5  .;@.x...               972.1.0        
               06 a0 a0 e1  80 00 12 e3  ........               972.1.8        
               09 20 a0 e3  02 10 00 03  . ......               972.1.16       
               44 90 85 e5  30 10 85 e5  D...0...               972.1.24       
  27    OUT    eb 3b 40 e3  78 a0 85 e5  .;@.x...               973.1.0        
               06 a0 a0 e1  80 00 12 e3  ........               973.1.8        
               09 20 a0 e3  02 10 00 03  . ......               973.1.16       
               44 90 85 e5  30 10 85 e5  D...0...               973.1.24       
   7    OUT                                                     974.1.0        
   7    IN     ef ee ee fe  01 00 00 00  ........               975.1.0        
               03 00 00 00               ....                   975.1.8        
  27    IN     ef ee ee fe  01 00 00 00  ........               976.1.0        
               03 00 00 00               ....                   976.1.8        
   7    IN     4f 4b 00                  OK.                    977.1.0        
  27    IN     4f 4b 00                  OK.                    978.1.0        
   7    OUT    ef ee ee fe  01 00 00 00  ........               979.1.0        
               0e 00 00 00               ....                   979.1.8        
  27    OUT    ef ee ee fe  01 00 00 00  ........               980.1.0        
               0e 00 00 00               ....                   980.1.8        
   7    OUT    4f 4b 40 30  78 37 61 39  OK@0x7a9               981.1.0        
               62 66 35 35  64 00        bf55d.                 981.1.8        
  27    OUT    4f 4b 40 30  78 37 61 39  OK@0x7a9               982.1.0        
               62 66 35 35  64 00        bf55d.                 982.1.8        
   7    IN     ef ee ee fe  01 00 00 00  ........               983.1.0        
               03 00 00 00               ....                   983.1.8        
   7    IN     4f 4b 00                  OK.                    984.1.0        
  27    IN     ef ee ee fe  01 00 00 00  ........               985.1.0        
               03 00 00 00               ....                   985.1.8        
  27    IN     4f 4b 00                  OK.                    986.1.0        
   7    OUT    ef ee ee fe  01 00 00 00  ........               987.1.0        
               00 10 00 00               ....                   987.1.8        
  27    OUT    ef ee ee fe  01 00 00 00  ........               988.1.0        
               00 10 00 00               ....                   988.1.8        
   7    OUT    24 a0 d5 e5  ad 03 00 eb  $.......               989.1.0        
               00 80 a0 e3  0c 00 57 e3  ......W.               989.1.8        
               33 00 00 2a  0a 00 58 e1  3..*..X.               989.1.16       
               45 00 00 0a  20 10 95 e5  E... ...               989.1.24       
  27    OUT    24 a0 d5 e5  ad 03 00 eb  $.......               990.1.0        
               00 80 a0 e3  0c 00 57 e3  ......W.               990.1.8        
               33 00 00 2a  0a 00 58 e1  3..*..X.               990.1.16       
               45 00 00 0a  20 10 95 e5  E... ...               990.1.24       
   7    OUT                                                     991.1.0        
   7    IN     ef ee ee fe  01 00 00 00  ........               992.1.0        
               03 00 00 00               ....                   992.1.8        
   7    IN     4f 4b 00                  OK.                    993.1.0        
  27    IN     ef ee ee fe  01 00 00 00  ........               994.1.0        
               03 00 00 00               ....                   994.1.8        
  27    IN     4f 4b 00                  OK.                    995.1.0        
   7    OUT    ef ee ee fe  01 00 00 00  ........               996.1.0        
               0e 00 00 00               ....                   996.1.8        
  27    OUT    ef ee ee fe  01 00 00 00  ........               997.1.0        
               0e 00 00 00               ....                   997.1.8        
   7    OUT    4f 4b 40 30  78 62 31 63  OK@0xb1c               998.1.0        
               66 61 37 61  33 00        fa7a3.                 998.1.8        
  27    OUT    4f 4b 40 30  78 62 31 63  OK@0xb1c               999.1.0        
               66 61 37 61  33 00        fa7a3.                 999.1.8        
   7    IN     ef ee ee fe  01 00 00 00  ........              1000.1.0        
               03 00 00 00               ....                  1000.1.8        
   7    IN     4f 4b 00                  OK.                   1001.1.0        
  27    IN     ef ee ee fe  01 00 00 00  ........              1002.1.0        
               03 00 00 00               ....                  1002.1.8        
  27    IN     4f 4b 00                  OK.                   1003.1.0        
   7    OUT    ef ee ee fe  01 00 00 00  ........              1004.1.0        
               00 10 00 00               ....                  1004.1.8        
  27    OUT    ef ee ee fe  01 00 00 00  ........              1005.1.0        
               00 10 00 00               ....                  1005.1.8        
   7    OUT    01 10 4b e2  01 00 4b e5  ..K...K.              1006.1.0        
               22 00 a0 e3  01 20 a0 e3  ".... ..              1006.1.8        
               03 30 a0 e3  51 ff ff eb  .0..Q...              1006.1.16       
               01 00 5b e5  01 00 60 e2  ..[...`.              1006.1.24       
  27    OUT    01 10 4b e2  01 00 4b e5  ..K...K.              1007.1.0        
               22 00 a0 e3  01 20 a0 e3  ".... ..              1007.1.8        
               03 30 a0 e3  51 ff ff eb  .0..Q...              1007.1.16       
               01 00 5b e5  01 00 60 e2  ..[...`.              1007.1.24       
   7    IN     ef ee ee fe  01 00 00 00  ........              1008.1.0        
               03 00 00 00               ....                  1008.1.8        
   7    IN     4f 4b 00                  OK.                   1009.1.0        
  27    IN     ef ee ee fe  01 00 00 00  ........              1010.1.0        
               03 00 00 00               ....                  1010.1.8        
   7    OUT                                                    1011.1.0        
  27    IN     4f 4b 00                  OK.                   1012.1.0        
   7    OUT    ef ee ee fe  01 00 00 00  ........              1013.1.0        
               0e 00 00 00               ....                  1013.1.8        
  27    OUT    ef ee ee fe  01 00 00 00  ........              1014.1.0        
               0e 00 00 00               ....                  1014.1.8        
   7    OUT    4f 4b 40 30  78 65 62 38  OK@0xeb8              1015.1.0        
               31 35 64 31  38 00        15d18.                1015.1.8        
  27    OUT    4f 4b 40 30  78 65 62 38  OK@0xeb8              1016.1.0        
               31 35 64 31  38 00        15d18.                1016.1.8        
   7    IN     ef ee ee fe  01 00 00 00  ........              1017.1.0        
               03 00 00 00               ....                  1017.1.8        
   7    IN     4f 4b 00                  OK.                   1018.1.0        
  27    IN     ef ee ee fe  01 00 00 00  ........              1019.1.0        
               03 00 00 00               ....                  1019.1.8        
  27    IN     4f 4b 00                  OK.                   1020.1.0        
   7    OUT    ef ee ee fe  01 00 00 00  ........              1021.1.0        
               00 10 00 00               ....                  1021.1.8        
  27    OUT    ef ee ee fe  01 00 00 00  ........              1022.1.0        
               00 10 00 00               ....                  1022.1.8        
   7    OUT    7c a0 ff eb  0a 00 a0 e3  ........              1023.1.0        
               a2 02 00 eb  04 00 a0 e1  ........              1023.1.8        
               30 88 bd e8  70 4c 2d e9  0...pL-.              1023.1.16       
               10 b0 8d e2  10 d0 4d e2  ......M.              1023.1.24       
  27    OUT    7c a0 ff eb  0a 00 a0 e3  ........              1024.1.0        
               a2 02 00 eb  04 00 a0 e1  ........              1024.1.8        
               30 88 bd e8  70 4c 2d e9  0...pL-.              1024.1.16       
               10 b0 8d e2  10 d0 4d e2  ......M.              1024.1.24       
   7    OUT                                                    1025.1.0        
   7    IN     ef ee ee fe  01 00 00 00  ........              1026.1.0        
               03 00 00 00               ....                  1026.1.8        
   7    IN     4f 4b 00                  OK.                   1027.1.0        
  27    IN     ef ee ee fe  01 00 00 00  ........              1028.1.0        
               03 00 00 00               ....                  1028.1.8        
  27    IN     4f 4b 00                  OK.                   1029.1.0        
   7    OUT    ef ee ee fe  01 00 00 00  ........              1030.1.0        
               0e 00 00 00               ....                  1030.1.8        
  27    OUT    ef ee ee fe  01 00 00 00  ........              1031.1.0        
               0e 00 00 00               ....                  1031.1.8        
   7    OUT    4f 4b 40 30  78 63 63 36  OK@0xcc6              1032.1.0        
               65 36 66 62  34 00        e6fb4.                1032.1.8        
  27    OUT    4f 4b 40 30  78 63 63 36  OK@0xcc6              1033.1.0        
               65 36 66 62  34 00        e6fb4.                1033.1.8        
   7    IN     ef ee ee fe  01 00 00 00  ........              1034.1.0        
               03 00 00 00               ....                  1034.1.8        
  27    IN     ef ee ee fe  01 00 00 00  ........              1035.1.0        
               03 00 00 00               ....                  1035.1.8        
   7    IN     4f 4b 00                  OK.                   1036.1.0        
  27    IN     4f 4b 00                  OK.                   1037.1.0        
   7    OUT    ef ee ee fe  01 00 00 00  ........              1038.1.0        
               00 10 00 00               ....                  1038.1.8        
  27    OUT    ef ee ee fe  01 00 00 00  ........              1039.1.0        
               00 10 00 00               ....                  1039.1.8        
   7    OUT    3c ff 2f e1  00 00 50 e3  <./...P.              1040.1.0        
               0b 00 00 1a  06 40 54 e0  .....@T.              1040.1.8        
               08 00 00 0a  06 76 87 e0  .....v..              1040.1.16       
               a0 c1 99 e5  05 50 86 e0  .....P..              1040.1.24       
  27    OUT    3c ff 2f e1  00 00 50 e3  <./...P.              1041.1.0        
               0b 00 00 1a  06 40 54 e0  .....@T.              1041.1.8        
               08 00 00 0a  06 76 87 e0  .....v..              1041.1.16       
               a0 c1 99 e5  05 50 86 e0  .....P..              1041.1.24       
   7    OUT                                                    1042.1.0        
   7    IN     ef ee ee fe  01 00 00 00  ........              1043.1.0        
               03 00 00 00               ....                  1043.1.8        
   7    IN     4f 4b 00                  OK.                   1044.1.0        
  27    IN     ef ee ee fe  01 00 00 00  ........              1045.1.0        
               03 00 00 00               ....                  1045.1.8        
  27    IN     4f 4b 00                  OK.                   1046.1.0        
   7    OUT    ef ee ee fe  01 00 00 00  ........              1047.1.0        
               0e 00 00 00               ....                  1047.1.8        
  27    OUT    ef ee ee fe  01 00 00 00  ........              1048.1.0        
               0e 00 00 00               ....                  1048.1.8        
   7    OUT    4f 4b 40 30  78 66 63 65  OK@0xfce              1049.1.0        
               32 32 61 61  39 00        22aa9.                1049.1.8        
  27    OUT    4f 4b 40 30  78 66 63 65  OK@0xfce              1050.1.0        
               32 32 61 61  39 00        22aa9.                1050.1.8        
   7    IN     ef ee ee fe  01 00 00 00  ........              1051.1.0        
               03 00 00 00               ....                  1051.1.8        
  27    IN     ef ee ee fe  01 00 00 00  ........              1052.1.0        
               03 00 00 00               ....                  1052.1.8        
   7    IN     4f 4b 00                  OK.                   1053.1.0        
  27    IN     4f 4b 00                  OK.                   1054.1.0        
   7    OUT    ef ee ee fe  01 00 00 00  ........              1055.1.0        
               00 10 00 00               ....                  1055.1.8        
  27    OUT    ef ee ee fe  01 00 00 00  ........              1056.1.0        
               00 10 00 00               ....                  1056.1.8        
   7    OUT    40 01 8d e8  09 a0 a0 e1  @.......              1057.1.0        
               04 00 a0 e1  14 60 8d e5  .....`..              1057.1.8        
               07 10 a0 e1  1c 60 9d e5  .....`..              1057.1.16       
               05 30 a0 e1  18 90 9d e5  .0......              1057.1.24       
  27    OUT    40 01 8d e8  09 a0 a0 e1  @.......              1058.1.0        
               04 00 a0 e1  14 60 8d e5  .....`..              1058.1.8        
               07 10 a0 e1  1c 60 9d e5  .....`..              1058.1.16       
               05 30 a0 e1  18 90 9d e5  .0......              1058.1.24       
   7    IN     ef ee ee fe  01 00 00 00  ........              1059.1.0        
               03 00 00 00               ....                  1059.1.8        
   7    IN     4f 4b 00                  OK.                   1060.1.0        
  27    IN     ef ee ee fe  01 00 00 00  ........              1061.1.0        
               03 00 00 00               ....                  1061.1.8        
   7    OUT                                                    1062.1.0        
  27    IN     4f 4b 00                  OK.                   1063.1.0        
   7    OUT    ef ee ee fe  01 00 00 00  ........              1064.1.0        
               0e 00 00 00               ....                  1064.1.8        
  27    OUT    ef ee ee fe  01 00 00 00  ........              1065.1.0        
               0e 00 00 00               ....                  1065.1.8        
   7    OUT    4f 4b 40 30  78 35 66 39  OK@0x5f9              1066.1.0        
               62 36 63 35  63 00        b6c5c.                1066.1.8        
  27    OUT    4f 4b 40 30  78 35 66 39  OK@0x5f9              1067.1.0        
               62 36 63 35  63 00        b6c5c.                1067.1.8        
   7    IN     ef ee ee fe  01 00 00 00  ........              1068.1.0        
               03 00 00 00               ....                  1068.1.8        
   7    IN     4f 4b 00                  OK.                   1069.1.0        
  27    IN     ef ee ee fe  01 00 00 00  ........              1070.1.0        
               03 00 00 00               ....                  1070.1.8        
  27    IN     4f 4b 00                  OK.                   1071.1.0        
   7    OUT    ef ee ee fe  01 00 00 00  ........              1072.1.0        
               00 10 00 00               ....                  1072.1.8        
  27    OUT    ef ee ee fe  01 00 00 00  ........              1073.1.0        
               00 10 00 00               ....                  1073.1.8        
   7    OUT    8c 0d 00 eb  b0 05 d9 e1  ........              1074.1.0        
               ce 11 00 e3  01 00 50 e1  ......P.              1074.1.8        
               0b 00 00 1a  00 60 00 e3  .....`..              1074.1.16       
               c8 31 99 e5  85 65 41 e3  .1...eA.              1074.1.24       
  27    OUT    8c 0d 00 eb  b0 05 d9 e1  ........              1075.1.0        
               ce 11 00 e3  01 00 50 e1  ......P.              1075.1.8        
               0b 00 00 1a  00 60 00 e3  .....`..              1075.1.16       
               c8 31 99 e5  85 65 41 e3  .1...eA.              1075.1.24       
   7    IN     ef ee ee fe  01 00 00 00  ........              1076.1.0        
               03 00 00 00               ....                  1076.1.8        
   7    OUT                                                    1077.1.0        
  27    IN     ef ee ee fe  01 00 00 00  ........              1078.1.0        
               03 00 00 00               ....                  1078.1.8        
   7    IN     4f 4b 00                  OK.                   1079.1.0        
  27    IN     4f 4b 00                  OK.                   1080.1.0        
   7    OUT    ef ee ee fe  01 00 00 00  ........              1081.1.0        
               0e 00 00 00               ....                  1081.1.8        
  27    OUT    ef ee ee fe  01 00 00 00  ........              1082.1.0        
               0e 00 00 00               ....                  1082.1.8        
   7    OUT    4f 4b 40 30  78 66 66 37  OK@0xff7              1083.1.0        
               66 65 31 64  37 00        fe1d7.                1083.1.8        
  27    OUT    4f 4b 40 30  78 66 66 37  OK@0xff7              1084.1.0        
               66 65 31 64  37 00        fe1d7.                1084.1.8        
   7    IN     ef ee ee fe  01 00 00 00  ........              1085.1.0        
               03 00 00 00               ....                  1085.1.8        
   7    IN     4f 4b 00                  OK.                   1086.1.0        
  27    IN     ef ee ee fe  01 00 00 00  ........              1087.1.0        
               03 00 00 00               ....                  1087.1.8        
  27    IN     4f 4b 00                  OK.                   1088.1.0        
   7    OUT    ef ee ee fe  01 00 00 00  ........              1089.1.0        
               00 10 00 00               ....                  1089.1.8        
  27    OUT    ef ee ee fe  01 00 00 00  ........              1090.1.0        
               00 10 00 00               ....                  1090.1.8        
   7    OUT    b8 71 90 e5  05 40 44 e3  .q...@D.              1091.1.0        
               c0 5d 01 e3  00 90 a0 e1  .]......              1091.1.8        
               04 00 94 e5  06 50 44 e3  .....PD.              1091.1.16       
               04 00 8d e5  09 00 a0 e1  ........              1091.1.24       
  27    OUT    b8 71 90 e5  05 40 44 e3  .q...@D.              1092.1.0        
               c0 5d 01 e3  00 90 a0 e1  .]......              1092.1.8        
               04 00 94 e5  06 50 44 e3  .....PD.              1092.1.16       
               04 00 8d e5  09 00 a0 e1  ........              1092.1.24       
   7    OUT                                                    1093.1.0        
   7    IN     ef ee ee fe  01 00 00 00  ........              1094.1.0        
               03 00 00 00               ....                  1094.1.8        
   7    IN     4f 4b 00                  OK.                   1095.1.0        
  27    IN     ef ee ee fe  01 00 00 00  ........              1096.1.0        
               03 00 00 00               ....                  1096.1.8        
  27    IN     4f 4b 00                  OK.                   1097.1.0        
   7    OUT    ef ee ee fe  01 00 00 00  ........              1098.1.0        
               0e 00 00 00               ....                  1098.1.8        
  27    OUT    ef ee ee fe  01 00 00 00  ........              1099.1.0        
               0e 00 00 00               ....                  1099.1.8        
   7    OUT    4f 4b 40 30  78 61 33 61  OK@0xa3a              1100.1.0        
               64 32 33 37  36 00        d2376.                1100.1.8        
  27    OUT    4f 4b 40 30  78 61 33 61  OK@0xa3a              1101.1.0        
               64 32 33 37  36 00        d2376.                1101.1.8        
   7    IN     ef ee ee fe  01 00 00 00  ........              1102.1.0        
               03 00 00 00               ....                  1102.1.8        
   7    IN     4f 4b 00                  OK.                   1103.1.0        
  27    IN     ef ee ee fe  01 00 00 00  ........              1104.1.0        
               03 00 00 00               ....                  1104.1.8        
  27    IN     4f 4b 00                  OK.                   1105.1.0        
   7    OUT    ef ee ee fe  01 00 00 00  ........              1106.1.0        
               00 10 00 00               ....                  1106.1.8        
  27    OUT    ef ee ee fe  01 00 00 00  ........              1107.1.0        
               00 10 00 00               ....                  1107.1.8        
   7    OUT    06 50 44 e3  2d 20 a0 e3  .PD.- ..              1108.1.0        
               05 00 a0 e1  00 70 a0 e3  .....p..              1108.1.8        
               bd 9b ff eb  01 00 a0 e3  ........              1108.1.16       
               08 10 9d e5  81 00 8d e8  ........              1108.1.24       
  27    OUT    06 50 44 e3  2d 20 a0 e3  .PD.- ..              1109.1.0        
               05 00 a0 e1  00 70 a0 e3  .....p..              1109.1.8        
               bd 9b ff eb  01 00 a0 e3  ........              1109.1.16       
               08 10 9d e5  81 00 8d e8  ........              1109.1.24       
   7    OUT                                                    1110.1.0        
   7    IN     ef ee ee fe  01 00 00 00  ........              1111.1.0        
               03 00 00 00               ....                  1111.1.8        
  27    IN     ef ee ee fe  01 00 00 00  ........              1112.1.0        
               03 00 00 00               ....                  1112.1.8        
   7    IN     4f 4b 00                  OK.                   1113.1.0        
  27    IN     4f 4b 00                  OK.                   1114.1.0        
   7    OUT    ef ee ee fe  01 00 00 00  ........              1115.1.0        
               0e 00 00 00               ....                  1115.1.8        
  27    OUT    ef ee ee fe  01 00 00 00  ........              1116.1.0        
               0e 00 00 00               ....                  1116.1.8        
   7    OUT    4f 4b 40 30  78 31 61 32  OK@0x1a2              1117.1.0        
               30 37 38 36  30 00        07860.                1117.1.8        
  27    OUT    4f 4b 40 30  78 31 61 32  OK@0x1a2              1118.1.0        
               30 37 38 36  30 00        07860.                1118.1.8        
   7    IN     ef ee ee fe  01 00 00 00  ........              1119.1.0        
               03 00 00 00               ....                  1119.1.8        
  27    IN     ef ee ee fe  01 00 00 00  ........              1120.1.0        
               03 00 00 00               ....                  1120.1.8        
   7    IN     4f 4b 00                  OK.                   1121.1.0        
  27    IN     4f 4b 00                  OK.                   1122.1.0        
   7    OUT    ef ee ee fe  01 00 00 00  ........              1123.1.0        
               00 10 00 00               ....                  1123.1.8        
  27    OUT    ef ee ee fe  01 00 00 00  ........              1124.1.0        
               00 10 00 00               ....                  1124.1.8        
   7    OUT    0d 20 a0 e1  64 10 a0 e3  . ..d...              1125.1.0        
               33 ff 2f e1  04 00 a0 e1  3./.....              1125.1.8        
               eb ed ff eb  00 40 a0 e1  .....@..              1125.1.16       
               04 00 a0 e1  1c d0 4b e2  ......K.              1125.1.24       
  27    OUT    0d 20 a0 e1  64 10 a0 e3  . ..d...              1126.1.0        
               33 ff 2f e1  04 00 a0 e1  3./.....              1126.1.8        
               eb ed ff eb  00 40 a0 e1  .....@..              1126.1.16       
               04 00 a0 e1  1c d0 4b e2  ......K.              1126.1.24       
   7    OUT                                                    1127.1.0        
   7    IN     ef ee ee fe  01 00 00 00  ........              1128.1.0        
               03 00 00 00               ....                  1128.1.8        
   7    IN     4f 4b 00                  OK.                   1129.1.0        
  27    IN     ef ee ee fe  01 00 00 00  ........              1130.1.0        
               03 00 00 00               ....                  1130.1.8        
  27    IN     4f 4b 00                  OK.                   1131.1.0        
   7    OUT    ef ee ee fe  01 00 00 00  ........              1132.1.0        
               0e 00 00 00               ....                  1132.1.8        
  27    OUT    ef ee ee fe  01 00 00 00  ........              1133.1.0        
               0e 00 00 00               ....                  1133.1.8        
   7    OUT    4f 4b 40 30  78 65 33 33  OK@0xe33              1134.1.0        
               39 64 39 61  31 00        9d9a1.                1134.1.8        
  27    OUT    4f 4b 40 30  78 65 33 33  OK@0xe33              1135.1.0        
               39 64 39 61  31 00        9d9a1.                1135.1.8        
   7    IN     ef ee ee fe  01 00 00 00  ........              1136.1.0        
               03 00 00 00               ....                  1136.1.8        
   7    IN     4f 4b 00                  OK.                   1137.1.0        
  27    IN     ef ee ee fe  01 00 00 00  ........              1138.1.0        
               03 00 00 00               ....                  1138.1.8        
  27    IN     4f 4b 00                  OK.                   1139.1.0        
   7    OUT    ef ee ee fe  01 00 00 00  ........              1140.1.0        
               00 10 00 00               ....                  1140.1.8        
  27    OUT    ef ee ee fe  01 00 00 00  ........              1141.1.0        
               00 10 00 00               ....                  1141.1.8        
   7    OUT    00 00 57 e3  24 00 00 0a  ..W.$...              1142.1.0        
               07 00 a0 e1  00 10 a0 e3  ........              1142.1.8        
               fe 21 00 e3  05 a0 a0 e1  .!......              1142.1.16       
               04 90 8d e5  7e 9f 87 e2  ........              1142.1.24       
  27    OUT    00 00 57 e3  24 00 00 0a  ..W.$...              1143.1.0        
               07 00 a0 e1  00 10 a0 e3  ........              1143.1.8        
               fe 21 00 e3  05 a0 a0 e1  .!......              1143.1.16       
               04 90 8d e5  7e 9f 87 e2  ........              1143.1.24       
   7    OUT                                                    1144.1.0        
   7    IN     ef ee ee fe  01 00 00 00  ........              1145.1.0        
               03 00 00 00               ....                  1145.1.8        
   7    IN     4f 4b 00                  OK.                   1146.1.0        
  27    IN     ef ee ee fe  01 00 00 00  ........              1147.1.0        
               03 00 00 00               ....                  1147.1.8        
  27    IN     4f 4b 00                  OK.                   1148.1.0        
   7    OUT    ef ee ee fe  01 00 00 00  ........              1149.1.0        
               0e 00 00 00               ....                  1149.1.8        
  27    OUT    ef ee ee fe  01 00 00 00  ........              1150.1.0        
               0e 00 00 00               ....                  1150.1.8        
   7    OUT    4f 4b 40 30  78 61 34 37  OK@0xa47              1151.1.0        
               37 39 37 33  35 00        79735.                1151.1.8        
  27    OUT    4f 4b 40 30  78 61 34 37  OK@0xa47              1152.1.0        
               37 39 37 33  35 00        79735.                1152.1.8        
   7    IN     ef ee ee fe  01 00 00 00  ........              1153.1.0        
               03 00 00 00               ....                  1153.1.8        
   7    IN     4f 4b 00                  OK.                   1154.1.0        
  27    IN     ef ee ee fe  01 00 00 00  ........              1155.1.0        
               03 00 00 00               ....                  1155.1.8        
  27    IN     4f 4b 00                  OK.                   1156.1.0        
   7    OUT    ef ee ee fe  01 00 00 00  ........              1157.1.0        
               00 10 00 00               ....                  1157.1.8        
  27    OUT    ef ee ee fe  01 00 00 00  ........              1158.1.0        
               00 10 00 00               ....                  1158.1.8        
   7    OUT    04 50 80 e5  58 07 03 e3  .P..X...              1159.1.0        
               06 00 44 e3  04 60 80 e5  ..D..`..              1159.1.8        
               1b 08 00 eb  01 00 50 e3  ......P.              1159.1.16       
               11 00 00 1a  28 07 03 e3  ....(...              1159.1.24       
  27    OUT    04 50 80 e5  58 07 03 e3  .P..X...              1160.1.0        
               06 00 44 e3  04 60 80 e5  ..D..`..              1160.1.8        
               1b 08 00 eb  01 00 50 e3  ......P.              1160.1.16       
               11 00 00 1a  28 07 03 e3  ....(...              1160.1.24       
   7    OUT                                                    1161.1.0        
   7    IN     ef ee ee fe  01 00 00 00  ........              1162.1.0        
               03 00 00 00               ....                  1162.1.8        
   7    IN     4f 4b 00                  OK.                   1163.1.0        
  27    IN     ef ee ee fe  01 00 00 00  ........              1164.1.0        
               03 00 00 00               ....                  1164.1.8        
  27    IN     4f 4b 00                  OK.                   1165.1.0        
   7    OUT    ef ee ee fe  01 00 00 00  ........              1166.1.0        
               0e 00 00 00               ....                  1166.1.8        
  27    OUT    ef ee ee fe  01 00 00 00  ........              1167.1.0        
               0e 00 00 00               ....                  1167.1.8        
   7    OUT    4f 4b 40 30  78 38 38 36  OK@0x886              1168.1.0        
               64 66 61 37  65 00        dfa7e.                1168.1.8        
  27    OUT    4f 4b 40 30  78 38 38 36  OK@0x886              1169.1.0        
               64 66 61 37  65 00        dfa7e.                1169.1.8        
   7    IN     ef ee ee fe  01 00 00 00  ........              1170.1.0        
               03 00 00 00               ....                  1170.1.8        
  27    IN     ef ee ee fe  01 00 00 00  ........              1171.1.0        
               03 00 00 00               ....                  1171.1.8        
   7    IN     4f 4b 00                  OK.                   1172.1.0        
  27    IN     4f 4b 00                  OK.                   1173.1.0        
   7    OUT    ef ee ee fe  01 00 00 00  ........              1174.1.0        
               00 10 00 00               ....                  1174.1.8        
  27    OUT    ef ee ee fe  01 00 00 00  ........              1175.1.0        
               00 10 00 00               ....                  1175.1.8        
   7    OUT    30 48 2d e9  08 b0 8d e2  0H-.....              1176.1.0        
               68 57 03 e3  06 50 44 e3  hW...PD.              1176.1.8        
               00 00 d5 e5  01 00 50 e3  ......P.              1176.1.16       
               06 00 00 1a  a0 7c ff eb  ........              1176.1.24       
  27    OUT    30 48 2d e9  08 b0 8d e2  0H-.....              1177.1.0        
               68 57 03 e3  06 50 44 e3  hW...PD.              1177.1.8        
               00 00 d5 e5  01 00 50 e3  ......P.              1177.1.16       
               06 00 00 1a  a0 7c ff eb  ........              1177.1.24       
   7    OUT                                                    1178.1.0        
   7    IN     ef ee ee fe  01 00 00 00  ........              1179.1.0        
               03 00 00 00               ....                  1179.1.8        
   7    IN     4f 4b 00                  OK.                   1180.1.0        
  27    IN     ef ee ee fe  01 00 00 00  ........              1181.1.0        
               03 00 00 00               ....                  1181.1.8        
  27    IN     4f 4b 00                  OK.                   1182.1.0        
   7    OUT    ef ee ee fe  01 00 00 00  ........              1183.1.0        
               0e 00 00 00               ....                  1183.1.8        
  27    OUT    ef ee ee fe  01 00 00 00  ........              1184.1.0        
               0e 00 00 00               ....                  1184.1.8        
   7    OUT    4f 4b 40 30  78 34 65 38  OK@0x4e8              1185.1.0        
               38 65 62 61  63 00        8ebac.                1185.1.8        
  27    OUT    4f 4b 40 30  78 34 65 38  OK@0x4e8              1186.1.0        
               38 65 62 61  63 00        8ebac.                1186.1.8        
   7    IN     ef ee ee fe  01 00 00 00  ........              1187.1.0        
               03 00 00 00               ....                  1187.1.8        
   7    IN     4f 4b 00                  OK.                   1188.1.0        
  27    IN     ef ee ee fe  01 00 00 00  ........              1189.1.0        
               03 00 00 00               ....                  1189.1.8        
  27    IN     4f 4b 00                  OK.                   1190.1.0        
   7    OUT    ef ee ee fe  01 00 00 00  ........              1191.1.0        
               00 10 00 00               ....                  1191.1.8        
  27    OUT    ef ee ee fe  01 00 00 00  ........              1192.1.0        
               00 10 00 00               ....                  1192.1.8        
   7    OUT    01 00 a0 e1  1e ff 2f e1  ....../.              1193.1.0        
               00 48 2d e9  0d b0 a0 e1  .H-.....              1193.1.8        
               08 d0 4d e2  00 00 50 e3  ..M...P.              1193.1.16       
               06 00 00 0a  00 12 01 e3  ........              1193.1.24       
  27    OUT    01 00 a0 e1  1e ff 2f e1  ....../.              1194.1.0        
               00 48 2d e9  0d b0 a0 e1  .H-.....              1194.1.8        
               08 d0 4d e2  00 00 50 e3  ..M...P.              1194.1.16       
               06 00 00 0a  00 12 01 e3  ........              1194.1.24       
   7    OUT                                                    1195.1.0        
   7    IN     ef ee ee fe  01 00 00 00  ........              1196.1.0        
               03 00 00 00               ....                  1196.1.8        
   7    IN     4f 4b 00                  OK.                   1197.1.0        
  27    IN     ef ee ee fe  01 00 00 00  ........              1198.1.0        
               03 00 00 00               ....                  1198.1.8        
  27    IN     4f 4b 00                  OK.                   1199.1.0        
   7    OUT    ef ee ee fe  01 00 00 00  ........              1200.1.0        
               0e 00 00 00               ....                  1200.1.8        
  27    OUT    ef ee ee fe  01 00 00 00  ........              1201.1.0        
               0e 00 00 00               ....                  1201.1.8        
   7    OUT    4f 4b 40 30  78 31 65 61  OK@0x1ea              1202.1.0        
               65 65 39 32  34 00        ee924.                1202.1.8        
  27    OUT    4f 4b 40 30  78 31 65 61  OK@0x1ea              1203.1.0        
               65 65 39 32  34 00        ee924.                1203.1.8        
   7    IN     ef ee ee fe  01 00 00 00  ........              1204.1.0        
               03 00 00 00               ....                  1204.1.8        
   7    IN     4f 4b 00                  OK.                   1205.1.0        
  27    IN     ef ee ee fe  01 00 00 00  ........              1206.1.0        
               03 00 00 00               ....                  1206.1.8        
  27    IN     4f 4b 00                  OK.                   1207.1.0        
   7    OUT    ef ee ee fe  01 00 00 00  ........              1208.1.0        
               00 10 00 00               ....                  1208.1.8        
  27    OUT    ef ee ee fe  01 00 00 00  ........              1209.1.0        
               00 10 00 00               ....                  1209.1.8        
   7    OUT    04 20 00 03  00 20 c0 e5  . ... ..              1210.1.0        
               f6 0f 81 e2  1e ff 2f e1  ....../.              1210.1.8        
               a0 19 03 e3  06 10 44 e3  ......D.              1210.1.16       
               78 24 d1 e5  01 20 82 e2  x$... ..              1210.1.24       
  27    OUT    04 20 00 03  00 20 c0 e5  . ... ..              1211.1.0        
               f6 0f 81 e2  1e ff 2f e1  ....../.              1211.1.8        
               a0 19 03 e3  06 10 44 e3  ......D.              1211.1.16       
               78 24 d1 e5  01 20 82 e2  x$... ..              1211.1.24       
   7    IN     ef ee ee fe  01 00 00 00  ........              1212.1.0        
               03 00 00 00               ....                  1212.1.8        
   7    OUT                                                    1213.1.0        
   7    IN     4f 4b 00                  OK.                   1214.1.0        
  27    IN     ef ee ee fe  01 00 00 00  ........              1215.1.0        
               03 00 00 00               ....                  1215.1.8        
  27    IN     4f 4b 00                  OK.                   1216.1.0        
   7    OUT    ef ee ee fe  01 00 00 00  ........              1217.1.0        
               0e 00 00 00               ....                  1217.1.8        
  27    OUT    ef ee ee fe  01 00 00 00  ........              1218.1.0        
               0e 00 00 00               ....                  1218.1.8        
   7    OUT    4f 4b 40 30  78 37 38 65  OK@0x78e              1219.1.0        
               64 64 61 36  32 00        dda62.                1219.1.8        
  27    OUT    4f 4b 40 30  78 37 38 65  OK@0x78e              1220.1.0        
               64 64 61 36  32 00        dda62.                1220.1.8        
   7    IN     ef ee ee fe  01 00 00 00  ........              1221.1.0        
               03 00 00 00               ....                  1221.1.8        
   7    IN     4f 4b 00                  OK.                   1222.1.0        
  27    IN     ef ee ee fe  01 00 00 00  ........              1223.1.0        
               03 00 00 00               ....                  1223.1.8        
  27    IN     4f 4b 00                  OK.                   1224.1.0        
   7    OUT    ef ee ee fe  01 00 00 00  ........              1225.1.0        
               00 10 00 00               ....                  1225.1.8        
  27    OUT    ef ee ee fe  01 00 00 00  ........              1226.1.0        
               00 10 00 00               ....                  1226.1.8        
   7    OUT    04 10 a0 e1  05 00 44 e3  ......D.              1227.1.0        
               7a 70 ff eb  01 00 00 e3  zp......              1227.1.8        
               00 00 56 e3  01 00 4c e3  ..V...L.              1227.1.16       
               00 00 5a 13  4e 00 00 0a  ..Z.N...              1227.1.24       
  27    OUT    04 10 a0 e1  05 00 44 e3  ......D.              1228.1.0        
               7a 70 ff eb  01 00 00 e3  zp......              1228.1.8        
               00 00 56 e3  01 00 4c e3  ..V...L.              1228.1.16       
               00 00 5a 13  4e 00 00 0a  ..Z.N...              1228.1.24       
   7    IN     ef ee ee fe  01 00 00 00  ........              1229.1.0        
               03 00 00 00               ....                  1229.1.8        
   7    OUT                                                    1230.1.0        
  27    IN     ef ee ee fe  01 00 00 00  ........              1231.1.0        
               03 00 00 00               ....                  1231.1.8        
   7    IN     4f 4b 00                  OK.                   1232.1.0        
  27    IN     4f 4b 00                  OK.                   1233.1.0        
   7    OUT    ef ee ee fe  01 00 00 00  ........              1234.1.0        
               0e 00 00 00               ....                  1234.1.8        
  27    OUT    ef ee ee fe  01 00 00 00  ........              1235.1.0        
               0e 00 00 00               ....                  1235.1.8        
   7    OUT    4f 4b 40 30  78 32 62 63  OK@0x2bc              1236.1.0        
               38 33 36 32  63 00        8362c.                1236.1.8        
  27    OUT    4f 4b 40 30  78 32 62 63  OK@0x2bc              1237.1.0        
               38 33 36 32  63 00        8362c.                1237.1.8        
   7    IN     ef ee ee fe  01 00 00 00  ........              1238.1.0        
               03 00 00 00               ....                  1238.1.8        
   7    IN     4f 4b 00                  OK.                   1239.1.0        
  27    IN     ef ee ee fe  01 00 00 00  ........              1240.1.0        
               03 00 00 00               ....                  1240.1.8        
  27    IN     4f 4b 00                  OK.                   1241.1.0        
   7    OUT    ef ee ee fe  01 00 00 00  ........              1242.1.0        
               00 10 00 00               ....                  1242.1.8        
  27    OUT    ef ee ee fe  01 00 00 00  ........              1243.1.0        
               00 10 00 00               ....                  1243.1.8        
   7    OUT    f0 4f 2d e9  1c b0 8d e2  .O-.....              1244.1.0        
               0c d0 4d e2  00 00 50 e3  ..M...P.              1244.1.8        
               84 00 00 0a  04 a0 90 e5  ........              1244.1.16       
               00 30 a0 e1  00 00 5a e3  .0....Z.              1244.1.24       
  27    OUT    f0 4f 2d e9  1c b0 8d e2  .O-.....              1245.1.0        
               0c d0 4d e2  00 00 50 e3  ..M...P.              1245.1.8        
               84 00 00 0a  04 a0 90 e5  ........              1245.1.16       
               00 30 a0 e1  00 00 5a e3  .0....Z.              1245.1.24       
   7    OUT                                                    1246.1.0        
   7    IN     ef ee ee fe  01 00 00 00  ........              1247.1.0        
               03 00 00 00               ....                  1247.1.8        
  27    IN     ef ee ee fe  01 00 00 00  ........              1248.1.0        
               03 00 00 00               ....                  1248.1.8        
   7    IN     4f 4b 00                  OK.                   1249.1.0        
  27    IN     4f 4b 00                  OK.                   1250.1.0        
   7    OUT    ef ee ee fe  01 00 00 00  ........              1251.1.0        
               0d 00 00 00               ....                  1251.1.8        
  27    OUT    ef ee ee fe  01 00 00 00  ........              1252.1.0        
               0d 00 00 00               ....                  1252.1.8        
   7    OUT    4f 4b 40 30  78 37 37 32  OK@0x772              1253.1.0        
               34 37 31 37  00           4717.                 1253.1.8        
  27    OUT    4f 4b 40 30  78 37 37 32  OK@0x772              1254.1.0        
               34 37 31 37  00           4717.                 1254.1.8        
   7    IN     ef ee ee fe  01 00 00 00  ........              1255.1.0        
               03 00 00 00               ....                  1255.1.8        
   7    IN     4f 4b 00                  OK.                   1256.1.0        
  27    IN     ef ee ee fe  01 00 00 00  ........              1257.1.0        
               03 00 00 00               ....                  1257.1.8        
  27    IN     4f 4b 00                  OK.                   1258.1.0        
   7    OUT    ef ee ee fe  01 00 00 00  ........              1259.1.0        
               00 10 00 00               ....                  1259.1.8        
  27    OUT    ef ee ee fe  01 00 00 00  ........              1260.1.0        
               00 10 00 00               ....                  1260.1.8        
   7    OUT    05 00 44 e3  6f ff ff ea  ..D.o...              1261.1.0        
               70 4c 2d e9  10 b0 8d e2  pL-.....              1261.1.8        
               70 19 09 e3  68 c6 0b e3  p...h...              1261.1.16       
               05 10 44 e3  00 40 a0 e3  ..D..@..              1261.1.24       
  27    OUT    05 00 44 e3  6f ff ff ea  ..D.o...              1262.1.0        
               70 4c 2d e9  10 b0 8d e2  pL-.....              1262.1.8        
               70 19 09 e3  68 c6 0b e3  p...h...              1262.1.16       
               05 10 44 e3  00 40 a0 e3  ..D..@..              1262.1.24       
   7    OUT                                                    1263.1.0        
   7    IN     ef ee ee fe  01 00 00 00  ........              1264.1.0        
               03 00 00 00               ....                  1264.1.8        
   7    IN     4f 4b 00                  OK.                   1265.1.0        
  27    IN     ef ee ee fe  01 00 00 00  ........              1266.1.0        
               03 00 00 00               ....                  1266.1.8        
  27    IN     4f 4b 00                  OK.                   1267.1.0        
   7    OUT    ef ee ee fe  01 00 00 00  ........              1268.1.0        
               0e 00 00 00               ....                  1268.1.8        
  27    OUT    ef ee ee fe  01 00 00 00  ........              1269.1.0        
               0e 00 00 00               ....                  1269.1.8        
   7    OUT    4f 4b 40 30  78 66 64 36  OK@0xfd6              1270.1.0        
               61 30 66 32  30 00        a0f20.                1270.1.8        
  27    OUT    4f 4b 40 30  78 66 64 36  OK@0xfd6              1271.1.0        
               61 30 66 32  30 00        a0f20.                1271.1.8        
   7    IN     ef ee ee fe  01 00 00 00  ........              1272.1.0        
               03 00 00 00               ....                  1272.1.8        
   7    IN     4f 4b 00                  OK.                   1273.1.0        
  27    IN     ef ee ee fe  01 00 00 00  ........              1274.1.0        
               03 00 00 00               ....                  1274.1.8        
  27    IN     4f 4b 00                  OK.                   1275.1.0        
   7    OUT    ef ee ee fe  01 00 00 00  ........              1276.1.0        
               00 10 00 00               ....                  1276.1.8        
  27    OUT    ef ee ee fe  01 00 00 00  ........              1277.1.0        
               00 10 00 00               ....                  1277.1.8        
   7    OUT    02 00 50 e0  08 00 a5 e5  ..P.....              1278.1.0        
               03 10 c1 e0  0c 10 88 e5  ........              1278.1.8        
               a3 64 ff eb  02 00 50 e3  .d....P.              1278.1.16       
               0a 00 00 8a  09 00 a0 e1  ........              1278.1.24       
  27    OUT    02 00 50 e0  08 00 a5 e5  ..P.....              1279.1.0        
               03 10 c1 e0  0c 10 88 e5  ........              1279.1.8        
               a3 64 ff eb  02 00 50 e3  .d....P.              1279.1.16       
               0a 00 00 8a  09 00 a0 e1  ........              1279.1.24       
   7    IN     ef ee ee fe  01 00 00 00  ........              1280.1.0        
               03 00 00 00               ....                  1280.1.8        
   7    OUT                                                    1281.1.0        
   7    IN     4f 4b 00                  OK.                   1282.1.0        
  27    IN     ef ee ee fe  01 00 00 00  ........              1283.1.0        
               03 00 00 00               ....                  1283.1.8        
  27    IN     4f 4b 00                  OK.                   1284.1.0        
   7    OUT    ef ee ee fe  01 00 00 00  ........              1285.1.0        
               0d 00 00 00               ....                  1285.1.8        
  27    OUT    ef ee ee fe  01 00 00 00  ........              1286.1.0        
               0d 00 00 00               ....                  1286.1.8        
   7    OUT    4f 4b 40 30  78 38 34 33  OK@0x843              1287.1.0        
               61 37 38 63  00           a78c.                 1287.1.8        
  27    OUT    4f 4b 40 30  78 38 34 33  OK@0x843              1288.1.0        
               61 37 38 63  00           a78c.                 1288.1.8        
   7    IN     ef ee ee fe  01 00 00 00  ........              1289.1.0        
               03 00 00 00               ....                  1289.1.8        
   7    IN     4f 4b 00                  OK.                   1290.1.0        
  27    IN     ef ee ee fe  01 00 00 00  ........              1291.1.0        
               03 00 00 00               ....                  1291.1.8        
  27    IN     4f 4b 00                  OK.                   1292.1.0        
   7    OUT    ef ee ee fe  01 00 00 00  ........              1293.1.0        
               00 10 00 00               ....                  1293.1.8        
  27    OUT    ef ee ee fe  01 00 00 00  ........              1294.1.0        
               00 10 00 00               ....                  1294.1.8        
   7    OUT    20 10 0b e5  24 50 1b e5   ...$P..              1295.1.0        
               18 70 87 e2  01 a0 5a e2  .p....Z.              1295.1.8        
               64 ff ff 1a  41 00 00 ea  d...A...              1295.1.16       
               30 80 9d e5  28 90 9d e5  0...(...              1295.1.24       
  27    OUT    20 10 0b e5  24 50 1b e5   ...$P..              1296.1.0        
               18 70 87 e2  01 a0 5a e2  .p....Z.              1296.1.8        
               64 ff ff 1a  41 00 00 ea  d...A...              1296.1.16       
               30 80 9d e5  28 90 9d e5  0...(...              1296.1.24       
   7    OUT                                                    1297.1.0        
   7    IN     ef ee ee fe  01 00 00 00  ........              1298.1.0        
               03 00 00 00               ....                  1298.1.8        
   7    IN     4f 4b 00                  OK.                   1299.1.0        
  27    IN     ef ee ee fe  01 00 00 00  ........              1300.1.0        
               03 00 00 00               ....                  1300.1.8        
  27    IN     4f 4b 00                  OK.                   1301.1.0        
   7    OUT    ef ee ee fe  01 00 00 00  ........              1302.1.0        
               0d 00 00 00               ....                  1302.1.8        
  27    OUT    ef ee ee fe  01 00 00 00  ........              1303.1.0        
               0d 00 00 00               ....                  1303.1.8        
   7    OUT    4f 4b 40 30  78 61 30 61  OK@0xa0a              1304.1.0        
               34 38 62 66  00           48bf.                 1304.1.8        
  27    OUT    4f 4b 40 30  78 61 30 61  OK@0xa0a              1305.1.0        
               34 38 62 66  00           48bf.                 1305.1.8        
   7    IN     ef ee ee fe  01 00 00 00  ........              1306.1.0        
               03 00 00 00               ....                  1306.1.8        
   7    IN     4f 4b 00                  OK.                   1307.1.0        
  27    IN     ef ee ee fe  01 00 00 00  ........              1308.1.0        
               03 00 00 00               ....                  1308.1.8        
  27    IN     4f 4b 00                  OK.                   1309.1.0        
   7    OUT    ef ee ee fe  01 00 00 00  ........              1310.1.0        
               00 10 00 00               ....                  1310.1.8        
  27    OUT    ef ee ee fe  01 00 00 00  ........              1311.1.0        
               00 10 00 00               ....                  1311.1.8        
   7    OUT    8f f6 ff eb  00 00 96 e5  ........              1312.1.0        
               05 20 a0 e1  06 90 a0 e1  . ......              1312.1.8        
               10 70 90 e5  14 50 90 e5  .p...P..              1312.1.16       
               00 00 d2 e5  02 00 10 e3  ........              1312.1.24       
  27    OUT    8f f6 ff eb  00 00 96 e5  ........              1313.1.0        
               05 20 a0 e1  06 90 a0 e1  . ......              1313.1.8        
               10 70 90 e5  14 50 90 e5  .p...P..              1313.1.16       
               00 00 d2 e5  02 00 10 e3  ........              1313.1.24       
   7    OUT                                                    1314.1.0        
   7    IN     ef ee ee fe  01 00 00 00  ........              1315.1.0        
               03 00 00 00               ....                  1315.1.8        
   7    IN     4f 4b 00                  OK.                   1316.1.0        
  27    IN     ef ee ee fe  01 00 00 00  ........              1317.1.0        
               03 00 00 00               ....                  1317.1.8        
  27    IN     4f 4b 00                  OK.                   1318.1.0        
   7    OUT    ef ee ee fe  01 00 00 00  ........              1319.1.0        
               0e 00 00 00               ....                  1319.1.8        
  27    OUT    ef ee ee fe  01 00 00 00  ........              1320.1.0        
               0e 00 00 00               ....                  1320.1.8        
   7    OUT    4f 4b 40 30  78 65 36 66  OK@0xe6f              1321.1.0        
               66 61 64 39  64 00        fad9d.                1321.1.8        
  27    OUT    4f 4b 40 30  78 65 36 66  OK@0xe6f              1322.1.0        
               66 61 64 39  64 00        fad9d.                1322.1.8        
   7    IN     ef ee ee fe  01 00 00 00  ........              1323.1.0        
               03 00 00 00               ....                  1323.1.8        
  27    IN     ef ee ee fe  01 00 00 00  ........              1324.1.0        
               03 00 00 00               ....                  1324.1.8        
   7    IN     4f 4b 00                  OK.                   1325.1.0        
  27    IN     4f 4b 00                  OK.                   1326.1.0        
   7    OUT    ef ee ee fe  01 00 00 00  ........              1327.1.0        
               00 10 00 00               ....                  1327.1.8        
  27    OUT    ef ee ee fe  01 00 00 00  ........              1328.1.0        
               00 10 00 00               ....                  1328.1.8        
   7    OUT    33 ff 2f e1  00 00 50 e3  3./...P.              1329.1.0        
               08 00 00 0a  00 50 a0 e1  .....P..              1329.1.8        
               a3 58 ff eb  04 00 50 e3  .X....P.              1329.1.16       
               ce ff ff 8a  90 06 03 e3  ........              1329.1.24       
  27    OUT    33 ff 2f e1  00 00 50 e3  3./...P.              1330.1.0        
               08 00 00 0a  00 50 a0 e1  .....P..              1330.1.8        
               a3 58 ff eb  04 00 50 e3  .X....P.              1330.1.16       
               ce ff ff 8a  90 06 03 e3  ........              1330.1.24       
   7    OUT                                                    1331.1.0        
   7    IN     ef ee ee fe  01 00 00 00  ........              1332.1.0        
               03 00 00 00               ....                  1332.1.8        
   7    IN     4f 4b 00                  OK.                   1333.1.0        
  27    IN     ef ee ee fe  01 00 00 00  ........              1334.1.0        
               03 00 00 00               ....                  1334.1.8        
  27    IN     4f 4b 00                  OK.                   1335.1.0        
   7    OUT    ef ee ee fe  01 00 00 00  ........              1336.1.0        
               0e 00 00 00               ....                  1336.1.8        
  27    OUT    ef ee ee fe  01 00 00 00  ........              1337.1.0        
               0e 00 00 00               ....                  1337.1.8        
   7    OUT    4f 4b 40 30  78 61 39 61  OK@0xa9a              1338.1.0        
               65 36 32 34  30 00        e6240.                1338.1.8        
  27    OUT    4f 4b 40 30  78 61 39 61  OK@0xa9a              1339.1.0        
               65 36 32 34  30 00        e6240.                1339.1.8        
   7    IN     ef ee ee fe  01 00 00 00  ........              1340.1.0        
               03 00 00 00               ....                  1340.1.8        
  27    IN     ef ee ee fe  01 00 00 00  ........              1341.1.0        
               03 00 00 00               ....                  1341.1.8        
   7    IN     4f 4b 00                  OK.                   1342.1.0        
  27    IN     4f 4b 00                  OK.                   1343.1.0        
   7    OUT    ef ee ee fe  01 00 00 00  ........              1344.1.0        
               00 10 00 00               ....                  1344.1.8        
  27    OUT    ef ee ee fe  01 00 00 00  ........              1345.1.0        
               00 10 00 00               ....                  1345.1.8        
   7    OUT    4b f2 06 02  09 90 c4 f2  K.......              1346.1.0        
               04 02 28 46  29 46 00 23  ..(F)F.#              1346.1.8        
               cd e9 00 a6  dc f7 a4 ec  ........              1346.1.16       
               b0 b3 dd f8  24 80 44 f6  ....$.D.              1346.1.24       
  27    OUT    4b f2 06 02  09 90 c4 f2  K.......              1347.1.0        
               04 02 28 46  29 46 00 23  ..(F)F.#              1347.1.8        
               cd e9 00 a6  dc f7 a4 ec  ........              1347.1.16       
               b0 b3 dd f8  24 80 44 f6  ....$.D.              1347.1.24       
   7    OUT                                                    1348.1.0        
   7    IN     ef ee ee fe  01 00 00 00  ........              1349.1.0        
               03 00 00 00               ....                  1349.1.8        
  27    IN     ef ee ee fe  01 00 00 00  ........              1350.1.0        
               03 00 00 00               ....                  1350.1.8        
   7    IN     4f 4b 00                  OK.                   1351.1.0        
  27    IN     4f 4b 00                  OK.                   1352.1.0        
   7    OUT    ef ee ee fe  01 00 00 00  ........              1353.1.0        
               0e 00 00 00               ....                  1353.1.8        
  27    OUT    ef ee ee fe  01 00 00 00  ........              1354.1.0        
               0e 00 00 00               ....                  1354.1.8        
   7    OUT    4f 4b 40 30  78 33 64 39  OK@0x3d9              1355.1.0        
               34 66 66 62  30 00        4ffb0.                1355.1.8        
  27    OUT    4f 4b 40 30  78 33 64 39  OK@0x3d9              1356.1.0        
               34 66 66 62  30 00        4ffb0.                1356.1.8        
   7    IN     ef ee ee fe  01 00 00 00  ........              1357.1.0        
               03 00 00 00               ....                  1357.1.8        
  27    IN     ef ee ee fe  01 00 00 00  ........              1358.1.0        
               03 00 00 00               ....                  1358.1.8        
   7    IN     4f 4b 00                  OK.                   1359.1.0        
  27    IN     4f 4b 00                  OK.                   1360.1.0        
   7    OUT    ef ee ee fe  01 00 00 00  ........              1361.1.0        
               00 10 00 00               ....                  1361.1.8        
  27    OUT    ef ee ee fe  01 00 00 00  ........              1362.1.0        
               00 10 00 00               ....                  1362.1.8        
   7    OUT    fb d1 01 33  2a 44 07 2b  ...3*D.+              1363.1.0        
               eb d1 07 26  4f f0 00 0e  ...&O...              1363.1.8        
               00 25 58 f8  26 40 00 2c  .%X.&@.,              1363.1.16       
               20 46 18 bf  01 20 5f ea   F... _.              1363.1.24       
  27    OUT    fb d1 01 33  2a 44 07 2b  ...3*D.+              1364.1.0        
               eb d1 07 26  4f f0 00 0e  ...&O...              1364.1.8        
               00 25 58 f8  26 40 00 2c  .%X.&@.,              1364.1.16       
               20 46 18 bf  01 20 5f ea   F... _.              1364.1.24       
   7    OUT                                                    1365.1.0        
   7    IN     ef ee ee fe  01 00 00 00  ........              1366.1.0        
               03 00 00 00               ....                  1366.1.8        
   7    IN     4f 4b 00                  OK.                   1367.1.0        
  27    IN     ef ee ee fe  01 00 00 00  ........              1368.1.0        
               03 00 00 00               ....                  1368.1.8        
  27    IN     4f 4b 00                  OK.                   1369.1.0        
   7    OUT    ef ee ee fe  01 00 00 00  ........              1370.1.0        
               0e 00 00 00               ....                  1370.1.8        
  27    OUT    ef ee ee fe  01 00 00 00  ........              1371.1.0        
               0e 00 00 00               ....                  1371.1.8        
   7    OUT    4f 4b 40 30  78 34 34 38  OK@0x448              1372.1.0        
               31 34 35 36  34 00        14564.                1372.1.8        
  27    OUT    4f 4b 40 30  78 34 34 38  OK@0x448              1373.1.0        
               31 34 35 36  34 00        14564.                1373.1.8        
   7    IN     ef ee ee fe  01 00 00 00  ........              1374.1.0        
               03 00 00 00               ....                  1374.1.8        
   7    IN     4f 4b 00                  OK.                   1375.1.0        
  27    IN     ef ee ee fe  01 00 00 00  ........              1376.1.0        
               03 00 00 00               ....                  1376.1.8        
  27    IN     4f 4b 00                  OK.                   1377.1.0        
   7    OUT    ef ee ee fe  01 00 00 00  ........              1378.1.0        
               00 10 00 00               ....                  1378.1.8        
  27    OUT    ef ee ee fe  01 00 00 00  ........              1379.1.0        
               00 10 00 00               ....                  1379.1.8        
   7    OUT    03 00 00 1a  b6 30 d0 e1  .....0..              1380.1.0        
               04 00 53 e3  e1 ff ff 1a  ..S.....              1380.1.8        
               f0 ff ff ea  00 70 88 e5  .....p..              1380.1.16       
               1c d0 4b e2  f0 8f bd e8  ..K.....              1380.1.24       
  27    OUT    03 00 00 1a  b6 30 d0 e1  .....0..              1381.1.0        
               04 00 53 e3  e1 ff ff 1a  ..S.....              1381.1.8        
               f0 ff ff ea  00 70 88 e5  .....p..              1381.1.16       
               1c d0 4b e2  f0 8f bd e8  ..K.....              1381.1.24       
   7    OUT                                                    1382.1.0        
   7    IN     ef ee ee fe  01 00 00 00  ........              1383.1.0        
               03 00 00 00               ....                  1383.1.8        
  27    IN     ef ee ee fe  01 00 00 00  ........              1384.1.0        
               03 00 00 00               ....                  1384.1.8        
   7    IN     4f 4b 00                  OK.                   1385.1.0        
  27    IN     4f 4b 00                  OK.                   1386.1.0        
   7    OUT    ef ee ee fe  01 00 00 00  ........              1387.1.0        
               0e 00 00 00               ....                  1387.1.8        
  27    OUT    ef ee ee fe  01 00 00 00  ........              1388.1.0        
               0e 00 00 00               ....                  1388.1.8        
   7    OUT    4f 4b 40 30  78 33 39 36  OK@0x396              1389.1.0        
               38 35 35 32  32 00        85522.                1389.1.8        
  27    OUT    4f 4b 40 30  78 33 39 36  OK@0x396              1390.1.0        
               38 35 35 32  32 00        85522.                1390.1.8        
   7    IN     ef ee ee fe  01 00 00 00  ........              1391.1.0        
               03 00 00 00               ....                  1391.1.8        
  27    IN     ef ee ee fe  01 00 00 00  ........              1392.1.0        
               03 00 00 00               ....                  1392.1.8        
   7    IN     4f 4b 00                  OK.                   1393.1.0        
  27    IN     4f 4b 00                  OK.                   1394.1.0        
   7    OUT    ef ee ee fe  01 00 00 00  ........              1395.1.0        
               00 10 00 00               ....                  1395.1.8        
  27    OUT    ef ee ee fe  01 00 00 00  ........              1396.1.0        
               00 10 00 00               ....                  1396.1.8        
   7    OUT    d8 00 08 e3  06 00 44 e3  ......D.              1397.1.0        
               00 10 90 e5  01 00 a0 e3  ........              1397.1.8        
               00 00 51 e3  0d 00 00 0a  ..Q.....              1397.1.16       
               02 00 51 e3  05 00 00 0a  ..Q.....              1397.1.24       
  27    OUT    d8 00 08 e3  06 00 44 e3  ......D.              1398.1.0        
               00 10 90 e5  01 00 a0 e3  ........              1398.1.8        
               00 00 51 e3  0d 00 00 0a  ..Q.....              1398.1.16       
               02 00 51 e3  05 00 00 0a  ..Q.....              1398.1.24       
   7    OUT                                                    1399.1.0        
   7    IN     ef ee ee fe  01 00 00 00  ........              1400.1.0        
               03 00 00 00               ....                  1400.1.8        
  27    IN     ef ee ee fe  01 00 00 00  ........              1401.1.0        
               03 00 00 00               ....                  1401.1.8        
   7    IN     4f 4b 00                  OK.                   1402.1.0        
  27    IN     4f 4b 00                  OK.                   1403.1.0        
   7    OUT    ef ee ee fe  01 00 00 00  ........              1404.1.0        
               0e 00 00 00               ....                  1404.1.8        
  27    OUT    ef ee ee fe  01 00 00 00  ........              1405.1.0        
               0e 00 00 00               ....                  1405.1.8        
   7    OUT    4f 4b 40 30  78 63 36 39  OK@0xc69              1406.1.0        
               66 36 61 64  33 00        f6ad3.                1406.1.8        
  27    OUT    4f 4b 40 30  78 63 36 39  OK@0xc69              1407.1.0        
               66 36 61 64  33 00        f6ad3.                1407.1.8        
   7    IN     ef ee ee fe  01 00 00 00  ........              1408.1.0        
               03 00 00 00               ....                  1408.1.8        
  27    IN     ef ee ee fe  01 00 00 00  ........              1409.1.0        
               03 00 00 00               ....                  1409.1.8        
   7    IN     4f 4b 00                  OK.                   1410.1.0        
  27    IN     4f 4b 00                  OK.                   1411.1.0        
   7    OUT    ef ee ee fe  01 00 00 00  ........              1412.1.0        
               00 10 00 00               ....                  1412.1.8        
  27    OUT    ef ee ee fe  01 00 00 00  ........              1413.1.0        
               00 10 00 00               ....                  1413.1.8        
   7    OUT    6c 75 0c e3  04 00 50 e3  lu....P.              1414.1.0        
               05 70 44 e3  08 00 00 8a  .pD.....              1414.1.8        
               00 20 97 e5  c3 04 05 e3  . ......              1414.1.16       
               16 1f 04 e3  05 00 44 e3  ......D.              1414.1.24       
  27    OUT    6c 75 0c e3  04 00 50 e3  lu....P.              1415.1.0        
               05 70 44 e3  08 00 00 8a  .pD.....              1415.1.8        
               00 20 97 e5  c3 04 05 e3  . ......              1415.1.16       
               16 1f 04 e3  05 00 44 e3  ......D.              1415.1.24       
   7    OUT                                                    1416.1.0        
   7    IN     ef ee ee fe  01 00 00 00  ........              1417.1.0        
               03 00 00 00               ....                  1417.1.8        
  27    IN     ef ee ee fe  01 00 00 00  ........              1418.1.0        
               03 00 00 00               ....                  1418.1.8        
   7    IN     4f 4b 00                  OK.                   1419.1.0        
  27    IN     4f 4b 00                  OK.                   1420.1.0        
   7    OUT    ef ee ee fe  01 00 00 00  ........              1421.1.0        
               0e 00 00 00               ....                  1421.1.8        
  27    OUT    ef ee ee fe  01 00 00 00  ........              1422.1.0        
               0e 00 00 00               ....                  1422.1.8        
   7    OUT    4f 4b 40 30  78 62 39 31  OK@0xb91              1423.1.0        
               65 65 62 61  34 00        eeba4.                1423.1.8        
  27    OUT    4f 4b 40 30  78 62 39 31  OK@0xb91              1424.1.0        
               65 65 62 61  34 00        eeba4.                1424.1.8        
   7    IN     ef ee ee fe  01 00 00 00  ........              1425.1.0        
               03 00 00 00               ....                  1425.1.8        
   7    IN     4f 4b 00                  OK.                   1426.1.0        
  27    IN     ef ee ee fe  01 00 00 00  ........              1427.1.0        
               03 00 00 00               ....                  1427.1.8        
  27    IN     4f 4b 00                  OK.                   1428.1.0        
   7    OUT    ef ee ee fe  01 00 00 00  ........              1429.1.0        
               00 10 00 00               ....                  1429.1.8        
  27    OUT    ef ee ee fe  01 00 00 00  ........              1430.1.0        
               00 10 00 00               ....                  1430.1.8        
   7    OUT    05 00 44 e3  05 10 44 e3  ..D...D.              1431.1.0        
               0a 20 a0 e1  79 40 ff eb  . ..y@..              1431.1.8        
               a3 40 ff eb  10 80 9d e5  .@......              1431.1.16       
               7c 52 0a e3  2a 60 00 e3  .R..*`..              1431.1.24       
  27    OUT    05 00 44 e3  05 10 44 e3  ..D...D.              1432.1.0        
               0a 20 a0 e1  79 40 ff eb  . ..y@..              1432.1.8        
               a3 40 ff eb  10 80 9d e5  .@......              1432.1.16       
               7c 52 0a e3  2a 60 00 e3  .R..*`..              1432.1.24       
   7    IN     ef ee ee fe  01 00 00 00  ........              1433.1.0        
               03 00 00 00               ....                  1433.1.8        
   7    OUT                                                    1434.1.0        
  27    IN     ef ee ee fe  01 00 00 00  ........              1435.1.0        
               03 00 00 00               ....                  1435.1.8        
   7    IN     4f 4b 00                  OK.                   1436.1.0        
  27    IN     4f 4b 00                  OK.                   1437.1.0        
   7    OUT    ef ee ee fe  01 00 00 00  ........              1438.1.0        
               0e 00 00 00               ....                  1438.1.8        
  27    OUT    ef ee ee fe  01 00 00 00  ........              1439.1.0        
               0e 00 00 00               ....                  1439.1.8        
   7    OUT    4f 4b 40 30  78 37 39 37  OK@0x797              1440.1.0        
               36 36 66 64  34 00        66fd4.                1440.1.8        
  27    OUT    4f 4b 40 30  78 37 39 37  OK@0x797              1441.1.0        
               36 36 66 64  34 00        66fd4.                1441.1.8        
   7    IN     ef ee ee fe  01 00 00 00  ........              1442.1.0        
               03 00 00 00               ....                  1442.1.8        
  27    IN     ef ee ee fe  01 00 00 00  ........              1443.1.0        
               03 00 00 00               ....                  1443.1.8        
   7    IN     4f 4b 00                  OK.                   1444.1.0        
  27    IN     4f 4b 00                  OK.                   1445.1.0        
   7    OUT    ef ee ee fe  01 00 00 00  ........              1446.1.0        
               00 10 00 00               ....                  1446.1.8        
  27    OUT    ef ee ee fe  01 00 00 00  ........              1447.1.0        
               00 10 00 00               ....                  1447.1.8        
   7    OUT    10 00 90 e5  02 1c 81 e2  ........              1448.1.0        
               01 30 92 e0  14 10 9d e5  .0......              1448.1.8        
               00 50 a1 e2  00 00 50 e3  .P....P.              1448.1.16       
               e4 fd ff 0a  22 00 00 ea  ...."...              1448.1.24       
  27    OUT    10 00 90 e5  02 1c 81 e2  ........              1449.1.0        
               01 30 92 e0  14 10 9d e5  .0......              1449.1.8        
               00 50 a1 e2  00 00 50 e3  .P....P.              1449.1.16       
               e4 fd ff 0a  22 00 00 ea  ...."...              1449.1.24       
   7    IN     ef ee ee fe  01 00 00 00  ........              1450.1.0        
               03 00 00 00               ....                  1450.1.8        
   7    IN     4f 4b 00                  OK.                   1451.1.0        
   7    OUT                                                    1452.1.0        
  27    IN     ef ee ee fe  01 00 00 00  ........              1453.1.0        
               03 00 00 00               ....                  1453.1.8        
  27    IN     4f 4b 00                  OK.                   1454.1.0        
   7    OUT    ef ee ee fe  01 00 00 00  ........              1455.1.0        
               0e 00 00 00               ....                  1455.1.8        
  27    OUT    ef ee ee fe  01 00 00 00  ........              1456.1.0        
               0e 00 00 00               ....                  1456.1.8        
   7    OUT    4f 4b 40 30  78 63 33 66  OK@0xc3f              1457.1.0        
               34 39 61 37  33 00        49a73.                1457.1.8        
  27    OUT    4f 4b 40 30  78 63 33 66  OK@0xc3f              1458.1.0        
               34 39 61 37  33 00        49a73.                1458.1.8        
   7    IN     ef ee ee fe  01 00 00 00  ........              1459.1.0        
               03 00 00 00               ....                  1459.1.8        
   7    IN     4f 4b 00                  OK.                   1460.1.0        
  27    IN     ef ee ee fe  01 00 00 00  ........              1461.1.0        
               03 00 00 00               ....                  1461.1.8        
  27    IN     4f 4b 00                  OK.                   1462.1.0        
   7    OUT    ef ee ee fe  01 00 00 00  ........              1463.1.0        
               00 10 00 00               ....                  1463.1.8        
  27    OUT    ef ee ee fe  01 00 00 00  ........              1464.1.0        
               00 10 00 00               ....                  1464.1.8        
   7    OUT    04 00 50 e3  e7 fd ff 8a  ..P.....              1465.1.0        
               ce 0a 05 e3  05 00 44 e3  ......D.              1465.1.8        
               78 38 ff eb  e3 fd ff ea  x8......              1465.1.16       
               10 80 8d e2  00 10 a0 e3  ........              1465.1.24       
  27    OUT    04 00 50 e3  e7 fd ff 8a  ..P.....              1466.1.0        
               ce 0a 05 e3  05 00 44 e3  ......D.              1466.1.8        
               78 38 ff eb  e3 fd ff ea  x8......              1466.1.16       
               10 80 8d e2  00 10 a0 e3  ........              1466.1.24       
   7    IN     ef ee ee fe  01 00 00 00  ........              1467.1.0        
               03 00 00 00               ....                  1467.1.8        
   7    OUT                                                    1468.1.0        
  27    IN     ef ee ee fe  01 00 00 00  ........              1469.1.0        
               03 00 00 00               ....                  1469.1.8        
   7    IN     4f 4b 00                  OK.                   1470.1.0        
  27    IN     4f 4b 00                  OK.                   1471.1.0        
   7    OUT    ef ee ee fe  01 00 00 00  ........              1472.1.0        
               0e 00 00 00               ....                  1472.1.8        
  27    OUT    ef ee ee fe  01 00 00 00  ........              1473.1.0        
               0e 00 00 00               ....                  1473.1.8        
   7    OUT    4f 4b 40 30  78 39 33 32  OK@0x932              1474.1.0        
               66 34 31 33  66 00        f413f.                1474.1.8        
  27    OUT    4f 4b 40 30  78 39 33 32  OK@0x932              1475.1.0        
               66 34 31 33  66 00        f413f.                1475.1.8        
   7    IN     ef ee ee fe  01 00 00 00  ........              1476.1.0        
               03 00 00 00               ....                  1476.1.8        
  27    IN     ef ee ee fe  01 00 00 00  ........              1477.1.0        
               03 00 00 00               ....                  1477.1.8        
   7    IN     4f 4b 00                  OK.                   1478.1.0        
  27    IN     4f 4b 00                  OK.                   1479.1.0        
   7    OUT    ef ee ee fe  01 00 00 00  ........              1480.1.0        
               00 10 00 00               ....                  1480.1.8        
  27    OUT    ef ee ee fe  01 00 00 00  ........              1481.1.0        
               00 10 00 00               ....                  1481.1.8        
   7    OUT    07 e0 d0 e5  0c 3c 83 e1  .....<..              1482.1.0        
               02 24 83 e1  0e 20 82 e1  .$... ..              1482.1.8        
               98 20 01 e5  09 30 d0 e5  . ...0..              1482.1.16       
               08 c0 d0 e5  0a 20 d0 e5  ..... ..              1482.1.24       
  27    OUT    07 e0 d0 e5  0c 3c 83 e1  .....<..              1483.1.0        
               02 24 83 e1  0e 20 82 e1  .$... ..              1483.1.8        
               98 20 01 e5  09 30 d0 e5  . ...0..              1483.1.16       
               08 c0 d0 e5  0a 20 d0 e5  ..... ..              1483.1.24       
   7    OUT                                                    1484.1.0        
   7    IN     ef ee ee fe  01 00 00 00  ........              1485.1.0        
               03 00 00 00               ....                  1485.1.8        
   7    IN     4f 4b 00                  OK.                   1486.1.0        
  27    IN     ef ee ee fe  01 00 00 00  ........              1487.1.0        
               03 00 00 00               ....                  1487.1.8        
  27    IN     4f 4b 00                  OK.                   1488.1.0        
   7    OUT    ef ee ee fe  01 00 00 00  ........              1489.1.0        
               0e 00 00 00               ....                  1489.1.8        
  27    OUT    ef ee ee fe  01 00 00 00  ........              1490.1.0        
               0e 00 00 00               ....                  1490.1.8        
   7    OUT    4f 4b 40 30  78 39 33 62  OK@0x93b              1491.1.0        
               32 66 62 38  32 00        2fb82.                1491.1.8        
  27    OUT    4f 4b 40 30  78 39 33 62  OK@0x93b              1492.1.0        
               32 66 62 38  32 00        2fb82.                1492.1.8        
   7    IN     ef ee ee fe  01 00 00 00  ........              1493.1.0        
               03 00 00 00               ....                  1493.1.8        
   7    IN     4f 4b 00                  OK.                   1494.1.0        
  27    IN     ef ee ee fe  01 00 00 00  ........              1495.1.0        
               03 00 00 00               ....                  1495.1.8        
  27    IN     4f 4b 00                  OK.                   1496.1.0        
   7    OUT    ef ee ee fe  01 00 00 00  ........              1497.1.0        
               00 10 00 00               ....                  1497.1.8        
  27    OUT    ef ee ee fe  01 00 00 00  ........              1498.1.0        
               00 10 00 00               ....                  1498.1.8        
   7    OUT    14 20 91 15  00 00 52 11  . ....R.              1499.1.0        
               31 00 00 0a  18 20 91 e5  1.... ..              1499.1.8        
               00 00 52 e1  1c 20 91 15  ..R.. ..              1499.1.16       
               00 00 52 11  2c 00 00 0a  ..R.,...              1499.1.24       
  27    OUT    14 20 91 15  00 00 52 11  . ....R.              1500.1.0        
               31 00 00 0a  18 20 91 e5  1.... ..              1500.1.8        
               00 00 52 e1  1c 20 91 15  ..R.. ..              1500.1.16       
               00 00 52 11  2c 00 00 0a  ..R.,...              1500.1.24       
   7    OUT                                                    1501.1.0        
   7    IN     ef ee ee fe  01 00 00 00  ........              1502.1.0        
               03 00 00 00               ....                  1502.1.8        
   7    IN     4f 4b 00                  OK.                   1503.1.0        
  27    IN     ef ee ee fe  01 00 00 00  ........              1504.1.0        
               03 00 00 00               ....                  1504.1.8        
  27    IN     4f 4b 00                  OK.                   1505.1.0        
   7    OUT    ef ee ee fe  01 00 00 00  ........              1506.1.0        
               0e 00 00 00               ....                  1506.1.8        
  27    OUT    ef ee ee fe  01 00 00 00  ........              1507.1.0        
               0e 00 00 00               ....                  1507.1.8        
   7    OUT    4f 4b 40 30  78 64 63 37  OK@0xdc7              1508.1.0        
               61 34 33 31  31 00        a4311.                1508.1.8        
  27    OUT    4f 4b 40 30  78 64 63 37  OK@0xdc7              1509.1.0        
               61 34 33 31  31 00        a4311.                1509.1.8        
   7    IN     ef ee ee fe  01 00 00 00  ........              1510.1.0        
               03 00 00 00               ....                  1510.1.8        
   7    IN     4f 4b 00                  OK.                   1511.1.0        
  27    IN     ef ee ee fe  01 00 00 00  ........              1512.1.0        
               03 00 00 00               ....                  1512.1.8        
  27    IN     4f 4b 00                  OK.                   1513.1.0        
   7    OUT    ef ee ee fe  01 00 00 00  ........              1514.1.0        
               00 10 00 00               ....                  1514.1.8        
  27    OUT    ef ee ee fe  01 00 00 00  ........              1515.1.0        
               00 10 00 00               ....                  1515.1.8        
   7    OUT    06 3d a0 e3  00 a0 8d e5  .=......              1516.1.0        
               bd 19 00 eb  06 0d a0 e3  ........              1516.1.8        
               05 10 a0 e1  01 04 8d e9  ........              1516.1.16       
               09 00 a0 e1  04 20 a0 e1  ..... ..              1516.1.24       
  27    OUT    06 3d a0 e3  00 a0 8d e5  .=......              1517.1.0        
               bd 19 00 eb  06 0d a0 e3  ........              1517.1.8        
               05 10 a0 e1  01 04 8d e9  ........              1517.1.16       
               09 00 a0 e1  04 20 a0 e1  ..... ..              1517.1.24       
   7    IN     ef ee ee fe  01 00 00 00  ........              1518.1.0        
               03 00 00 00               ....                  1518.1.8        
   7    IN     4f 4b 00                  OK.                   1519.1.0        
   7    OUT                                                    1520.1.0        
  27    IN     ef ee ee fe  01 00 00 00  ........              1521.1.0        
               03 00 00 00               ....                  1521.1.8        
  27    IN     4f 4b 00                  OK.                   1522.1.0        
   7    OUT    ef ee ee fe  01 00 00 00  ........              1523.1.0        
               0e 00 00 00               ....                  1523.1.8        
  27    OUT    ef ee ee fe  01 00 00 00  ........              1524.1.0        
               0e 00 00 00               ....                  1524.1.8        
   7    OUT    4f 4b 40 30  78 65 32 61  OK@0xe2a              1525.1.0        
               37 35 61 38  35 00        75a85.                1525.1.8        
  27    OUT    4f 4b 40 30  78 65 32 61  OK@0xe2a              1526.1.0        
               37 35 61 38  35 00        75a85.                1526.1.8        
   7    IN     ef ee ee fe  01 00 00 00  ........              1527.1.0        
               03 00 00 00               ....                  1527.1.8        
   7    IN     4f 4b 00                  OK.                   1528.1.0        
  27    IN     ef ee ee fe  01 00 00 00  ........              1529.1.0        
               03 00 00 00               ....                  1529.1.8        
  27    IN     4f 4b 00                  OK.                   1530.1.0        
   7    OUT    ef ee ee fe  01 00 00 00  ........              1531.1.0        
               00 10 00 00               ....                  1531.1.8        
  27    OUT    ef ee ee fe  01 00 00 00  ........              1532.1.0        
               00 10 00 00               ....                  1532.1.8        
   7    OUT    89 80 a0 e1  01 00 5a e3  ......Z.              1533.1.0        
               34 00 00 ba  20 08 0b e3  4... ...              1533.1.8        
               06 00 44 e3  09 01 80 e0  ..D.....              1533.1.16       
               06 c0 80 e2  01 00 44 e2  ......D.              1533.1.24       
  27    OUT    89 80 a0 e1  01 00 5a e3  ......Z.              1534.1.0        
               34 00 00 ba  20 08 0b e3  4... ...              1534.1.8        
               06 00 44 e3  09 01 80 e0  ..D.....              1534.1.16       
               06 c0 80 e2  01 00 44 e2  ......D.              1534.1.24       
   7    OUT                                                    1535.1.0        
   7    IN     ef ee ee fe  01 00 00 00  ........              1536.1.0        
               03 00 00 00               ....                  1536.1.8        
  27    IN     ef ee ee fe  01 00 00 00  ........              1537.1.0        
               03 00 00 00               ....                  1537.1.8        
   7    IN     4f 4b 00                  OK.                   1538.1.0        
  27    IN     4f 4b 00                  OK.                   1539.1.0        
   7    OUT    ef ee ee fe  01 00 00 00  ........              1540.1.0        
               0e 00 00 00               ....                  1540.1.8        
  27    OUT    ef ee ee fe  01 00 00 00  ........              1541.1.0        
               0e 00 00 00               ....                  1541.1.8        
   7    OUT    4f 4b 40 30  78 36 32 36  OK@0x626              1542.1.0        
               66 33 36 32  35 00        f3625.                1542.1.8        
  27    OUT    4f 4b 40 30  78 36 32 36  OK@0x626              1543.1.0        
               66 33 36 32  35 00        f3625.                1543.1.8        
   7    IN     ef ee ee fe  01 00 00 00  ........              1544.1.0        
               03 00 00 00               ....                  1544.1.8        
   7    IN     4f 4b 00                  OK.                   1545.1.0        
  27    IN     ef ee ee fe  01 00 00 00  ........              1546.1.0        
               03 00 00 00               ....                  1546.1.8        
  27    IN     4f 4b 00                  OK.                   1547.1.0        
   7    OUT    ef ee ee fe  01 00 00 00  ........              1548.1.0        
               00 10 00 00               ....                  1548.1.8        
  27    OUT    ef ee ee fe  01 00 00 00  ........              1549.1.0        
               00 10 00 00               ....                  1549.1.8        
   7    OUT    01 70 a0 e1  f8 2f ff eb  .p.../..              1550.1.0        
               00 00 50 e3  81 00 00 0a  ..P.....              1550.1.8        
               00 40 a0 e1  01 0b a0 e3  .@......              1550.1.16       
               f3 2f ff eb  00 00 50 e3  ./....P.              1550.1.24       
  27    OUT    01 70 a0 e1  f8 2f ff eb  .p.../..              1551.1.0        
               00 00 50 e3  81 00 00 0a  ..P.....              1551.1.8        
               00 40 a0 e1  01 0b a0 e3  .@......              1551.1.16       
               f3 2f ff eb  00 00 50 e3  ./....P.              1551.1.24       
   7    OUT                                                    1552.1.0        
   7    IN     ef ee ee fe  01 00 00 00  ........              1553.1.0        
               03 00 00 00               ....                  1553.1.8        
   7    IN     4f 4b 00                  OK.                   1554.1.0        
  27    IN     ef ee ee fe  01 00 00 00  ........              1555.1.0        
               03 00 00 00               ....                  1555.1.8        
  27    IN     4f 4b 00                  OK.                   1556.1.0        
   7    OUT    ef ee ee fe  01 00 00 00  ........              1557.1.0        
               0e 00 00 00               ....                  1557.1.8        
  27    OUT    ef ee ee fe  01 00 00 00  ........              1558.1.0        
               0e 00 00 00               ....                  1558.1.8        
   7    OUT    4f 4b 40 30  78 39 36 32  OK@0x962              1559.1.0        
               66 37 32 61  32 00        f72a2.                1559.1.8        
  27    OUT    4f 4b 40 30  78 39 36 32  OK@0x962              1560.1.0        
               66 37 32 61  32 00        f72a2.                1560.1.8        
   7    IN     ef ee ee fe  01 00 00 00  ........              1561.1.0        
               03 00 00 00               ....                  1561.1.8        
  27    IN     ef ee ee fe  01 00 00 00  ........              1562.1.0        
               03 00 00 00               ....                  1562.1.8        
   7    IN     4f 4b 00                  OK.                   1563.1.0        
  27    IN     4f 4b 00                  OK.                   1564.1.0        
   7    OUT    ef ee ee fe  01 00 00 00  ........              1565.1.0        
               00 10 00 00               ....                  1565.1.8        
  27    OUT    ef ee ee fe  01 00 00 00  ........              1566.1.0        
               00 10 00 00               ....                  1566.1.8        
   7    OUT    1c d0 4b e2  f0 8f bd e8  ..K.....              1567.1.0        
               00 00 a0 e3  00 00 8e e5  ........              1567.1.8        
               09 00 a0 e1  00 00 58 e3  ......X.              1567.1.16       
               01 00 49 02  1c d0 4b e2  ..I...K.              1567.1.24       
  27    OUT    1c d0 4b e2  f0 8f bd e8  ..K.....              1568.1.0        
               00 00 a0 e3  00 00 8e e5  ........              1568.1.8        
               09 00 a0 e1  00 00 58 e3  ......X.              1568.1.16       
               01 00 49 02  1c d0 4b e2  ..I...K.              1568.1.24       
   7    OUT                                                    1569.1.0        
   7    IN     ef ee ee fe  01 00 00 00  ........              1570.1.0        
               03 00 00 00               ....                  1570.1.8        
  27    IN     ef ee ee fe  01 00 00 00  ........              1571.1.0        
               03 00 00 00               ....                  1571.1.8        
   7    IN     4f 4b 00                  OK.                   1572.1.0        
  27    IN     4f 4b 00                  OK.                   1573.1.0        
   7    OUT    ef ee ee fe  01 00 00 00  ........              1574.1.0        
               0e 00 00 00               ....                  1574.1.8        
  27    OUT    ef ee ee fe  01 00 00 00  ........              1575.1.0        
               0e 00 00 00               ....                  1575.1.8        
   7    OUT    4f 4b 40 30  78 39 39 38  OK@0x998              1576.1.0        
               65 32 34 33  63 00        e243c.                1576.1.8        
  27    OUT    4f 4b 40 30  78 39 39 38  OK@0x998              1577.1.0        
               65 32 34 33  63 00        e243c.                1577.1.8        
   7    IN     ef ee ee fe  01 00 00 00  ........              1578.1.0        
               03 00 00 00               ....                  1578.1.8        
   7    IN     4f 4b 00                  OK.                   1579.1.0        
  27    IN     ef ee ee fe  01 00 00 00  ........              1580.1.0        
               03 00 00 00               ....                  1580.1.8        
  27    IN     4f 4b 00                  OK.                   1581.1.0        
   7    OUT    ef ee ee fe  01 00 00 00  ........              1582.1.0        
               00 10 00 00               ....                  1582.1.8        
  27    OUT    ef ee ee fe  01 00 00 00  ........              1583.1.0        
               00 10 00 00               ....                  1583.1.8        
   7    OUT    e7 ff ff 3a  05 20 89 e0  ...:. ..              1584.1.0        
               05 00 40 e0  30 00 57 e3  ..@.0.W.              1584.1.8        
               00 20 88 e5  e1 ff ff 1a  . ......              1584.1.16       
               01 00 50 e3  00 00 8a e5  ..P.....              1584.1.24       
  27    OUT    e7 ff ff 3a  05 20 89 e0  ...:. ..              1585.1.0        
               05 00 40 e0  30 00 57 e3  ..@.0.W.              1585.1.8        
               00 20 88 e5  e1 ff ff 1a  . ......              1585.1.16       
               01 00 50 e3  00 00 8a e5  ..P.....              1585.1.24       
   7    OUT                                                    1586.1.0        
   7    IN     ef ee ee fe  01 00 00 00  ........              1587.1.0        
               03 00 00 00               ....                  1587.1.8        
   7    IN     4f 4b 00                  OK.                   1588.1.0        
  27    IN     ef ee ee fe  01 00 00 00  ........              1589.1.0        
               03 00 00 00               ....                  1589.1.8        
  27    IN     4f 4b 00                  OK.                   1590.1.0        
   7    OUT    ef ee ee fe  01 00 00 00  ........              1591.1.0        
               0e 00 00 00               ....                  1591.1.8        
  27    OUT    ef ee ee fe  01 00 00 00  ........              1592.1.0        
               0e 00 00 00               ....                  1592.1.8        
   7    OUT    4f 4b 40 30  78 33 31 65  OK@0x31e              1593.1.0        
               64 36 64 32  37 00        d6d27.                1593.1.8        
  27    OUT    4f 4b 40 30  78 33 31 65  OK@0x31e              1594.1.0        
               64 36 64 32  37 00        d6d27.                1594.1.8        
   7    IN     ef ee ee fe  01 00 00 00  ........              1595.1.0        
               03 00 00 00               ....                  1595.1.8        
   7    IN     4f 4b 00                  OK.                   1596.1.0        
  27    IN     ef ee ee fe  01 00 00 00  ........              1597.1.0        
               03 00 00 00               ....                  1597.1.8        
  27    IN     4f 4b 00                  OK.                   1598.1.0        
   7    OUT    ef ee ee fe  01 00 00 00  ........              1599.1.0        
               00 10 00 00               ....                  1599.1.8        
  27    OUT    ef ee ee fe  01 00 00 00  ........              1600.1.0        
               00 10 00 00               ....                  1600.1.8        
   7    OUT    01 00 50 e3  00 00 87 e5  ..P.....              1601.1.0        
               04 00 00 ba  0c 00 a0 e3  ........              1601.1.8        
               01 80 a0 e1  57 f7 ff eb  ....W...              1601.1.16       
               00 00 50 e3  06 00 00 0a  ..P.....              1601.1.24       
  27    OUT    01 00 50 e3  00 00 87 e5  ..P.....              1602.1.0        
               04 00 00 ba  0c 00 a0 e3  ........              1602.1.8        
               01 80 a0 e1  57 f7 ff eb  ....W...              1602.1.16       
               00 00 50 e3  06 00 00 0a  ..P.....              1602.1.24       
   7    OUT                                                    1603.1.0        
   7    IN     ef ee ee fe  01 00 00 00  ........              1604.1.0        
               03 00 00 00               ....                  1604.1.8        
   7    IN     4f 4b 00                  OK.                   1605.1.0        
  27    IN     ef ee ee fe  01 00 00 00  ........              1606.1.0        
               03 00 00 00               ....                  1606.1.8        
  27    IN     4f 4b 00                  OK.                   1607.1.0        
   7    OUT    ef ee ee fe  01 00 00 00  ........              1608.1.0        
               0e 00 00 00               ....                  1608.1.8        
  27    OUT    ef ee ee fe  01 00 00 00  ........              1609.1.0        
               0e 00 00 00               ....                  1609.1.8        
   7    OUT    4f 4b 40 30  78 34 63 61  OK@0x4ca              1610.1.0        
               61 33 37 31  32 00        a3712.                1610.1.8        
  27    OUT    4f 4b 40 30  78 34 63 61  OK@0x4ca              1611.1.0        
               61 33 37 31  32 00        a3712.                1611.1.8        
   7    IN     ef ee ee fe  01 00 00 00  ........              1612.1.0        
               03 00 00 00               ....                  1612.1.8        
  27    IN     ef ee ee fe  01 00 00 00  ........              1613.1.0        
               03 00 00 00               ....                  1613.1.8        
   7    IN     4f 4b 00                  OK.                   1614.1.0        
  27    IN     4f 4b 00                  OK.                   1615.1.0        
   7    OUT    ef ee ee fe  01 00 00 00  ........              1616.1.0        
               00 10 00 00               ....                  1616.1.8        
  27    OUT    ef ee ee fe  01 00 00 00  ........              1617.1.0        
               00 10 00 00               ....                  1617.1.8        
   7    OUT    08 10 a0 e1  09 00 00 0a  ........              1618.1.0        
               02 00 a0 e3  00 00 8d e5  ........              1618.1.8        
               00 00 a0 e3  20 20 8d e2  ....  ..              1618.1.16       
               04 00 8d e5  08 00 a0 e1  ........              1618.1.24       
  27    OUT    08 10 a0 e1  09 00 00 0a  ........              1619.1.0        
               02 00 a0 e3  00 00 8d e5  ........              1619.1.8        
               00 00 a0 e3  20 20 8d e2  ....  ..              1619.1.16       
               04 00 8d e5  08 00 a0 e1  ........              1619.1.24       
   7    OUT                                                    1620.1.0        
   7    IN     ef ee ee fe  01 00 00 00  ........              1621.1.0        
               03 00 00 00               ....                  1621.1.8        
  27    IN     ef ee ee fe  01 00 00 00  ........              1622.1.0        
               03 00 00 00               ....                  1622.1.8        
   7    IN     4f 4b 00                  OK.                   1623.1.0        
  27    IN     4f 4b 00                  OK.                   1624.1.0        
   7    OUT    ef ee ee fe  01 00 00 00  ........              1625.1.0        
               0e 00 00 00               ....                  1625.1.8        
  27    OUT    ef ee ee fe  01 00 00 00  ........              1626.1.0        
               0e 00 00 00               ....                  1626.1.8        
   7    OUT    4f 4b 40 30  78 38 38 66  OK@0x88f              1627.1.0        
               62 31 31 66  63 00        b11fc.                1627.1.8        
  27    OUT    4f 4b 40 30  78 38 38 66  OK@0x88f              1628.1.0        
               62 31 31 66  63 00        b11fc.                1628.1.8        
   7    IN     ef ee ee fe  01 00 00 00  ........              1629.1.0        
               03 00 00 00               ....                  1629.1.8        
  27    IN     ef ee ee fe  01 00 00 00  ........              1630.1.0        
               03 00 00 00               ....                  1630.1.8        
   7    IN     4f 4b 00                  OK.                   1631.1.0        
  27    IN     4f 4b 00                  OK.                   1632.1.0        
   7    OUT    ef ee ee fe  01 00 00 00  ........              1633.1.0        
               00 10 00 00               ....                  1633.1.8        
  27    OUT    ef ee ee fe  01 00 00 00  ........              1634.1.0        
               00 10 00 00               ....                  1634.1.8        
   7    OUT    5f 41 4c 49  47 4e 45 44  _ALIGNED              1635.1.0        
               28 76 61 64  64 72 29 00  (vaddr).              1635.1.8        
               49 53 5f 42  4c 4f 43 4b  IS_BLOCK              1635.1.16       
               5f 41 4c 49  47 4e 45 44  _ALIGNED              1635.1.24       
  27    OUT    5f 41 4c 49  47 4e 45 44  _ALIGNED              1636.1.0        
               28 76 61 64  64 72 29 00  (vaddr).              1636.1.8        
               49 53 5f 42  4c 4f 43 4b  IS_BLOCK              1636.1.16       
               5f 41 4c 49  47 4e 45 44  _ALIGNED              1636.1.24       
   7    OUT                                                    1637.1.0        
   7    IN     ef ee ee fe  01 00 00 00  ........              1638.1.0        
               03 00 00 00               ....                  1638.1.8        
  27    IN     ef ee ee fe  01 00 00 00  ........              1639.1.0        
               03 00 00 00               ....                  1639.1.8        
   7    IN     4f 4b 00                  OK.                   1640.1.0        
  27    IN     4f 4b 00                  OK.                   1641.1.0        
   7    OUT    ef ee ee fe  01 00 00 00  ........              1642.1.0        
               0e 00 00 00               ....                  1642.1.8        
  27    OUT    ef ee ee fe  01 00 00 00  ........              1643.1.0        
               0e 00 00 00               ....                  1643.1.8        
   7    OUT    4f 4b 40 30  78 34 30 64  OK@0x40d              1644.1.0        
               33 33 37 62  31 00        337b1.                1644.1.8        
  27    OUT    4f 4b 40 30  78 34 30 64  OK@0x40d              1645.1.0        
               33 33 37 62  31 00        337b1.                1645.1.8        
   7    IN     ef ee ee fe  01 00 00 00  ........              1646.1.0        
               03 00 00 00               ....                  1646.1.8        
   7    IN     4f 4b 00                  OK.                   1647.1.0        
  27    IN     ef ee ee fe  01 00 00 00  ........              1648.1.0        
               03 00 00 00               ....                  1648.1.8        
  27    IN     4f 4b 00                  OK.                   1649.1.0        
   7    OUT    ef ee ee fe  01 00 00 00  ........              1650.1.0        
               00 10 00 00               ....                  1650.1.8        
  27    OUT    ef ee ee fe  01 00 00 00  ........              1651.1.0        
               00 10 00 00               ....                  1651.1.8        
   7    OUT    64 65 2c 20  6f 6e 6c 79  de, only              1652.1.0        
               20 63 61 6e  20 72 65 61   can rea              1652.1.8        
               64 20 6f 70  6c 75 73 72  d oplusr              1652.1.16       
               65 73 65 72  76 65 31 2c  eserve1,              1652.1.24       
  27    OUT    64 65 2c 20  6f 6e 6c 79  de, only              1653.1.0        
               20 63 61 6e  20 72 65 61   can rea              1653.1.8        
               64 20 6f 70  6c 75 73 72  d oplusr              1653.1.16       
               65 73 65 72  76 65 31 2c  eserve1,              1653.1.24       
   7    OUT                                                    1654.1.0        
   7    IN     ef ee ee fe  01 00 00 00  ........              1655.1.0        
               03 00 00 00               ....                  1655.1.8        
   7    IN     4f 4b 00                  OK.                   1656.1.0        
  27    IN     ef ee ee fe  01 00 00 00  ........              1657.1.0        
               03 00 00 00               ....                  1657.1.8        
  27    IN     4f 4b 00                  OK.                   1658.1.0        
   7    OUT    ef ee ee fe  01 00 00 00  ........              1659.1.0        
               0e 00 00 00               ....                  1659.1.8        
  27    OUT    ef ee ee fe  01 00 00 00  ........              1660.1.0        
               0e 00 00 00               ....                  1660.1.8        
   7    OUT    4f 4b 40 30  78 31 66 32  OK@0x1f2              1661.1.0        
               39 30 33 39  64 00        9039d.                1661.1.8        
  27    OUT    4f 4b 40 30  78 31 66 32  OK@0x1f2              1662.1.0        
               39 30 33 39  64 00        9039d.                1662.1.8        
   7    IN     ef ee ee fe  01 00 00 00  ........              1663.1.0        
               03 00 00 00               ....                  1663.1.8        
   7    IN     4f 4b 00                  OK.                   1664.1.0        
  27    IN     ef ee ee fe  01 00 00 00  ........              1665.1.0        
               03 00 00 00               ....                  1665.1.8        
  27    IN     4f 4b 00                  OK.                   1666.1.0        
   7    OUT    ef ee ee fe  01 00 00 00  ........              1667.1.0        
               00 10 00 00               ....                  1667.1.8        
  27    OUT    ef ee ee fe  01 00 00 00  ........              1668.1.0        
               00 10 00 00               ....                  1668.1.8        
   7    OUT    6f 3e 00 32  30 32 31 00  o>.2021.              1669.1.0        
               4f 63 74 20  31 31 20 32  Oct 11 2              1669.1.8        
               30 32 35 00  31 35 3a 31  025.15:1              1669.1.16       
               34 3a 32 32  00 44 41 2d  4:22.DA-              1669.1.24       
  27    OUT    6f 3e 00 32  30 32 31 00  o>.2021.              1670.1.0        
               4f 63 74 20  31 31 20 32  Oct 11 2              1670.1.8        
               30 32 35 00  31 35 3a 31  025.15:1              1670.1.16       
               34 3a 32 32  00 44 41 2d  4:22.DA-              1670.1.24       
   7    OUT                                                    1671.1.0        
   7    IN     ef ee ee fe  01 00 00 00  ........              1672.1.0        
               03 00 00 00               ....                  1672.1.8        
  27    IN     ef ee ee fe  01 00 00 00  ........              1673.1.0        
               03 00 00 00               ....                  1673.1.8        
   7    IN     4f 4b 00                  OK.                   1674.1.0        
  27    IN     4f 4b 00                  OK.                   1675.1.0        
   7    OUT    ef ee ee fe  01 00 00 00  ........              1676.1.0        
               0e 00 00 00               ....                  1676.1.8        
  27    OUT    ef ee ee fe  01 00 00 00  ........              1677.1.0        
               0e 00 00 00               ....                  1677.1.8        
   7    OUT    4f 4b 40 30  78 33 30 61  OK@0x30a              1678.1.0        
               32 35 35 64  61 00        255da.                1678.1.8        
  27    OUT    4f 4b 40 30  78 33 30 61  OK@0x30a              1679.1.0        
               32 35 35 64  61 00        255da.                1679.1.8        
   7    IN     ef ee ee fe  01 00 00 00  ........              1680.1.0        
               03 00 00 00               ....                  1680.1.8        
   7    IN     4f 4b 00                  OK.                   1681.1.0        
  27    IN     ef ee ee fe  01 00 00 00  ........              1682.1.0        
               03 00 00 00               ....                  1682.1.8        
  27    IN     4f 4b 00                  OK.                   1683.1.0        
   7    OUT    ef ee ee fe  01 00 00 00  ........              1684.1.0        
               00 10 00 00               ....                  1684.1.8        
  27    OUT    ef ee ee fe  01 00 00 00  ........              1685.1.0        
               00 10 00 00               ....                  1685.1.8        
   7    OUT    6e 74 65 72  20 32 6e 64  nter 2nd              1686.1.0        
               2d 44 41 2e  2a 2a 2a 0a  -DA.***.              1686.1.8        
               00 0a 2a 2a  2a 6b 6d 61  ..***kma              1686.1.16       
               69 6e 2d 70  6c 61 74 66  in-platf              1686.1.24       
  27    OUT    6e 74 65 72  20 32 6e 64  nter 2nd              1687.1.0        
               2d 44 41 2e  2a 2a 2a 0a  -DA.***.              1687.1.8        
               00 0a 2a 2a  2a 6b 6d 61  ..***kma              1687.1.16       
               69 6e 2d 70  6c 61 74 66  in-platf              1687.1.24       
   7    OUT                                                    1688.1.0        
   7    IN     ef ee ee fe  01 00 00 00  ........              1689.1.0        
               03 00 00 00               ....                  1689.1.8        
  27    IN     ef ee ee fe  01 00 00 00  ........              1690.1.0        
               03 00 00 00               ....                  1690.1.8        
   7    IN     4f 4b 00                  OK.                   1691.1.0        
  27    IN     4f 4b 00                  OK.                   1692.1.0        
   7    OUT    ef ee ee fe  01 00 00 00  ........              1693.1.0        
               0e 00 00 00               ....                  1693.1.8        
  27    OUT    ef ee ee fe  01 00 00 00  ........              1694.1.0        
               0e 00 00 00               ....                  1694.1.8        
   7    OUT    4f 4b 40 30  78 37 38 32  OK@0x782              1695.1.0        
               35 61 66 61  32 00        5afa2.                1695.1.8        
  27    OUT    4f 4b 40 30  78 37 38 32  OK@0x782              1696.1.0        
               35 61 66 61  32 00        5afa2.                1696.1.8        
   7    IN     ef ee ee fe  01 00 00 00  ........              1697.1.0        
               03 00 00 00               ....                  1697.1.8        
  27    IN     ef ee ee fe  01 00 00 00  ........              1698.1.0        
               03 00 00 00               ....                  1698.1.8        
   7    IN     4f 4b 00                  OK.                   1699.1.0        
  27    IN     4f 4b 00                  OK.                   1700.1.0        
   7    OUT    ef ee ee fe  01 00 00 00  ........              1701.1.0        
               00 10 00 00               ....                  1701.1.8        
  27    OUT    ef ee ee fe  01 00 00 00  ........              1702.1.0        
               00 10 00 00               ....                  1702.1.8        
   7    OUT    6e 74 20 6e  6f 64 65 20  nt node               1703.1.0        
               74 6f 20 70  61 72 65 6e  to paren              1703.1.8        
               74 20 3c 25  73 3e 20 6f  t <%s> o              1703.1.16       
               6e 20 6c 69  6e 65 20 25  n line %              1703.1.24       
  27    OUT    6e 74 20 6e  6f 64 65 20  nt node               1704.1.0        
               74 6f 20 70  61 72 65 6e  to paren              1704.1.8        
               74 20 3c 25  73 3e 20 6f  t <%s> o              1704.1.16       
               6e 20 6c 69  6e 65 20 25  n line %              1704.1.24       
   7    OUT                                                    1705.1.0        
   7    IN     ef ee ee fe  01 00 00 00  ........              1706.1.0        
               03 00 00 00               ....                  1706.1.8        
   7    IN     4f 4b 00                  OK.                   1707.1.0        
  27    IN     ef ee ee fe  01 00 00 00  ........              1708.1.0        
               03 00 00 00               ....                  1708.1.8        
  27    IN     4f 4b 00                  OK.                   1709.1.0        
   7    OUT    ef ee ee fe  01 00 00 00  ........              1710.1.0        
               0e 00 00 00               ....                  1710.1.8        
  27    OUT    ef ee ee fe  01 00 00 00  ........              1711.1.0        
               0e 00 00 00               ....                  1711.1.8        
   7    OUT    4f 4b 40 30  78 63 62 34  OK@0xcb4              1712.1.0        
               64 37 39 36  66 00        d796f.                1712.1.8        
  27    OUT    4f 4b 40 30  78 63 62 34  OK@0xcb4              1713.1.0        
               64 37 39 36  66 00        d796f.                1713.1.8        
   7    IN     ef ee ee fe  01 00 00 00  ........              1714.1.0        
               03 00 00 00               ....                  1714.1.8        
   7    IN     4f 4b 00                  OK.                   1715.1.0        
  27    IN     ef ee ee fe  01 00 00 00  ........              1716.1.0        
               03 00 00 00               ....                  1716.1.8        
  27    IN     4f 4b 00                  OK.                   1717.1.0        
   7    OUT    ef ee ee fe  01 00 00 00  ........              1718.1.0        
               00 10 00 00               ....                  1718.1.8        
  27    OUT    ef ee ee fe  01 00 00 00  ........              1719.1.0        
               00 10 00 00               ....                  1719.1.8        
   7    OUT    63 6d 64 5f  64 65 62 75  cmd_debu              1720.1.0        
               67 5f 65 72  72 6f 72 5f  g_error_              1720.1.8        
               63 6f 64 65  00 49 6e 76  code.Inv              1720.1.16       
               61 6c 69 64  20 70 61 72  alid par              1720.1.24       
  27    OUT    63 6d 64 5f  64 65 62 75  cmd_debu              1721.1.0        
               67 5f 65 72  72 6f 72 5f  g_error_              1721.1.8        
               63 6f 64 65  00 49 6e 76  code.Inv              1721.1.16       
               61 6c 69 64  20 70 61 72  alid par              1721.1.24       
   7    OUT                                                    1722.1.0        
   7    IN     ef ee ee fe  01 00 00 00  ........              1723.1.0        
               03 00 00 00               ....                  1723.1.8        
   7    IN     4f 4b 00                  OK.                   1724.1.0        
  27    IN     ef ee ee fe  01 00 00 00  ........              1725.1.0        
               03 00 00 00               ....                  1725.1.8        
  27    IN     4f 4b 00                  OK.                   1726.1.0        
   7    OUT    ef ee ee fe  01 00 00 00  ........              1727.1.0        
               0e 00 00 00               ....                  1727.1.8        
  27    OUT    ef ee ee fe  01 00 00 00  ........              1728.1.0        
               0e 00 00 00               ....                  1728.1.8        
   7    OUT    4f 4b 40 30  78 32 61 63  OK@0x2ac              1729.1.0        
               65 35 62 32  64 00        e5b2d.                1729.1.8        
  27    OUT    4f 4b 40 30  78 32 61 63  OK@0x2ac              1730.1.0        
               65 35 62 32  64 00        e5b2d.                1730.1.8        
   7    IN     ef ee ee fe  01 00 00 00  ........              1731.1.0        
               03 00 00 00               ....                  1731.1.8        
  27    IN     ef ee ee fe  01 00 00 00  ........              1732.1.0        
               03 00 00 00               ....                  1732.1.8        
   7    IN     4f 4b 00                  OK.                   1733.1.0        
  27    IN     4f 4b 00                  OK.                   1734.1.0        
   7    OUT    ef ee ee fe  01 00 00 00  ........              1735.1.0        
               00 10 00 00               ....                  1735.1.8        
  27    OUT    ef ee ee fe  01 00 00 00  ........              1736.1.0        
               00 10 00 00               ....                  1736.1.8        
   7    OUT    75 73 20 77  69 64 74 68  us width              1737.1.0        
               28 25 64 29  20 66 61 69  (%d) fai              1737.1.8        
               6c 65 64 0a  00 5b 53 44  led..[SD              1737.1.16       
               25 64 5d 20  53 77 69 74  %d] Swit              1737.1.24       
  27    OUT    75 73 20 77  69 64 74 68  us width              1738.1.0        
               28 25 64 29  20 66 61 69  (%d) fai              1738.1.8        
               6c 65 64 0a  00 5b 53 44  led..[SD              1738.1.16       
               25 64 5d 20  53 77 69 74  %d] Swit              1738.1.24       
   7    OUT                                                    1739.1.0        
   7    IN     ef ee ee fe  01 00 00 00  ........              1740.1.0        
               03 00 00 00               ....                  1740.1.8        
   7    IN     4f 4b 00                  OK.                   1741.1.0        
  27    IN     ef ee ee fe  01 00 00 00  ........              1742.1.0        
               03 00 00 00               ....                  1742.1.8        
  27    IN     4f 4b 00                  OK.                   1743.1.0        
   7    OUT    ef ee ee fe  01 00 00 00  ........              1744.1.0        
               0e 00 00 00               ....                  1744.1.8        
  27    OUT    ef ee ee fe  01 00 00 00  ........              1745.1.0        
               0e 00 00 00               ....                  1745.1.8        
   7    OUT    4f 4b 40 30  78 61 33 62  OK@0xa3b              1746.1.0        
               62 61 38 63  34 00        ba8c4.                1746.1.8        
  27    OUT    4f 4b 40 30  78 61 33 62  OK@0xa3b              1747.1.0        
               62 61 38 63  34 00        ba8c4.                1747.1.8        
   7    IN     ef ee ee fe  01 00 00 00  ........              1748.1.0        
               03 00 00 00               ....                  1748.1.8        
   7    IN     4f 4b 00                  OK.                   1749.1.0        
  27    IN     ef ee ee fe  01 00 00 00  ........              1750.1.0        
               03 00 00 00               ....                  1750.1.8        
  27    IN     4f 4b 00                  OK.                   1751.1.0        
   7    OUT    ef ee ee fe  01 00 00 00  ........              1752.1.0        
               00 10 00 00               ....                  1752.1.8        
  27    OUT    ef ee ee fe  01 00 00 00  ........              1753.1.0        
               00 10 00 00               ....                  1753.1.8        
   7    OUT    6f 75 73 65  64 00 76 63  oused.vc              1754.1.0        
               6f 72 65 00  76 63 70 75  ore.vcpu              1754.1.8        
               6c 00 76 64  69 67 72 66  l.vdigrf              1754.1.16       
               00 76 64 64  32 00 76 73  .vdd2.vs              1754.1.24       
  27    OUT    6f 75 73 65  64 00 76 63  oused.vc              1755.1.0        
               6f 72 65 00  76 63 70 75  ore.vcpu              1755.1.8        
               6c 00 76 64  69 67 72 66  l.vdigrf              1755.1.16       
               00 76 64 64  32 00 76 73  .vdd2.vs              1755.1.24       
   7    OUT                                                    1756.1.0        
   7    IN     ef ee ee fe  01 00 00 00  ........              1757.1.0        
               03 00 00 00               ....                  1757.1.8        
   7    IN     4f 4b 00                  OK.                   1758.1.0        
  27    IN     ef ee ee fe  01 00 00 00  ........              1759.1.0        
               03 00 00 00               ....                  1759.1.8        
  27    IN     4f 4b 00                  OK.                   1760.1.0        
   7    OUT    ef ee ee fe  01 00 00 00  ........              1761.1.0        
               0e 00 00 00               ....                  1761.1.8        
  27    OUT    ef ee ee fe  01 00 00 00  ........              1762.1.0        
               0e 00 00 00               ....                  1762.1.8        
   7    OUT    4f 4b 40 30  78 65 36 36  OK@0xe66              1763.1.0        
               65 33 39 37  66 00        e397f.                1763.1.8        
  27    OUT    4f 4b 40 30  78 65 36 36  OK@0xe66              1764.1.0        
               65 33 39 37  66 00        e397f.                1764.1.8        
   7    IN     ef ee ee fe  01 00 00 00  ........              1765.1.0        
               03 00 00 00               ....                  1765.1.8        
  27    IN     ef ee ee fe  01 00 00 00  ........              1766.1.0        
               03 00 00 00               ....                  1766.1.8        
   7    IN     4f 4b 00                  OK.                   1767.1.0        
  27    IN     4f 4b 00                  OK.                   1768.1.0        
   7    OUT    ef ee ee fe  01 00 00 00  ........              1769.1.0        
               00 10 00 00               ....                  1769.1.8        
  27    OUT    ef ee ee fe  01 00 00 00  ........              1770.1.0        
               00 10 00 00               ....                  1770.1.8        
   7    OUT    20 65 72 72  6f 72 2e 2e   error..              1771.1.0        
               2e 0a 00 50  4c 20 64 65  ...PL de              1771.1.8        
               6c 61 79 20  66 6f 72 20  lay for               1771.1.16       
               4c 6f 6e 67  20 50 72 65  Long Pre              1771.1.24       
  27    OUT    20 65 72 72  6f 72 2e 2e   error..              1772.1.0        
               2e 0a 00 50  4c 20 64 65  ...PL de              1772.1.8        
               6c 61 79 20  66 6f 72 20  lay for               1772.1.16       
               4c 6f 6e 67  20 50 72 65  Long Pre              1772.1.24       
   7    OUT                                                    1773.1.0        
   7    IN     ef ee ee fe  01 00 00 00  ........              1774.1.0        
               03 00 00 00               ....                  1774.1.8        
   7    IN     4f 4b 00                  OK.                   1775.1.0        
  27    IN     ef ee ee fe  01 00 00 00  ........              1776.1.0        
               03 00 00 00               ....                  1776.1.8        
  27    IN     4f 4b 00                  OK.                   1777.1.0        
   7    OUT    ef ee ee fe  01 00 00 00  ........              1778.1.0        
               0e 00 00 00               ....                  1778.1.8        
  27    OUT    ef ee ee fe  01 00 00 00  ........              1779.1.0        
               0e 00 00 00               ....                  1779.1.8        
   7    OUT    4f 4b 40 30  78 66 31 35  OK@0xf15              1780.1.0        
               65 38 38 32  32 00        e8822.                1780.1.8        
  27    OUT    4f 4b 40 30  78 66 31 35  OK@0xf15              1781.1.0        
               65 38 38 32  32 00        e8822.                1781.1.8        
   7    IN     ef ee ee fe  01 00 00 00  ........              1782.1.0        
               03 00 00 00               ....                  1782.1.8        
   7    IN     4f 4b 00                  OK.                   1783.1.0        
  27    IN     ef ee ee fe  01 00 00 00  ........              1784.1.0        
               03 00 00 00               ....                  1784.1.8        
  27    IN     4f 4b 00                  OK.                   1785.1.0        
   7    OUT    ef ee ee fe  01 00 00 00  ........              1786.1.0        
               00 10 00 00               ....                  1786.1.8        
  27    OUT    ef ee ee fe  01 00 00 00  ........              1787.1.0        
               00 10 00 00               ....                  1787.1.8        
   7    OUT    2c 20 79 65  61 20 3d 20  , yea =               1788.1.0        
               30 78 25 78  0a 00 5b 52  0x%x..[R              1788.1.8        
               54 43 5d 25  73 23 32 20  TC]%s#2               1788.1.16       
               70 6f 77 65  72 6b 65 79  powerkey              1788.1.24       
  27    OUT    2c 20 79 65  61 20 3d 20  , yea =               1789.1.0        
               30 78 25 78  0a 00 5b 52  0x%x..[R              1789.1.8        
               54 43 5d 25  73 23 32 20  TC]%s#2               1789.1.16       
               70 6f 77 65  72 6b 65 79  powerkey              1789.1.24       
   7    OUT                                                    1790.1.0        
   7    IN     ef ee ee fe  01 00 00 00  ........              1791.1.0        
               03 00 00 00               ....                  1791.1.8        
  27    IN     ef ee ee fe  01 00 00 00  ........              1792.1.0        
               03 00 00 00               ....                  1792.1.8        
   7    IN     4f 4b 00                  OK.                   1793.1.0        
  27    IN     4f 4b 00                  OK.                   1794.1.0        
   7    OUT    ef ee ee fe  01 00 00 00  ........              1795.1.0        
               0e 00 00 00               ....                  1795.1.8        
  27    OUT    ef ee ee fe  01 00 00 00  ........              1796.1.0        
               0e 00 00 00               ....                  1796.1.8        
   7    OUT    4f 4b 40 30  78 61 39 61  OK@0xa9a              1797.1.0        
               61 38 61 32  33 00        a8a23.                1797.1.8        
  27    OUT    4f 4b 40 30  78 61 39 61  OK@0xa9a              1798.1.0        
               61 38 61 32  33 00        a8a23.                1798.1.8        
   7    IN     ef ee ee fe  01 00 00 00  ........              1799.1.0        
               03 00 00 00               ....                  1799.1.8        
  27    IN     ef ee ee fe  01 00 00 00  ........              1800.1.0        
               03 00 00 00               ....                  1800.1.8        
   7    IN     4f 4b 00                  OK.                   1801.1.0        
  27    IN     4f 4b 00                  OK.                   1802.1.0        
   7    OUT    ef ee ee fe  01 00 00 00  ........              1803.1.0        
               00 10 00 00               ....                  1803.1.8        
  27    OUT    ef ee ee fe  01 00 00 00  ........              1804.1.0        
               00 10 00 00               ....                  1804.1.8        
   7    OUT    55 46 53 5d  20 65 72 72  UFS] err              1805.1.0        
               3a 20 75 66  73 68 63 64  : ufshcd              1805.1.8        
               5f 70 72 6f  62 65 5f 68  _probe_h              1805.1.16       
               62 61 20 66  61 69 6c 65  ba faile              1805.1.24       
  27    OUT    55 46 53 5d  20 65 72 72  UFS] err              1806.1.0        
               3a 20 75 66  73 68 63 64  : ufshcd              1806.1.8        
               5f 70 72 6f  62 65 5f 68  _probe_h              1806.1.16       
               62 61 20 66  61 69 6c 65  ba faile              1806.1.24       
   7    IN     ef ee ee fe  01 00 00 00  ........              1807.1.0        
               03 00 00 00               ....                  1807.1.8        
   7    OUT                                                    1808.1.0        
   7    IN     4f 4b 00                  OK.                   1809.1.0        
  27    IN     ef ee ee fe  01 00 00 00  ........              1810.1.0        
               03 00 00 00               ....                  1810.1.8        
  27    IN     4f 4b 00                  OK.                   1811.1.0        
   7    OUT    ef ee ee fe  01 00 00 00  ........              1812.1.0        
               0e 00 00 00               ....                  1812.1.8        
  27    OUT    ef ee ee fe  01 00 00 00  ........              1813.1.0        
               0e 00 00 00               ....                  1813.1.8        
   7    OUT    4f 4b 40 30  78 33 66 30  OK@0x3f0              1814.1.0        
               30 63 31 38  61 00        0c18a.                1814.1.8        
  27    OUT    4f 4b 40 30  78 33 66 30  OK@0x3f0              1815.1.0        
               30 63 31 38  61 00        0c18a.                1815.1.8        
   7    IN     ef ee ee fe  01 00 00 00  ........              1816.1.0        
               03 00 00 00               ....                  1816.1.8        
   7    IN     4f 4b 00                  OK.                   1817.1.0        
  27    IN     ef ee ee fe  01 00 00 00  ........              1818.1.0        
               03 00 00 00               ....                  1818.1.8        
  27    IN     4f 4b 00                  OK.                   1819.1.0        
   7    OUT    ef ee ee fe  01 00 00 00  ........              1820.1.0        
               00 10 00 00               ....                  1820.1.8        
  27    OUT    ef ee ee fe  01 00 00 00  ........              1821.1.0        
               00 10 00 00               ....                  1821.1.8        
   7    OUT    25 78 0a 00  5b 55 46 53  %x..[UFS              1822.1.0        
               5d 20 75 6e  69 70 72 6f  ] unipro              1822.1.8        
               5f 70 61 72  61 6d 73 3a  _params:              1822.1.16       
               20 70 61 5f  68 38 74 69   pa_h8ti              1822.1.24       
  27    OUT    25 78 0a 00  5b 55 46 53  %x..[UFS              1823.1.0        
               5d 20 75 6e  69 70 72 6f  ] unipro              1823.1.8        
               5f 70 61 72  61 6d 73 3a  _params:              1823.1.16       
               20 70 61 5f  68 38 74 69   pa_h8ti              1823.1.24       
   7    OUT                                                    1824.1.0        
   7    IN     ef ee ee fe  01 00 00 00  ........              1825.1.0        
               03 00 00 00               ....                  1825.1.8        
  27    IN     ef ee ee fe  01 00 00 00  ........              1826.1.0        
               03 00 00 00               ....                  1826.1.8        
   7    IN     4f 4b 00                  OK.                   1827.1.0        
  27    IN     4f 4b 00                  OK.                   1828.1.0        
   7    OUT    ef ee ee fe  01 00 00 00  ........              1829.1.0        
               0e 00 00 00               ....                  1829.1.8        
  27    OUT    ef ee ee fe  01 00 00 00  ........              1830.1.0        
               0e 00 00 00               ....                  1830.1.8        
   7    OUT    4f 4b 40 30  78 35 34 64  OK@0x54d              1831.1.0        
               34 62 30 62  37 00        4b0b7.                1831.1.8        
  27    OUT    4f 4b 40 30  78 35 34 64  OK@0x54d              1832.1.0        
               34 62 30 62  37 00        4b0b7.                1832.1.8        
   7    IN     ef ee ee fe  01 00 00 00  ........              1833.1.0        
               03 00 00 00               ....                  1833.1.8        
   7    IN     4f 4b 00                  OK.                   1834.1.0        
  27    IN     ef ee ee fe  01 00 00 00  ........              1835.1.0        
               03 00 00 00               ....                  1835.1.8        
  27    IN     4f 4b 00                  OK.                   1836.1.0        
   7    OUT    ef ee ee fe  01 00 00 00  ........              1837.1.0        
               00 10 00 00               ....                  1837.1.8        
  27    OUT    ef ee ee fe  01 00 00 00  ........              1838.1.0        
               00 10 00 00               ....                  1838.1.8        
   7    OUT    77 70 66 20  30 78 25 78  wpf 0x%x              1839.1.0        
               0a 00 73 77  70 63 62 20  ..swpcb               1839.1.8        
               65 6e 74 72  79 5b 25 64  entry[%d              1839.1.16       
               5d 20 75 70  70 65 72 5f  ] upper_              1839.1.24       
  27    OUT    77 70 66 20  30 78 25 78  wpf 0x%x              1840.1.0        
               0a 00 73 77  70 63 62 20  ..swpcb               1840.1.8        
               65 6e 74 72  79 5b 25 64  entry[%d              1840.1.16       
               5d 20 75 70  70 65 72 5f  ] upper_              1840.1.24       
   7    OUT                                                    1841.1.0        
   7    IN     ef ee ee fe  01 00 00 00  ........              1842.1.0        
               03 00 00 00               ....                  1842.1.8        
   7    IN     4f 4b 00                  OK.                   1843.1.0        
  27    IN     ef ee ee fe  01 00 00 00  ........              1844.1.0        
               03 00 00 00               ....                  1844.1.8        
  27    IN     4f 4b 00                  OK.                   1845.1.0        
   7    OUT    ef ee ee fe  01 00 00 00  ........              1846.1.0        
               0e 00 00 00               ....                  1846.1.8        
  27    OUT    ef ee ee fe  01 00 00 00  ........              1847.1.0        
               0e 00 00 00               ....                  1847.1.8        
   7    OUT    4f 4b 40 30  78 65 36 61  OK@0xe6a              1848.1.0        
               63 31 66 34  62 00        c1f4b.                1848.1.8        
  27    OUT    4f 4b 40 30  78 65 36 61  OK@0xe6a              1849.1.0        
               63 31 66 34  62 00        c1f4b.                1849.1.8        
   7    IN     ef ee ee fe  01 00 00 00  ........              1850.1.0        
               03 00 00 00               ....                  1850.1.8        
  27    IN     ef ee ee fe  01 00 00 00  ........              1851.1.0        
               03 00 00 00               ....                  1851.1.8        
   7    IN     4f 4b 00                  OK.                   1852.1.0        
  27    IN     4f 4b 00                  OK.                   1853.1.0        
   7    OUT    ef ee ee fe  01 00 00 00  ........              1854.1.0        
               00 10 00 00               ....                  1854.1.8        
  27    OUT    ef ee ee fe  01 00 00 00  ........              1855.1.0        
               00 10 00 00               ....                  1855.1.8        
   7    OUT    74 61 62 6c  65 2f 62 6f  table/bo              1856.1.0        
               6f 74 6c 6f  61 64 65 72  otloader              1856.1.8        
               2f 70 72 65  6c 6f 61 64  /preload              1856.1.16       
               65 72 2f 70  6c 61 74 66  er/platf              1856.1.24       
  27    OUT    74 61 62 6c  65 2f 62 6f  table/bo              1857.1.0        
               6f 74 6c 6f  61 64 65 72  otloader              1857.1.8        
               2f 70 72 65  6c 6f 61 64  /preload              1857.1.16       
               65 72 2f 70  6c 61 74 66  er/platf              1857.1.24       
   7    OUT                                                    1858.1.0        
   7    IN     ef ee ee fe  01 00 00 00  ........              1859.1.0        
               03 00 00 00               ....                  1859.1.8        
   7    IN     4f 4b 00                  OK.                   1860.1.0        
  27    IN     ef ee ee fe  01 00 00 00  ........              1861.1.0        
               03 00 00 00               ....                  1861.1.8        
  27    IN     4f 4b 00                  OK.                   1862.1.0        
   7    OUT    ef ee ee fe  01 00 00 00  ........              1863.1.0        
               0e 00 00 00               ....                  1863.1.8        
  27    OUT    ef ee ee fe  01 00 00 00  ........              1864.1.0        
               0e 00 00 00               ....                  1864.1.8        
   7    OUT    4f 4b 40 30  78 34 38 66  OK@0x48f              1865.1.0        
               36 31 63 38  33 00        61c83.                1865.1.8        
  27    OUT    4f 4b 40 30  78 34 38 66  OK@0x48f              1866.1.0        
               36 31 63 38  33 00        61c83.                1866.1.8        
   7    IN     ef ee ee fe  01 00 00 00  ........              1867.1.0        
               03 00 00 00               ....                  1867.1.8        
  27    IN     ef ee ee fe  01 00 00 00  ........              1868.1.0        
               03 00 00 00               ....                  1868.1.8        
   7    IN     4f 4b 00                  OK.                   1869.1.0        
  27    IN     4f 4b 00                  OK.                   1870.1.0        
   7    OUT    ef ee ee fe  01 00 00 00  ........              1871.1.0        
               00 10 00 00               ....                  1871.1.8        
  27    OUT    ef ee ee fe  01 00 00 00  ........              1872.1.0        
               00 10 00 00               ....                  1872.1.8        
   7    OUT    6c 2e 69 6e  66 6f 20 62  l.info b              1873.1.0        
               75 66 66 65  72 20 66 61  uffer fa              1873.1.8        
               69 6c 65 64  2e 0a 00 53  iled...S              1873.1.16       
               63 61 74 74  65 72 20 66  catter f              1873.1.24       
  27    OUT    6c 2e 69 6e  66 6f 20 62  l.info b              1874.1.0        
               75 66 66 65  72 20 66 61  uffer fa              1874.1.8        
               69 6c 65 64  2e 0a 00 53  iled...S              1874.1.16       
               63 61 74 74  65 72 20 66  catter f              1874.1.24       
   7    OUT                                                    1875.1.0        
   7    IN     ef ee ee fe  01 00 00 00  ........              1876.1.0        
               03 00 00 00               ....                  1876.1.8        
   7    IN     4f 4b 00                  OK.                   1877.1.0        
  27    IN     ef ee ee fe  01 00 00 00  ........              1878.1.0        
               03 00 00 00               ....                  1878.1.8        
  27    IN     4f 4b 00                  OK.                   1879.1.0        
   7    OUT    ef ee ee fe  01 00 00 00  ........              1880.1.0        
               0e 00 00 00               ....                  1880.1.8        
  27    OUT    ef ee ee fe  01 00 00 00  ........              1881.1.0        
               0e 00 00 00               ....                  1881.1.8        
   7    OUT    4f 4b 40 30  78 63 65 31  OK@0xce1              1882.1.0        
               66 61 64 36  61 00        fad6a.                1882.1.8        
  27    OUT    4f 4b 40 30  78 63 65 31  OK@0xce1              1883.1.0        
               66 61 64 36  61 00        fad6a.                1883.1.8        
   7    IN     ef ee ee fe  01 00 00 00  ........              1884.1.0        
               03 00 00 00               ....                  1884.1.8        
  27    IN     ef ee ee fe  01 00 00 00  ........              1885.1.0        
               03 00 00 00               ....                  1885.1.8        
   7    IN     4f 4b 00                  OK.                   1886.1.0        
  27    IN     4f 4b 00                  OK.                   1887.1.0        
   7    OUT    ef ee ee fe  01 00 00 00  ........              1888.1.0        
               00 10 00 00               ....                  1888.1.8        
  27    OUT    ef ee ee fe  01 00 00 00  ........              1889.1.0        
               00 10 00 00               ....                  1889.1.8        
   7    OUT    69 6f 6e 20  61 72 65 61  ion area              1890.1.0        
               0a 00 73 74  69 6c 6c 20  ..still               1890.1.8        
               68 61 76 65  20 64 61 74  have dat              1890.1.16       
               61 20 74 6f  20 68 61 6e  a to han              1890.1.24       
  27    OUT    69 6f 6e 20  61 72 65 61  ion area              1891.1.0        
               0a 00 73 74  69 6c 6c 20  ..still               1891.1.8        
               68 61 76 65  20 64 61 74  have dat              1891.1.16       
               61 20 74 6f  20 68 61 6e  a to han              1891.1.24       
   7    OUT                                                    1892.1.0        
   7    IN     ef ee ee fe  01 00 00 00  ........              1893.1.0        
               03 00 00 00               ....                  1893.1.8        
   7    IN     4f 4b 00                  OK.                   1894.1.0        
  27    IN     ef ee ee fe  01 00 00 00  ........              1895.1.0        
               03 00 00 00               ....                  1895.1.8        
  27    IN     4f 4b 00                  OK.                   1896.1.0        
   7    OUT    ef ee ee fe  01 00 00 00  ........              1897.1.0        
               0e 00 00 00               ....                  1897.1.8        
  27    OUT    ef ee ee fe  01 00 00 00  ........              1898.1.0        
               0e 00 00 00               ....                  1898.1.8        
   7    OUT    4f 4b 40 30  78 64 66 65  OK@0xdfe              1899.1.0        
               38 63 38 34  61 00        8c84a.                1899.1.8        
  27    OUT    4f 4b 40 30  78 64 66 65  OK@0xdfe              1900.1.0        
               38 63 38 34  61 00        8c84a.                1900.1.8        
   7    IN     ef ee ee fe  01 00 00 00  ........              1901.1.0        
               03 00 00 00               ....                  1901.1.8        
   7    IN     4f 4b 00                  OK.                   1902.1.0        
  27    IN     ef ee ee fe  01 00 00 00  ........              1903.1.0        
               03 00 00 00               ....                  1903.1.8        
  27    IN     4f 4b 00                  OK.                   1904.1.0        
   7    OUT    ef ee ee fe  01 00 00 00  ........              1905.1.0        
               00 10 00 00               ....                  1905.1.8        
  27    OUT    ef ee ee fe  01 00 00 00  ........              1906.1.0        
               00 10 00 00               ....                  1906.1.8        
   7    OUT    00 5b 45 46  55 53 45 5d  .[EFUSE]              1907.1.0        
               20 65 66 75  73 65 20 64   efuse d              1907.1.8        
               65 62 75 67  20 66 75 6e  ebug fun              1907.1.16       
               63 74 69 6f  6e 20 46 61  ction Fa              1907.1.24       
  27    OUT    00 5b 45 46  55 53 45 5d  .[EFUSE]              1908.1.0        
               20 65 66 75  73 65 20 64   efuse d              1908.1.8        
               65 62 75 67  20 66 75 6e  ebug fun              1908.1.16       
               63 74 69 6f  6e 20 46 61  ction Fa              1908.1.24       
   7    OUT                                                    1909.1.0        
   7    IN     ef ee ee fe  01 00 00 00  ........              1910.1.0        
               03 00 00 00               ....                  1910.1.8        
  27    IN     ef ee ee fe  01 00 00 00  ........              1911.1.0        
               03 00 00 00               ....                  1911.1.8        
   7    IN     4f 4b 00                  OK.                   1912.1.0        
  27    IN     4f 4b 00                  OK.                   1913.1.0        
   7    OUT    ef ee ee fe  01 00 00 00  ........              1914.1.0        
               0e 00 00 00               ....                  1914.1.8        
  27    OUT    ef ee ee fe  01 00 00 00  ........              1915.1.0        
               0e 00 00 00               ....                  1915.1.8        
   7    OUT    4f 4b 40 30  78 66 33 33  OK@0xf33              1916.1.0        
               65 34 65 66  64 00        e4efd.                1916.1.8        
  27    OUT    4f 4b 40 30  78 66 33 33  OK@0xf33              1917.1.0        
               65 34 65 66  64 00        e4efd.                1917.1.8        
   7    IN     ef ee ee fe  01 00 00 00  ........              1918.1.0        
               03 00 00 00               ....                  1918.1.8        
   7    IN     4f 4b 00                  OK.                   1919.1.0        
  27    IN     ef ee ee fe  01 00 00 00  ........              1920.1.0        
               03 00 00 00               ....                  1920.1.8        
  27    IN     4f 4b 00                  OK.                   1921.1.0        
   7    OUT    ef ee ee fe  01 00 00 00  ........              1922.1.0        
               00 10 00 00               ....                  1922.1.8        
  27    OUT    ef ee ee fe  01 00 00 00  ........              1923.1.0        
               00 10 00 00               ....                  1923.1.8        
   7    OUT    65 63 75 72  69 74 79 2f  ecurity/              1924.1.0        
               64 61 5f 61  6e 74 69 5f  da_anti_              1924.1.8        
               72 6f 6c 6c  62 61 63 6b  rollback              1924.1.16       
               2e 63 00 6b  65 79 5f 64  .c.key_d              1924.1.24       
  27    OUT    65 63 75 72  69 74 79 2f  ecurity/              1925.1.0        
               64 61 5f 61  6e 74 69 5f  da_anti_              1925.1.8        
               72 6f 6c 6c  62 61 63 6b  rollback              1925.1.16       
               2e 63 00 6b  65 79 5f 64  .c.key_d              1925.1.24       
   7    OUT                                                    1926.1.0        
   7    IN     ef ee ee fe  01 00 00 00  ........              1927.1.0        
               03 00 00 00               ....                  1927.1.8        
  27    IN     ef ee ee fe  01 00 00 00  ........              1928.1.0        
               03 00 00 00               ....                  1928.1.8        
   7    IN     4f 4b 00                  OK.                   1929.1.0        
  27    IN     4f 4b 00                  OK.                   1930.1.0        
   7    OUT    ef ee ee fe  01 00 00 00  ........              1931.1.0        
               0e 00 00 00               ....                  1931.1.8        
  27    OUT    ef ee ee fe  01 00 00 00  ........              1932.1.0        
               0e 00 00 00               ....                  1932.1.8        
   7    OUT    4f 4b 40 30  78 38 34 65  OK@0x84e              1933.1.0        
               64 34 37 62  63 00        d47bc.                1933.1.8        
  27    OUT    4f 4b 40 30  78 38 34 65  OK@0x84e              1934.1.0        
               64 34 37 62  63 00        d47bc.                1934.1.8        
   7    IN     ef ee ee fe  01 00 00 00  ........              1935.1.0        
               03 00 00 00               ....                  1935.1.8        
  27    IN     ef ee ee fe  01 00 00 00  ........              1936.1.0        
               03 00 00 00               ....                  1936.1.8        
   7    IN     4f 4b 00                  OK.                   1937.1.0        
  27    IN     4f 4b 00                  OK.                   1938.1.0        
   7    OUT    ef ee ee fe  01 00 00 00  ........              1939.1.0        
               00 10 00 00               ....                  1939.1.8        
  27    OUT    ef ee ee fe  01 00 00 00  ........              1940.1.0        
               00 10 00 00               ....                  1940.1.8        
   7    OUT    70 73 73 5f  65 6e 63 6f  pss_enco              1941.1.0        
               64 65 5f 73  68 61 33 38  de_sha38              1941.1.8        
               34 20 6f 70  65 72 61 74  4 operat              1941.1.16       
               69 6f 6e 0a  00 45 72 72  ion..Err              1941.1.24       
  27    OUT    70 73 73 5f  65 6e 63 6f  pss_enco              1942.1.0        
               64 65 5f 73  68 61 33 38  de_sha38              1942.1.8        
               34 20 6f 70  65 72 61 74  4 operat              1942.1.16       
               69 6f 6e 0a  00 45 72 72  ion..Err              1942.1.24       
   7    OUT                                                    1943.1.0        
   7    IN     ef ee ee fe  01 00 00 00  ........              1944.1.0        
               03 00 00 00               ....                  1944.1.8        
   7    IN     4f 4b 00                  OK.                   1945.1.0        
  27    IN     ef ee ee fe  01 00 00 00  ........              1946.1.0        
               03 00 00 00               ....                  1946.1.8        
  27    IN     4f 4b 00                  OK.                   1947.1.0        
   7    OUT    ef ee ee fe  01 00 00 00  ........              1948.1.0        
               0e 00 00 00               ....                  1948.1.8        
  27    OUT    ef ee ee fe  01 00 00 00  ........              1949.1.0        
               0e 00 00 00               ....                  1949.1.8        
   7    OUT    4f 4b 40 30  78 39 33 30  OK@0x930              1950.1.0        
               37 61 30 36  63 00        7a06c.                1950.1.8        
  27    OUT    4f 4b 40 30  78 39 33 30  OK@0x930              1951.1.0        
               37 61 30 36  63 00        7a06c.                1951.1.8        
   7    IN     ef ee ee fe  01 00 00 00  ........              1952.1.0        
               03 00 00 00               ....                  1952.1.8        
   7    IN     4f 4b 00                  OK.                   1953.1.0        
  27    IN     ef ee ee fe  01 00 00 00  ........              1954.1.0        
               03 00 00 00               ....                  1954.1.8        
  27    IN     4f 4b 00                  OK.                   1955.1.0        
   7    OUT    ef ee ee fe  01 00 00 00  ........              1956.1.0        
               00 10 00 00               ....                  1956.1.8        
  27    OUT    ef ee ee fe  01 00 00 00  ........              1957.1.0        
               00 10 00 00               ....                  1957.1.8        
   7    OUT    f9 7a 04 40  03 20 00 00  .z.@. ..              1958.1.0        
               fe 7a 04 40  02 20 00 00  .z.@. ..              1958.1.8        
               03 7b 04 40  b5 03 00 00  ...@....              1958.1.16       
               0b 7b 04 40  61 22 00 00  ...@a"..              1958.1.24       
  27    OUT    f9 7a 04 40  03 20 00 00  .z.@. ..              1959.1.0        
               fe 7a 04 40  02 20 00 00  .z.@. ..              1959.1.8        
               03 7b 04 40  b5 03 00 00  ...@....              1959.1.16       
               0b 7b 04 40  61 22 00 00  ...@a"..              1959.1.24       
   7    OUT                                                    1960.1.0        
   7    IN     ef ee ee fe  01 00 00 00  ........              1961.1.0        
               03 00 00 00               ....                  1961.1.8        
  27    IN     ef ee ee fe  01 00 00 00  ........              1962.1.0        
               03 00 00 00               ....                  1962.1.8        
   7    IN     4f 4b 00                  OK.                   1963.1.0        
  27    IN     4f 4b 00                  OK.                   1964.1.0        
   7    OUT    ef ee ee fe  01 00 00 00  ........              1965.1.0        
               0e 00 00 00               ....                  1965.1.8        
  27    OUT    ef ee ee fe  01 00 00 00  ........              1966.1.0        
               0e 00 00 00               ....                  1966.1.8        
   7    OUT    4f 4b 40 30  78 33 35 39  OK@0x359              1967.1.0        
               35 34 62 63  33 00        54bc3.                1967.1.8        
  27    OUT    4f 4b 40 30  78 33 35 39  OK@0x359              1968.1.0        
               35 34 62 63  33 00        54bc3.                1968.1.8        
   7    IN     ef ee ee fe  01 00 00 00  ........              1969.1.0        
               03 00 00 00               ....                  1969.1.8        
  27    IN     ef ee ee fe  01 00 00 00  ........              1970.1.0        
               03 00 00 00               ....                  1970.1.8        
   7    IN     4f 4b 00                  OK.                   1971.1.0        
  27    IN     4f 4b 00                  OK.                   1972.1.0        
   7    OUT    ef ee ee fe  01 00 00 00  ........              1973.1.0        
               00 10 00 00               ....                  1973.1.8        
  27    OUT    ef ee ee fe  01 00 00 00  ........              1974.1.0        
               00 10 00 00               ....                  1974.1.8        
   7    OUT    0f 00 00 00  10 27 00 00  .....'..              1975.1.0        
               ab b2 04 40  21 00 00 00  ...@!...              1975.1.8        
               2f 20 0f 00  23 1d 01 00  / ..#...              1975.1.16       
               00 00 00 00  00 00 00 00  ........              1975.1.24       
  27    OUT    0f 00 00 00  10 27 00 00  .....'..              1976.1.0        
               ab b2 04 40  21 00 00 00  ...@!...              1976.1.8        
               2f 20 0f 00  23 1d 01 00  / ..#...              1976.1.16       
               00 00 00 00  00 00 00 00  ........              1976.1.24       
   7    OUT                                                    1977.1.0        
   7    IN     ef ee ee fe  01 00 00 00  ........              1978.1.0        
               03 00 00 00               ....                  1978.1.8        
   7    IN     4f 4b 00                  OK.                   1979.1.0        
  27    IN     ef ee ee fe  01 00 00 00  ........              1980.1.0        
               03 00 00 00               ....                  1980.1.8        
  27    IN     4f 4b 00                  OK.                   1981.1.0        
   7    OUT    ef ee ee fe  01 00 00 00  ........              1982.1.0        
               0e 00 00 00               ....                  1982.1.8        
  27    OUT    ef ee ee fe  01 00 00 00  ........              1983.1.0        
               0e 00 00 00               ....                  1983.1.8        
   7    OUT    4f 4b 40 30  78 36 34 36  OK@0x646              1984.1.0        
               34 34 31 66  32 00        441f2.                1984.1.8        
  27    OUT    4f 4b 40 30  78 36 34 36  OK@0x646              1985.1.0        
               34 34 31 66  32 00        441f2.                1985.1.8        
   7    IN     ef ee ee fe  01 00 00 00  ........              1986.1.0        
               03 00 00 00               ....                  1986.1.8        
  27    IN     ef ee ee fe  01 00 00 00  ........              1987.1.0        
               03 00 00 00               ....                  1987.1.8        
   7    IN     4f 4b 00                  OK.                   1988.1.0        
  27    IN     4f 4b 00                  OK.                   1989.1.0        
   7    OUT    ef ee ee fe  01 00 00 00  ........              1990.1.0        
               00 10 00 00               ....                  1990.1.8        
  27    OUT    ef ee ee fe  01 00 00 00  ........              1991.1.0        
               00 10 00 00               ....                  1991.1.8        
   7    OUT    00 00 00 00  00 00 00 00  ........              1992.1.0        
               00 00 00 32  2e 31 36 2e  ...2.16.              1992.1.8        
               38 38 36 2e  32 34 35 34  886.2454              1992.1.16       
               2e 31 2e 33  00 00 00 00  .1.3....              1992.1.24       
  27    OUT    00 00 00 00  00 00 00 00  ........              1993.1.0        
               00 00 00 32  2e 31 36 2e  ...2.16.              1993.1.8        
               38 38 36 2e  32 34 35 34  886.2454              1993.1.16       
               2e 31 2e 33  00 00 00 00  .1.3....              1993.1.24       
   7    IN     ef ee ee fe  01 00 00 00  ........              1994.1.0        
               03 00 00 00               ....                  1994.1.8        
   7    OUT                                                    1995.1.0        
  27    IN     ef ee ee fe  01 00 00 00  ........              1996.1.0        
               03 00 00 00               ....                  1996.1.8        
   7    IN     4f 4b 00                  OK.                   1997.1.0        
  27    IN     4f 4b 00                  OK.                   1998.1.0        
   7    OUT    ef ee ee fe  01 00 00 00  ........              1999.1.0        
               0e 00 00 00               ....                  1999.1.8        
  27    OUT    ef ee ee fe  01 00 00 00  ........              2000.1.0        
               0e 00 00 00               ....                  2000.1.8        
   7    OUT    4f 4b 40 30  78 37 37 39  OK@0x779              2001.1.0        
               38 31 31 34  31 00        81141.                2001.1.8        
  27    OUT    4f 4b 40 30  78 37 37 39  OK@0x779              2002.1.0        
               38 31 31 34  31 00        81141.                2002.1.8        
   7    IN     ef ee ee fe  01 00 00 00  ........              2003.1.0        
               03 00 00 00               ....                  2003.1.8        
   7    IN     4f 4b 00                  OK.                   2004.1.0        
  27    IN     ef ee ee fe  01 00 00 00  ........              2005.1.0        
               03 00 00 00               ....                  2005.1.8        
  27    IN     4f 4b 00                  OK.                   2006.1.0        
   7    OUT    ef ee ee fe  01 00 00 00  ........              2007.1.0        
               00 10 00 00               ....                  2007.1.8        
  27    OUT    ef ee ee fe  01 00 00 00  ........              2008.1.0        
               00 10 00 00               ....                  2008.1.8        
   7    OUT    70 00 d4 11  60 00 eb 11  p...`...              2009.1.0        
               60 00 eb 11  60 00 eb 11  `...`...              2009.1.8        
               60 00 eb 11  60 00 eb 11  `...`...              2009.1.16       
               60 00 eb 11  ff ff ff ff  `.......              2009.1.24       
  27    OUT    70 00 d4 11  60 00 eb 11  p...`...              2010.1.0        
               60 00 eb 11  60 00 eb 11  `...`...              2010.1.8        
               60 00 eb 11  60 00 eb 11  `...`...              2010.1.16       
               60 00 eb 11  ff ff ff ff  `.......              2010.1.24       
   7    OUT                                                    2011.1.0        
   7    IN     ef ee ee fe  01 00 00 00  ........              2012.1.0        
               03 00 00 00               ....                  2012.1.8        
  27    IN     ef ee ee fe  01 00 00 00  ........              2013.1.0        
               03 00 00 00               ....                  2013.1.8        
   7    IN     4f 4b 00                  OK.                   2014.1.0        
  27    IN     4f 4b 00                  OK.                   2015.1.0        
   7    OUT    ef ee ee fe  01 00 00 00  ........              2016.1.0        
               0e 00 00 00               ....                  2016.1.8        
  27    OUT    ef ee ee fe  01 00 00 00  ........              2017.1.0        
               0e 00 00 00               ....                  2017.1.8        
   7    OUT    4f 4b 40 30  78 39 61 35  OK@0x9a5              2018.1.0        
               39 32 62 34  62 00        92b4b.                2018.1.8        
  27    OUT    4f 4b 40 30  78 39 61 35  OK@0x9a5              2019.1.0        
               39 32 62 34  62 00        92b4b.                2019.1.8        
   7    IN     ef ee ee fe  01 00 00 00  ........              2020.1.0        
               03 00 00 00               ....                  2020.1.8        
   7    IN     4f 4b 00                  OK.                   2021.1.0        
  27    IN     ef ee ee fe  01 00 00 00  ........              2022.1.0        
               03 00 00 00               ....                  2022.1.8        
  27    IN     4f 4b 00                  OK.                   2023.1.0        
   7    OUT    ef ee ee fe  01 00 00 00  ........              2024.1.0        
               00 10 00 00               ....                  2024.1.8        
  27    OUT    ef ee ee fe  01 00 00 00  ........              2025.1.0        
               00 10 00 00               ....                  2025.1.8        
   7    OUT    00 00 00 00  00 18 80 1c  ........              2026.1.0        
               00 00 00 00  07 00 00 00  ........              2026.1.8        
               02 00 00 00  00 00 00 00  ........              2026.1.16       
               02 00 00 00  01 00 00 00  ........              2026.1.24       
  27    OUT    00 00 00 00  00 18 80 1c  ........              2027.1.0        
               00 00 00 00  07 00 00 00  ........              2027.1.8        
               02 00 00 00  00 00 00 00  ........              2027.1.16       
               02 00 00 00  01 00 00 00  ........              2027.1.24       
   7    IN     ef ee ee fe  01 00 00 00  ........              2028.1.0        
               03 00 00 00               ....                  2028.1.8        
   7    IN     4f 4b 00                  OK.                   2029.1.0        
   7    OUT                                                    2030.1.0        
  27    IN     ef ee ee fe  01 00 00 00  ........              2031.1.0        
               03 00 00 00               ....                  2031.1.8        
  27    IN     4f 4b 00                  OK.                   2032.1.0        
   7    OUT    ef ee ee fe  01 00 00 00  ........              2033.1.0        
               0e 00 00 00               ....                  2033.1.8        
  27    OUT    ef ee ee fe  01 00 00 00  ........              2034.1.0        
               0e 00 00 00               ....                  2034.1.8        
   7    OUT    4f 4b 40 30  78 36 34 38  OK@0x648              2035.1.0        
               30 66 33 63  63 00        0f3cc.                2035.1.8        
  27    OUT    4f 4b 40 30  78 36 34 38  OK@0x648              2036.1.0        
               30 66 33 63  63 00        0f3cc.                2036.1.8        
   7    IN     ef ee ee fe  01 00 00 00  ........              2037.1.0        
               03 00 00 00               ....                  2037.1.8        
   7    IN     4f 4b 00                  OK.                   2038.1.0        
  27    IN     ef ee ee fe  01 00 00 00  ........              2039.1.0        
               03 00 00 00               ....                  2039.1.8        
  27    IN     4f 4b 00                  OK.                   2040.1.0        
   7    OUT    ef ee ee fe  01 00 00 00  ........              2041.1.0        
               10 06 00 00               ....                  2041.1.8        
  27    OUT    ef ee ee fe  01 00 00 00  ........              2042.1.0        
               10 06 00 00               ....                  2042.1.8        
   7    OUT    7f 00 00 00  02 00 00 00  ........              2043.1.0        
               1c 05 c1 11  ff ff ff ff  ........              2043.1.8        
               14 03 03 07  28 0c c1 11  ....(...              2043.1.16       
               7f 00 00 00  03 00 00 00  ........              2043.1.24       
  27    OUT    7f 00 00 00  02 00 00 00  ........              2044.1.0        
               1c 05 c1 11  ff ff ff ff  ........              2044.1.8        
               14 03 03 07  28 0c c1 11  ....(...              2044.1.16       
               7f 00 00 00  03 00 00 00  ........              2044.1.24       
   7    IN     ef ee ee fe  01 00 00 00  ........              2045.1.0        
               03 00 00 00               ....                  2045.1.8        
  27    IN     ef ee ee fe  01 00 00 00  ........              2046.1.0        
               03 00 00 00               ....                  2046.1.8        
   7    IN     4f 4b 00                  OK.                   2047.1.0        
  27    IN     4f 4b 00                  OK.                   2048.1.0        
   7    IN     ef ee ee fe  01 00 00 00  ........              2049.1.0        
               95 00 00 00               ....                  2049.1.8        
  27    IN     ef ee ee fe  01 00 00 00  ........              2050.1.0        
               95 00 00 00               ....                  2050.1.8        
   7    IN     3c 3f 78 6d  6c 20 76 65  <?xml ve              2051.1.0        
               72 73 69 6f  6e 3d 22 31  rsion="1              2051.1.8        
               2e 30 22 20  65 6e 63 6f  .0" enco              2051.1.16       
               64 69 6e 67  3d 22 75 74  ding="ut              2051.1.24       
  27    IN     3c 3f 78 6d  6c 20 76 65  <?xml ve              2052.1.0        
               72 73 69 6f  6e 3d 22 31  rsion="1              2052.1.8        
               2e 30 22 20  65 6e 63 6f  .0" enco              2052.1.16       
               64 69 6e 67  3d 22 75 74  ding="ut              2052.1.24       
   7    OUT    ef ee ee fe  01 00 00 00  ........              2053.1.0        
               03 00 00 00               ....                  2053.1.8        
  27    OUT    ef ee ee fe  01 00 00 00  ........              2054.1.0        
               03 00 00 00               ....                  2054.1.8        
   7    OUT    4f 4b 00                  OK.                   2055.1.0        
  27    OUT    4f 4b 00                  OK.                   2056.1.0        
   7    IN     ef ee ee fe  01 00 00 00  ........              2057.1.0        
               66 00 00 00               f...                  2057.1.8        
   7    IN     3c 3f 78 6d  6c 20 76 65  <?xml ve              2058.1.0        
               72 73 69 6f  6e 3d 22 31  rsion="1              2058.1.8        
               2e 30 22 20  65 6e 63 6f  .0" enco              2058.1.16       
               64 69 6e 67  3d 22 75 74  ding="ut              2058.1.24       
  27    IN     ef ee ee fe  01 00 00 00  ........              2059.1.0        
               66 00 00 00               f...                  2059.1.8        
  27    IN     3c 3f 78 6d  6c 20 76 65  <?xml ve              2060.1.0        
               72 73 69 6f  6e 3d 22 31  rsion="1              2060.1.8        
               2e 30 22 20  65 6e 63 6f  .0" enco              2060.1.16       
               64 69 6e 67  3d 22 75 74  ding="ut              2060.1.24       
   7    OUT    ef ee ee fe  01 00 00 00  ........              2061.1.0        
               03 00 00 00               ....                  2061.1.8        
  27    OUT    ef ee ee fe  01 00 00 00  ........              2062.1.0        
               03 00 00 00               ....                  2062.1.8        
   7    OUT    4f 4b 00                  OK.                   2063.1.0        
  27    OUT    4f 4b 00                  OK.                   2064.1.0        
   7    OUT    ef ee ee fe  01 00 00 00  ........              2065.1.0        
               21 01 00 00               !...                  2065.1.8        
  27    OUT    ef ee ee fe  01 00 00 00  ........              2066.1.0        
               21 01 00 00               !...                  2066.1.8        
   7    OUT    3c 3f 78 6d  6c 20 76 65  <?xml ve              2067.1.0        
               72 73 69 6f  6e 3d 22 31  rsion="1              2067.1.8        
               2e 30 22 20  65 6e 63 6f  .0" enco              2067.1.16       
               64 69 6e 67  3d 22 75 74  ding="ut              2067.1.24       
  27    OUT    3c 3f 78 6d  6c 20 76 65  <?xml ve              2068.1.0        
               72 73 69 6f  6e 3d 22 31  rsion="1              2068.1.8        
               2e 30 22 20  65 6e 63 6f  .0" enco              2068.1.16       
               64 69 6e 67  3d 22 75 74  ding="ut              2068.1.24       
   7    IN     ef ee ee fe  01 00 00 00  ........              2069.1.0        
               03 00 00 00               ....                  2069.1.8        
   7    IN     4f 4b 00                  OK.                   2070.1.0        
  27    IN     ef ee ee fe  01 00 00 00  ........              2071.1.0        
               03 00 00 00               ....                  2071.1.8        
  27    IN     4f 4b 00                  OK.                   2072.1.0        
   7    IN     ef ee ee fe  01 00 00 00  ........              2073.1.0        
               95 00 00 00               ....                  2073.1.8        
   7    IN     3c 3f 78 6d  6c 20 76 65  <?xml ve              2074.1.0        
               72 73 69 6f  6e 3d 22 31  rsion="1              2074.1.8        
               2e 30 22 20  65 6e 63 6f  .0" enco              2074.1.16       
               64 69 6e 67  3d 22 75 74  ding="ut              2074.1.24       
  27    IN     ef ee ee fe  01 00 00 00  ........              2075.1.0        
               95 00 00 00               ....                  2075.1.8        
  27    IN     3c 3f 78 6d  6c 20 76 65  <?xml ve              2076.1.0        
               72 73 69 6f  6e 3d 22 31  rsion="1              2076.1.8        
               2e 30 22 20  65 6e 63 6f  .0" enco              2076.1.16       
               64 69 6e 67  3d 22 75 74  ding="ut              2076.1.24       
   7    OUT    ef ee ee fe  01 00 00 00  ........              2077.1.0        
               03 00 00 00               ....                  2077.1.8        
  27    OUT    ef ee ee fe  01 00 00 00  ........              2078.1.0        
               03 00 00 00               ....                  2078.1.8        
   7    OUT    4f 4b 00                  OK.                   2079.1.0        
  27    OUT    4f 4b 00                  OK.                   2080.1.0        
   7    IN     ef ee ee fe  01 00 00 00  ........              2081.1.0        
               66 00 00 00               f...                  2081.1.8        
   7    IN     3c 3f 78 6d  6c 20 76 65  <?xml ve              2082.1.0        
               72 73 69 6f  6e 3d 22 31  rsion="1              2082.1.8        
               2e 30 22 20  65 6e 63 6f  .0" enco              2082.1.16       
               64 69 6e 67  3d 22 75 74  ding="ut              2082.1.24       
  27    IN     ef ee ee fe  01 00 00 00  ........              2083.1.0        
               66 00 00 00               f...                  2083.1.8        
  27    IN     3c 3f 78 6d  6c 20 76 65  <?xml ve              2084.1.0        
               72 73 69 6f  6e 3d 22 31  rsion="1              2084.1.8        
               2e 30 22 20  65 6e 63 6f  .0" enco              2084.1.16       
               64 69 6e 67  3d 22 75 74  ding="ut              2084.1.24       
   7    OUT    ef ee ee fe  01 00 00 00  ........              2085.1.0        
               03 00 00 00               ....                  2085.1.8        
  27    OUT    ef ee ee fe  01 00 00 00  ........              2086.1.0        
               03 00 00 00               ....                  2086.1.8        
   7    OUT    4f 4b 00                  OK.                   2087.1.0        
  27    OUT    4f 4b 00                  OK.                   2088.1.0        
   7    OUT    ef ee ee fe  01 00 00 00  ........              2089.1.0        
               76 00 00 00               v...                  2089.1.8        
  27    OUT    ef ee ee fe  01 00 00 00  ........              2090.1.0        
               76 00 00 00               v...                  2090.1.8        
   7    OUT    3c 3f 78 6d  6c 20 76 65  <?xml ve              2091.1.0        
               72 73 69 6f  6e 3d 22 31  rsion="1              2091.1.8        
               2e 30 22 20  65 6e 63 6f  .0" enco              2091.1.16       
               64 69 6e 67  3d 22 75 74  ding="ut              2091.1.24       
  27    OUT    3c 3f 78 6d  6c 20 76 65  <?xml ve              2092.1.0        
               72 73 69 6f  6e 3d 22 31  rsion="1              2092.1.8        
               2e 30 22 20  65 6e 63 6f  .0" enco              2092.1.16       
               64 69 6e 67  3d 22 75 74  ding="ut              2092.1.24       
   7    IN     ef ee ee fe  01 00 00 00  ........              2093.1.0        
               03 00 00 00               ....                  2093.1.8        
   7    IN     4f 4b 00                  OK.                   2094.1.0        
  27    IN     ef ee ee fe  01 00 00 00  ........              2095.1.0        
               03 00 00 00               ....                  2095.1.8        
  27    IN     4f 4b 00                  OK.                   2096.1.0        
   7    IN     ef ee ee fe  01 00 00 00  ........              2097.1.0        
               95 00 00 00               ....                  2097.1.8        
   7    IN     3c 3f 78 6d  6c 20 76 65  <?xml ve              2098.1.0        
               72 73 69 6f  6e 3d 22 31  rsion="1              2098.1.8        
               2e 30 22 20  65 6e 63 6f  .0" enco              2098.1.16       
               64 69 6e 67  3d 22 75 74  ding="ut              2098.1.24       
  27    IN     ef ee ee fe  01 00 00 00  ........              2099.1.0        
               95 00 00 00               ....                  2099.1.8        
  27    IN     3c 3f 78 6d  6c 20 76 65  <?xml ve              2100.1.0        
               72 73 69 6f  6e 3d 22 31  rsion="1              2100.1.8        
               2e 30 22 20  65 6e 63 6f  .0" enco              2100.1.16       
               64 69 6e 67  3d 22 75 74  ding="ut              2100.1.24       
   7    OUT    ef ee ee fe  01 00 00 00  ........              2101.1.0        
               03 00 00 00               ....                  2101.1.8        
  27    OUT    ef ee ee fe  01 00 00 00  ........              2102.1.0        
               03 00 00 00               ....                  2102.1.8        
   7    OUT    4f 4b 00                  OK.                   2103.1.0        
  27    OUT    4f 4b 00                  OK.                   2104.1.0        
   7    IN     ef ee ee fe  01 00 00 00  ........              2105.1.0        
               07 00 00 00               ....                  2105.1.8        
   7    IN     4f 4b 21 45  4f 54 00     OK!EOT.               2106.1.0        
  27    IN     ef ee ee fe  01 00 00 00  ........              2107.1.0        
               07 00 00 00               ....                  2107.1.8        
  27    IN     4f 4b 21 45  4f 54 00     OK!EOT.               2108.1.0        
   7    OUT    ef ee ee fe  01 00 00 00  ........              2109.1.0        
               03 00 00 00               ....                  2109.1.8        
  27    OUT    ef ee ee fe  01 00 00 00  ........              2110.1.0        
               03 00 00 00               ....                  2110.1.8        
   7    OUT    4f 4b 00                  OK.                   2111.1.0        
  27    OUT    4f 4b 00                  OK.                   2112.1.0        
   7    IN     ef ee ee fe  01 00 00 00  ........              2113.1.0        
               95 00 00 00               ....                  2113.1.8        
   7    IN     3c 3f 78 6d  6c 20 76 65  <?xml ve              2114.1.0        
               72 73 69 6f  6e 3d 22 31  rsion="1              2114.1.8        
               2e 30 22 20  65 6e 63 6f  .0" enco              2114.1.16       
               64 69 6e 67  3d 22 75 74  ding="ut              2114.1.24       
  27    IN     ef ee ee fe  01 00 00 00  ........              2115.1.0        
               95 00 00 00               ....                  2115.1.8        
  27    IN     3c 3f 78 6d  6c 20 76 65  <?xml ve              2116.1.0        
               72 73 69 6f  6e 3d 22 31  rsion="1              2116.1.8        
               2e 30 22 20  65 6e 63 6f  .0" enco              2116.1.16       
               64 69 6e 67  3d 22 75 74  ding="ut              2116.1.24       
   7    OUT    ef ee ee fe  01 00 00 00  ........              2117.1.0        
               03 00 00 00               ....                  2117.1.8        
  27    OUT    ef ee ee fe  01 00 00 00  ........              2118.1.0        
               03 00 00 00               ....                  2118.1.8        
   7    OUT    4f 4b 00                  OK.                   2119.1.0        
  27    OUT    4f 4b 00                  OK.                   2120.1.0        
   7    IN     ef ee ee fe  01 00 00 00  ........              2121.1.0        
               66 00 00 00               f...                  2121.1.8        
   7    IN     3c 3f 78 6d  6c 20 76 65  <?xml ve              2122.1.0        
               72 73 69 6f  6e 3d 22 31  rsion="1              2122.1.8        
               2e 30 22 20  65 6e 63 6f  .0" enco              2122.1.16       
               64 69 6e 67  3d 22 75 74  ding="ut              2122.1.24       
  27    IN     ef ee ee fe  01 00 00 00  ........              2123.1.0        
               66 00 00 00               f...                  2123.1.8        
  27    IN     3c 3f 78 6d  6c 20 76 65  <?xml ve              2124.1.0        
               72 73 69 6f  6e 3d 22 31  rsion="1              2124.1.8        
               2e 30 22 20  65 6e 63 6f  .0" enco              2124.1.16       
               64 69 6e 67  3d 22 75 74  ding="ut              2124.1.24       
   7    OUT    ef ee ee fe  01 00 00 00  ........              2125.1.0        
               03 00 00 00               ....                  2125.1.8        
  27    OUT    ef ee ee fe  01 00 00 00  ........              2126.1.0        
               03 00 00 00               ....                  2126.1.8        
   7    OUT    4f 4b 00                  OK.                   2127.1.0        
  27    OUT    4f 4b 00                  OK.                   2128.1.0        
   7    OUT    ef ee ee fe  01 00 00 00  ........              2129.1.0        
               ab 00 00 00               ....                  2129.1.8        
  27    OUT    ef ee ee fe  01 00 00 00  ........              2130.1.0        
               ab 00 00 00               ....                  2130.1.8        
   7    OUT    3c 3f 78 6d  6c 20 76 65  <?xml ve              2131.1.0        
               72 73 69 6f  6e 3d 22 31  rsion="1              2131.1.8        
               2e 30 22 20  65 6e 63 6f  .0" enco              2131.1.16       
               64 69 6e 67  3d 22 75 74  ding="ut              2131.1.24       
  27    OUT    3c 3f 78 6d  6c 20 76 65  <?xml ve              2132.1.0        
               72 73 69 6f  6e 3d 22 31  rsion="1              2132.1.8        
               2e 30 22 20  65 6e 63 6f  .0" enco              2132.1.16       
               64 69 6e 67  3d 22 75 74  ding="ut              2132.1.24       
   7    IN     ef ee ee fe  01 00 00 00  ........              2133.1.0        
               10 00 00 00               ....                  2133.1.8        
   7    IN     45 52 52 21  55 4e 53 55  ERR!UNSU              2134.1.0        
               50 50 4f 52  54 45 44 00  PPORTED.              2134.1.8        
  27    IN     ef ee ee fe  01 00 00 00  ........              2135.1.0        
               10 00 00 00               ....                  2135.1.8        
  27    IN     45 52 52 21  55 4e 53 55  ERR!UNSU              2136.1.0        
               50 50 4f 52  54 45 44 00  PPORTED.              2136.1.8        
   7    IN     ef ee ee fe  01 00 00 00  ........              2137.1.0        
               b6 00 00 00               ....                  2137.1.8        
   7    IN     3c 3f 78 6d  6c 20 76 65  <?xml ve              2138.1.0        
               72 73 69 6f  6e 3d 22 31  rsion="1              2138.1.8        
               2e 30 22 20  65 6e 63 6f  .0" enco              2138.1.16       
               64 69 6e 67  3d 22 75 74  ding="ut              2138.1.24       
  27    IN     ef ee ee fe  01 00 00 00  ........              2139.1.0        
               b6 00 00 00               ....                  2139.1.8        
  27    IN     3c 3f 78 6d  6c 20 76 65  <?xml ve              2140.1.0        
               72 73 69 6f  6e 3d 22 31  rsion="1              2140.1.8        
               2e 30 22 20  65 6e 63 6f  .0" enco              2140.1.16       
               64 69 6e 67  3d 22 75 74  ding="ut              2140.1.24       
   7    OUT    ef ee ee fe  01 00 00 00  ........              2141.1.0        
               03 00 00 00               ....                  2141.1.8        
  27    OUT    ef ee ee fe  01 00 00 00  ........              2142.1.0        
               03 00 00 00               ....                  2142.1.8        
   7    OUT    4f 4b 00                  OK.                   2143.1.0        
  27    OUT    4f 4b 00                  OK.                   2144.1.0        
   7    IN     ef ee ee fe  01 00 00 00  ........              2145.1.0        
               66 00 00 00               f...                  2145.1.8        
   7    IN     3c 3f 78 6d  6c 20 76 65  <?xml ve              2146.1.0        
               72 73 69 6f  6e 3d 22 31  rsion="1              2146.1.8        
               2e 30 22 20  65 6e 63 6f  .0" enco              2146.1.16       
               64 69 6e 67  3d 22 75 74  ding="ut              2146.1.24       
  27    IN     ef ee ee fe  01 00 00 00  ........              2147.1.0        
               66 00 00 00               f...                  2147.1.8        
  27    IN     3c 3f 78 6d  6c 20 76 65  <?xml ve              2148.1.0        
               72 73 69 6f  6e 3d 22 31  rsion="1              2148.1.8        
               2e 30 22 20  65 6e 63 6f  .0" enco              2148.1.16       
               64 69 6e 67  3d 22 75 74  ding="ut              2148.1.24       
   7    OUT    ef ee ee fe  01 00 00 00  ........              2149.1.0        
               03 00 00 00               ....                  2149.1.8        
  27    OUT    ef ee ee fe  01 00 00 00  ........              2150.1.0        
               03 00 00 00               ....                  2150.1.8        
   7    OUT    4f 4b 00                  OK.                   2151.1.0        
  27    OUT    4f 4b 00                  OK.                   2152.1.0        
   7    OUT    ef ee ee fe  01 00 00 00  ........              2153.1.0        
               2b 01 00 00               +...                  2153.1.8        
  27    OUT    ef ee ee fe  01 00 00 00  ........              2154.1.0        
               2b 01 00 00               +...                  2154.1.8        
   7    OUT    3c 3f 78 6d  6c 20 76 65  <?xml ve              2155.1.0        
               72 73 69 6f  6e 3d 22 31  rsion="1              2155.1.8        
               2e 30 22 20  65 6e 63 6f  .0" enco              2155.1.16       
               64 69 6e 67  3d 22 75 74  ding="ut              2155.1.24       
  27    OUT    3c 3f 78 6d  6c 20 76 65  <?xml ve              2156.1.0        
               72 73 69 6f  6e 3d 22 31  rsion="1              2156.1.8        
               2e 30 22 20  65 6e 63 6f  .0" enco              2156.1.16       
               64 69 6e 67  3d 22 75 74  ding="ut              2156.1.24       
   7    IN     ef ee ee fe  01 00 00 00  ........              2157.1.0        
               03 00 00 00               ....                  2157.1.8        
   7    IN     4f 4b 00                  OK.                   2158.1.0        
  27    IN     ef ee ee fe  01 00 00 00  ........              2159.1.0        
               03 00 00 00               ....                  2159.1.8        
  27    IN     4f 4b 00                  OK.                   2160.1.0        
   7    IN     ef ee ee fe  01 00 00 00  ........              2161.1.0        
               56 01 00 00               V...                  2161.1.8        
   7    IN     3c 3f 78 6d  6c 20 76 65  <?xml ve              2162.1.0        
               72 73 69 6f  6e 3d 22 31  rsion="1              2162.1.8        
               2e 30 22 20  65 6e 63 6f  .0" enco              2162.1.16       
               64 69 6e 67  3d 22 75 74  ding="ut              2162.1.24       
  27    IN     ef ee ee fe  01 00 00 00  ........              2163.1.0        
               56 01 00 00               V...                  2163.1.8        
  27    IN     3c 3f 78 6d  6c 20 76 65  <?xml ve              2164.1.0        
               72 73 69 6f  6e 3d 22 31  rsion="1              2164.1.8        
               2e 30 22 20  65 6e 63 6f  .0" enco              2164.1.16       
               64 69 6e 67  3d 22 75 74  ding="ut              2164.1.24       
   7    OUT    ef ee ee fe  01 00 00 00  ........              2165.1.0        
               03 00 00 00               ....                  2165.1.8        
  27    OUT    ef ee ee fe  01 00 00 00  ........              2166.1.0        
               03 00 00 00               ....                  2166.1.8        
   7    OUT    4f 4b 00                  OK.                   2167.1.0        
  27    OUT    4f 4b 00                  OK.                   2168.1.0        
   7    OUT    ef ee ee fe  01 00 00 00  ........              2169.1.0        
               0b 00 00 00               ....                  2169.1.8        
  27    OUT    ef ee ee fe  01 00 00 00  ........              2170.1.0        
               0b 00 00 00               ....                  2170.1.8        
   7    OUT    4f 4b 40 30  78 31 64 62  OK@0x1db              2171.1.0        
               38 30 00                  80.                   2171.1.8        
  27    OUT    4f 4b 40 30  78 31 64 62  OK@0x1db              2172.1.0        
               38 30 00                  80.                   2172.1.8        
   7    IN     ef ee ee fe  01 00 00 00  ........              2173.1.0        
               03 00 00 00               ....                  2173.1.8        
   7    IN     4f 4b 00                  OK.                   2174.1.0        
  27    IN     ef ee ee fe  01 00 00 00  ........              2175.1.0        
               03 00 00 00               ....                  2175.1.8        
  27    IN     4f 4b 00                  OK.                   2176.1.0        
   7    OUT    ef ee ee fe  01 00 00 00  ........              2177.1.0        
               0e 00 00 00               ....                  2177.1.8        
  27    OUT    ef ee ee fe  01 00 00 00  ........              2178.1.0        
               0e 00 00 00               ....                  2178.1.8        
   7    OUT    4f 4b 40 30  78 61 31 64  OK@0xa1d              2179.1.0        
               63 34 35 30  64 00        c450d.                2179.1.8        
  27    OUT    4f 4b 40 30  78 61 31 64  OK@0xa1d              2180.1.0        
               63 34 35 30  64 00        c450d.                2180.1.8        
   7    IN     ef ee ee fe  01 00 00 00  ........              2181.1.0        
               03 00 00 00               ....                  2181.1.8        
   7    IN     4f 4b 00                  OK.                   2182.1.0        
  27    IN     ef ee ee fe  01 00 00 00  ........              2183.1.0        
               03 00 00 00               ....                  2183.1.8        
  27    IN     4f 4b 00                  OK.                   2184.1.0        
   7    OUT    ef ee ee fe  01 00 00 00  ........              2185.1.0        
               80 db 01 00               ....                  2185.1.8        
  27    OUT    ef ee ee fe  01 00 00 00  ........              2186.1.0        
               80 db 01 00               ....                  2186.1.8        
   7    OUT    88 16 88 58  28 f5 0c 00  ...X(...              2187.1.0        
               61 65 65 00  00 00 00 00  aee.....              2187.1.8        
               00 00 00 00  00 00 00 00  ........              2187.1.16       
               00 00 00 00  00 00 00 00  ........              2187.1.24       
  27    OUT    88 16 88 58  28 f5 0c 00  ...X(...              2188.1.0        
               61 65 65 00  00 00 00 00  aee.....              2188.1.8        
               00 00 00 00  00 00 00 00  ........              2188.1.16       
               00 00 00 00  00 00 00 00  ........              2188.1.24       
   7    IN     ef ee ee fe  01 00 00 00  ........              2189.1.0        
               03 00 00 00               ....                  2189.1.8        
   7    IN     4f 4b 00                  OK.                   2190.1.0        
  27    IN     ef ee ee fe  01 00 00 00  ........              2191.1.0        
               03 00 00 00               ....                  2191.1.8        
  27    IN     4f 4b 00                  OK.                   2192.1.0        
   7    IN     ef ee ee fe  01 00 00 00  ........              2193.1.0        
               a9 00 00 00               ....                  2193.1.8        
   7    IN     3c 3f 78 6d  6c 20 76 65  <?xml ve              2194.1.0        
               72 73 69 6f  6e 3d 22 31  rsion="1              2194.1.8        
               2e 30 22 20  65 6e 63 6f  .0" enco              2194.1.16       
               64 69 6e 67  3d 22 75 74  ding="ut              2194.1.24       
  27    IN     ef ee ee fe  01 00 00 00  ........              2195.1.0        
               a9 00 00 00               ....                  2195.1.8        
  27    IN     3c 3f 78 6d  6c 20 76 65  <?xml ve              2196.1.0        
               72 73 69 6f  6e 3d 22 31  rsion="1              2196.1.8        
               2e 30 22 20  65 6e 63 6f  .0" enco              2196.1.16       
               64 69 6e 67  3d 22 75 74  ding="ut              2196.1.24       
   7    OUT    ef ee ee fe  01 00 00 00  ........              2197.1.0        
               03 00 00 00               ....                  2197.1.8        
  27    OUT    ef ee ee fe  01 00 00 00  ........              2198.1.0        
               03 00 00 00               ....                  2198.1.8        
   7    OUT    4f 4b 00                  OK.                   2199.1.0        
  27    OUT    4f 4b 00                  OK.                   2200.1.0        
   7    IN     ef ee ee fe  01 00 00 00  ........              2201.1.0        
               66 00 00 00               f...                  2201.1.8        
   7    IN     3c 3f 78 6d  6c 20 76 65  <?xml ve              2202.1.0        
               72 73 69 6f  6e 3d 22 31  rsion="1              2202.1.8        
               2e 30 22 20  65 6e 63 6f  .0" enco              2202.1.16       
               64 69 6e 67  3d 22 75 74  ding="ut              2202.1.24       
  27    IN     ef ee ee fe  01 00 00 00  ........              2203.1.0        
               66 00 00 00               f...                  2203.1.8        
  27    IN     3c 3f 78 6d  6c 20 76 65  <?xml ve              2204.1.0        
               72 73 69 6f  6e 3d 22 31  rsion="1              2204.1.8        
               2e 30 22 20  65 6e 63 6f  .0" enco              2204.1.16       
               64 69 6e 67  3d 22 75 74  ding="ut              2204.1.24       
   7    OUT    ef ee ee fe  01 00 00 00  ........              2205.1.0        
               03 00 00 00               ....                  2205.1.8        
  27    OUT    ef ee ee fe  01 00 00 00  ........              2206.1.0        
               03 00 00 00               ....                  2206.1.8        
   7    OUT    4f 4b 00                  OK.                   2207.1.0        
  27    OUT    4f 4b 00                  OK.                   2208.1.0        
   7    OUT    ef ee ee fe  01 00 00 00  ........              2209.1.0        
               04 01 00 00               ....                  2209.1.8        
  27    OUT    ef ee ee fe  01 00 00 00  ........              2210.1.0        
               04 01 00 00               ....                  2210.1.8        
   7    OUT    3c 3f 78 6d  6c 20 76 65  <?xml ve              2211.1.0        
               72 73 69 6f  6e 3d 22 31  rsion="1              2211.1.8        
               2e 30 22 20  65 6e 63 6f  .0" enco              2211.1.16       
               64 69 6e 67  3d 22 75 74  ding="ut              2211.1.24       
  27    OUT    3c 3f 78 6d  6c 20 76 65  <?xml ve              2212.1.0        
               72 73 69 6f  6e 3d 22 31  rsion="1              2212.1.8        
               2e 30 22 20  65 6e 63 6f  .0" enco              2212.1.16       
               64 69 6e 67  3d 22 75 74  ding="ut              2212.1.24       
   7    IN     ef ee ee fe  01 00 00 00  ........              2213.1.0        
               03 00 00 00               ....                  2213.1.8        
   7    IN     4f 4b 00                  OK.                   2214.1.0        
  27    IN     ef ee ee fe  01 00 00 00  ........              2215.1.0        
               03 00 00 00               ....                  2215.1.8        
  27    IN     4f 4b 00                  OK.                   2216.1.0        
   7    IN     ef ee ee fe  01 00 00 00  ........              2217.1.0        
               02 01 00 00               ....                  2217.1.8        
   7    IN     3c 3f 78 6d  6c 20 76 65  <?xml ve              2218.1.0        
               72 73 69 6f  6e 3d 22 31  rsion="1              2218.1.8        
               2e 30 22 20  65 6e 63 6f  .0" enco              2218.1.16       
               64 69 6e 67  3d 22 75 74  ding="ut              2218.1.24       
  27    IN     ef ee ee fe  01 00 00 00  ........              2219.1.0        
               02 01 00 00               ....                  2219.1.8        
  27    IN     3c 3f 78 6d  6c 20 76 65  <?xml ve              2220.1.0        
               72 73 69 6f  6e 3d 22 31  rsion="1              2220.1.8        
               2e 30 22 20  65 6e 63 6f  .0" enco              2220.1.16       
               64 69 6e 67  3d 22 75 74  ding="ut              2220.1.24       
   7    OUT    ef ee ee fe  01 00 00 00  ........              2221.1.0        
               03 00 00 00               ....                  2221.1.8        
  27    OUT    ef ee ee fe  01 00 00 00  ........              2222.1.0        
               03 00 00 00               ....                  2222.1.8        
   7    OUT    4f 4b 00                  OK.                   2223.1.0        
  27    OUT    4f 4b 00                  OK.                   2224.1.0        
   7    IN     ef ee ee fe  01 00 00 00  ........              2225.1.0        
               08 00 00 00               ....                  2225.1.8        
   7    IN     4f 4b 40 30  78 64 65 00  OK@0xde.              2226.1.0        
  27    IN     ef ee ee fe  01 00 00 00  ........              2227.1.0        
               08 00 00 00               ....                  2227.1.8        
  27    IN     4f 4b 40 30  78 64 65 00  OK@0xde.              2228.1.0        
   7    OUT    ef ee ee fe  01 00 00 00  ........              2229.1.0        
               03 00 00 00               ....                  2229.1.8        
  27    OUT    ef ee ee fe  01 00 00 00  ........              2230.1.0        
               03 00 00 00               ....                  2230.1.8        
   7    OUT    4f 4b 00                  OK.                   2231.1.0        
  27    OUT    4f 4b 00                  OK.                   2232.1.0        
   7    IN     ef ee ee fe  01 00 00 00  ........              2233.1.0        
               03 00 00 00               ....                  2233.1.8        
   7    IN     4f 4b 00                  OK.                   2234.1.0        
  27    IN     ef ee ee fe  01 00 00 00  ........              2235.1.0        
               03 00 00 00               ....                  2235.1.8        
  27    IN     4f 4b 00                  OK.                   2236.1.0        
   7    OUT    ef ee ee fe  01 00 00 00  ........              2237.1.0        
               03 00 00 00               ....                  2237.1.8        
  27    OUT    ef ee ee fe  01 00 00 00  ........              2238.1.0        
               03 00 00 00               ....                  2238.1.8        
   7    OUT    4f 4b 00                  OK.                   2239.1.0        
  27    OUT    4f 4b 00                  OK.                   2240.1.0        
   7    IN     ef ee ee fe  01 00 00 00  ........              2241.1.0        
               de 00 00 00               ....                  2241.1.8        
   7    IN     4f 53 49 47  30 00 00 01  OSIG0...              2242.1.0        
               59 00 00 00  57 00 00 00  Y...W...              2242.1.8        
               4d 54 4b 00  00 00 00 00  MTK.....              2242.1.16       
               4d 54 36 38  33 35 00 00  MT6835..              2242.1.24       
  27    IN     ef ee ee fe  01 00 00 00  ........              2243.1.0        
               de 00 00 00               ....                  2243.1.8        
  27    IN     4f 53 49 47  30 00 00 01  OSIG0...              2244.1.0        
               59 00 00 00  57 00 00 00  Y...W...              2244.1.8        
               4d 54 4b 00  00 00 00 00  MTK.....              2244.1.16       
               4d 54 36 38  33 35 00 00  MT6835..              2244.1.24       
   7    OUT    ef ee ee fe  01 00 00 00  ........              2245.1.0        
               03 00 00 00               ....                  2245.1.8        
  27    OUT    ef ee ee fe  01 00 00 00  ........              2246.1.0        
               03 00 00 00               ....                  2246.1.8        
   7    OUT    4f 4b 00                  OK.                   2247.1.0        
  27    OUT    4f 4b 00                  OK.                   2248.1.0        
   7    IN     ef ee ee fe  01 00 00 00  ........              2249.1.0        
               95 00 00 00               ....                  2249.1.8        
   7    IN     3c 3f 78 6d  6c 20 76 65  <?xml ve              2250.1.0        
               72 73 69 6f  6e 3d 22 31  rsion="1              2250.1.8        
               2e 30 22 20  65 6e 63 6f  .0" enco              2250.1.16       
               64 69 6e 67  3d 22 75 74  ding="ut              2250.1.24       
  27    IN     ef ee ee fe  01 00 00 00  ........              2251.1.0        
               95 00 00 00               ....                  2251.1.8        
  27    IN     3c 3f 78 6d  6c 20 76 65  <?xml ve              2252.1.0        
               72 73 69 6f  6e 3d 22 31  rsion="1              2252.1.8        
               2e 30 22 20  65 6e 63 6f  .0" enco              2252.1.16       
               64 69 6e 67  3d 22 75 74  ding="ut              2252.1.24       
   7    OUT    ef ee ee fe  01 00 00 00  ........              2253.1.0        
               03 00 00 00               ....                  2253.1.8        
  27    OUT    ef ee ee fe  01 00 00 00  ........              2254.1.0        
               03 00 00 00               ....                  2254.1.8        
   7    OUT    4f 4b 00                  OK.                   2255.1.0        
  27    OUT    4f 4b 00                  OK.                   2256.1.0        
   7    IN     ef ee ee fe  01 00 00 00  ........              2257.1.0        
               66 00 00 00               f...                  2257.1.8        
   7    IN     3c 3f 78 6d  6c 20 76 65  <?xml ve              2258.1.0        
               72 73 69 6f  6e 3d 22 31  rsion="1              2258.1.8        
               2e 30 22 20  65 6e 63 6f  .0" enco              2258.1.16       
               64 69 6e 67  3d 22 75 74  ding="ut              2258.1.24       
  27    IN     ef ee ee fe  01 00 00 00  ........              2259.1.0        
               66 00 00 00               f...                  2259.1.8        
  27    IN     3c 3f 78 6d  6c 20 76 65  <?xml ve              2260.1.0        
               72 73 69 6f  6e 3d 22 31  rsion="1              2260.1.8        
               2e 30 22 20  65 6e 63 6f  .0" enco              2260.1.16       
               64 69 6e 67  3d 22 75 74  ding="ut              2260.1.24       
   7    OUT    ef ee ee fe  01 00 00 00  ........              2261.1.0        
               03 00 00 00               ....                  2261.1.8        
  27    OUT    ef ee ee fe  01 00 00 00  ........              2262.1.0        
               03 00 00 00               ....                  2262.1.8        
   7    OUT    4f 4b 00                  OK.                   2263.1.0        
  27    OUT    4f 4b 00                  OK.                   2264.1.0        
   7    OUT    ef ee ee fe  01 00 00 00  ........              2265.1.0        
               04 01 00 00               ....                  2265.1.8        
  27    OUT    ef ee ee fe  01 00 00 00  ........              2266.1.0        
               04 01 00 00               ....                  2266.1.8        
   7    OUT    3c 3f 78 6d  6c 20 76 65  <?xml ve              2267.1.0        
               72 73 69 6f  6e 3d 22 31  rsion="1              2267.1.8        
               2e 30 22 20  65 6e 63 6f  .0" enco              2267.1.16       
               64 69 6e 67  3d 22 75 74  ding="ut              2267.1.24       
  27    OUT    3c 3f 78 6d  6c 20 76 65  <?xml ve              2268.1.0        
               72 73 69 6f  6e 3d 22 31  rsion="1              2268.1.8        
               2e 30 22 20  65 6e 63 6f  .0" enco              2268.1.16       
               64 69 6e 67  3d 22 75 74  ding="ut              2268.1.24       
   7    IN     ef ee ee fe  01 00 00 00  ........              2269.1.0        
               03 00 00 00               ....                  2269.1.8        
   7    IN     4f 4b 00                  OK.                   2270.1.0        
  27    IN     ef ee ee fe  01 00 00 00  ........              2271.1.0        
               03 00 00 00               ....                  2271.1.8        
  27    IN     4f 4b 00                  OK.                   2272.1.0        
   7    IN     ef ee ee fe  01 00 00 00  ........              2273.1.0        
               03 01 00 00               ....                  2273.1.8        
   7    IN     3c 3f 78 6d  6c 20 76 65  <?xml ve              2274.1.0        
               72 73 69 6f  6e 3d 22 31  rsion="1              2274.1.8        
               2e 30 22 20  65 6e 63 6f  .0" enco              2274.1.16       
               64 69 6e 67  3d 22 75 74  ding="ut              2274.1.24       
  27    IN     ef ee ee fe  01 00 00 00  ........              2275.1.0        
               03 01 00 00               ....                  2275.1.8        
  27    IN     3c 3f 78 6d  6c 20 76 65  <?xml ve              2276.1.0        
               72 73 69 6f  6e 3d 22 31  rsion="1              2276.1.8        
               2e 30 22 20  65 6e 63 6f  .0" enco              2276.1.16       
               64 69 6e 67  3d 22 75 74  ding="ut              2276.1.24       
   7    OUT    ef ee ee fe  01 00 00 00  ........              2277.1.0        
               03 00 00 00               ....                  2277.1.8        
  27    OUT    ef ee ee fe  01 00 00 00  ........              2278.1.0        
               03 00 00 00               ....                  2278.1.8        
   7    OUT    4f 4b 00                  OK.                   2279.1.0        
  27    OUT    4f 4b 00                  OK.                   2280.1.0        
   7    OUT    ef ee ee fe  01 00 00 00  ........              2281.1.0        
               09 00 00 00               ....                  2281.1.8        
  27    OUT    ef ee ee fe  01 00 00 00  ........              2282.1.0        
               09 00 00 00               ....                  2282.1.8        
   7    OUT    4f 4b 40 30  78 38 30 30  OK@0x800              2283.1.0        
               00                        .                     2283.1.8        
  27    OUT    4f 4b 40 30  78 38 30 30  OK@0x800              2284.1.0        
               00                        .                     2284.1.8        
   7    IN     ef ee ee fe  01 00 00 00  ........              2285.1.0        
               03 00 00 00               ....                  2285.1.8        
   7    IN     4f 4b 00                  OK.                   2286.1.0        
  27    IN     ef ee ee fe  01 00 00 00  ........              2287.1.0        
               03 00 00 00               ....                  2287.1.8        
  27    IN     4f 4b 00                  OK.                   2288.1.0        
   7    OUT    ef ee ee fe  01 00 00 00  ........              2289.1.0        
               0e 00 00 00               ....                  2289.1.8        
  27    OUT    ef ee ee fe  01 00 00 00  ........              2290.1.0        
               0e 00 00 00               ....                  2290.1.8        
   7    OUT    4f 4b 40 30  78 61 37 62  OK@0xa7b              2291.1.0        
               64 32 30 39  66 00        d209f.                2291.1.8        
  27    OUT    4f 4b 40 30  78 61 37 62  OK@0xa7b              2292.1.0        
               64 32 30 39  66 00        d209f.                2292.1.8        
   7    IN     ef ee ee fe  01 00 00 00  ........              2293.1.0        
               03 00 00 00               ....                  2293.1.8        
   7    IN     4f 4b 00                  OK.                   2294.1.0        
  27    IN     ef ee ee fe  01 00 00 00  ........              2295.1.0        
               03 00 00 00               ....                  2295.1.8        
  27    IN     4f 4b 00                  OK.                   2296.1.0        
   7    OUT    ef ee ee fe  01 00 00 00  ........              2297.1.0        
               00 08 00 00               ....                  2297.1.8        
  27    OUT    ef ee ee fe  01 00 00 00  ........              2298.1.0        
               00 08 00 00               ....                  2298.1.8        
   7    OUT    56 f8 cc 85  7f 3f 52 08  V....?R.              2299.1.0        
               1e 5a 01 c2  d2 e1 f2 39  .Z.....9              2299.1.8        
               ed 6d 24 f0  5b 76 2f 72  .m$.[v/r              2299.1.16       
               78 d3 48 d6  9d 7b 96 94  x.H.....              2299.1.24       
  27    OUT    56 f8 cc 85  7f 3f 52 08  V....?R.              2300.1.0        
               1e 5a 01 c2  d2 e1 f2 39  .Z.....9              2300.1.8        
               ed 6d 24 f0  5b 76 2f 72  .m$.[v/r              2300.1.16       
               78 d3 48 d6  9d 7b 96 94  x.H.....              2300.1.24       
   7    IN     ef ee ee fe  01 00 00 00  ........              2301.1.0        
               03 00 00 00               ....                  2301.1.8        
   7    OUT                                                    2302.1.0        
   7    IN     4f 4b 00                  OK.                   2303.1.0        
  27    IN     ef ee ee fe  01 00 00 00  ........              2304.1.0        
               03 00 00 00               ....                  2304.1.8        
  27    IN     4f 4b 00                  OK.                   2305.1.0        
   7    IN     ef ee ee fe  01 00 00 00  ........              2306.1.0        
               95 00 00 00               ....                  2306.1.8        
   7    IN     3c 3f 78 6d  6c 20 76 65  <?xml ve              2307.1.0        
               72 73 69 6f  6e 3d 22 31  rsion="1              2307.1.8        
               2e 30 22 20  65 6e 63 6f  .0" enco              2307.1.16       
               64 69 6e 67  3d 22 75 74  ding="ut              2307.1.24       
  27    IN     ef ee ee fe  01 00 00 00  ........              2308.1.0        
               95 00 00 00               ....                  2308.1.8        
  27    IN     3c 3f 78 6d  6c 20 76 65  <?xml ve              2309.1.0        
               72 73 69 6f  6e 3d 22 31  rsion="1              2309.1.8        
               2e 30 22 20  65 6e 63 6f  .0" enco              2309.1.16       
               64 69 6e 67  3d 22 75 74  ding="ut              2309.1.24       
   7    OUT    ef ee ee fe  01 00 00 00  ........              2310.1.0        
               03 00 00 00               ....                  2310.1.8        
  27    OUT    ef ee ee fe  01 00 00 00  ........              2311.1.0        
               03 00 00 00               ....                  2311.1.8        
   7    OUT    4f 4b 00                  OK.                   2312.1.0        
  27    OUT    4f 4b 00                  OK.                   2313.1.0        
   7    IN     ef ee ee fe  01 00 00 00  ........              2314.1.0        
               66 00 00 00               f...                  2314.1.8        
   7    IN     3c 3f 78 6d  6c 20 76 65  <?xml ve              2315.1.0        
               72 73 69 6f  6e 3d 22 31  rsion="1              2315.1.8        
               2e 30 22 20  65 6e 63 6f  .0" enco              2315.1.16       
               64 69 6e 67  3d 22 75 74  ding="ut              2315.1.24       
  27    IN     ef ee ee fe  01 00 00 00  ........              2316.1.0        
               66 00 00 00               f...                  2316.1.8        
  27    IN     3c 3f 78 6d  6c 20 76 65  <?xml ve              2317.1.0        
               72 73 69 6f  6e 3d 22 31  rsion="1              2317.1.8        
               2e 30 22 20  65 6e 63 6f  .0" enco              2317.1.16       
               64 69 6e 67  3d 22 75 74  ding="ut              2317.1.24       
   7    OUT    ef ee ee fe  01 00 00 00  ........              2318.1.0        
               03 00 00 00               ....                  2318.1.8        
  27    OUT    ef ee ee fe  01 00 00 00  ........              2319.1.0        
               03 00 00 00               ....                  2319.1.8        
   7    OUT    4f 4b 00                  OK.                   2320.1.0        
  27    OUT    4f 4b 00                  OK.                   2321.1.0        
   7    OUT    ef ee ee fe  01 00 00 00  ........              2322.1.0        
               c7 00 00 00               ....                  2322.1.8        
  27    OUT    ef ee ee fe  01 00 00 00  ........              2323.1.0        
               c7 00 00 00               ....                  2323.1.8        
   7    OUT    3c 3f 78 6d  6c 20 76 65  <?xml ve              2324.1.0        
               72 73 69 6f  6e 3d 22 31  rsion="1              2324.1.8        
               2e 30 22 20  65 6e 63 6f  .0" enco              2324.1.16       
               64 69 6e 67  3d 22 75 74  ding="ut              2324.1.24       
  27    OUT    3c 3f 78 6d  6c 20 76 65  <?xml ve              2325.1.0        
               72 73 69 6f  6e 3d 22 31  rsion="1              2325.1.8        
               2e 30 22 20  65 6e 63 6f  .0" enco              2325.1.16       
               64 69 6e 67  3d 22 75 74  ding="ut              2325.1.24       
   7    IN     ef ee ee fe  01 00 00 00  ........              2326.1.0        
               03 00 00 00               ....                  2326.1.8        
   7    IN     4f 4b 00                  OK.                   2327.1.0        
  27    IN     ef ee ee fe  01 00 00 00  ........              2328.1.0        
               03 00 00 00               ....                  2328.1.8        
  27    IN     4f 4b 00                  OK.                   2329.1.0        
   7    IN     ef ee ee fe  01 00 00 00  ........              2330.1.0        
               01 01 00 00               ....                  2330.1.8        
   7    IN     3c 3f 78 6d  6c 20 76 65  <?xml ve              2331.1.0        
               72 73 69 6f  6e 3d 22 31  rsion="1              2331.1.8        
               2e 30 22 20  65 6e 63 6f  .0" enco              2331.1.16       
               64 69 6e 67  3d 22 75 74  ding="ut              2331.1.24       
  27    IN     ef ee ee fe  01 00 00 00  ........              2332.1.0        
               01 01 00 00               ....                  2332.1.8        
  27    IN     3c 3f 78 6d  6c 20 76 65  <?xml ve              2333.1.0        
               72 73 69 6f  6e 3d 22 31  rsion="1              2333.1.8        
               2e 30 22 20  65 6e 63 6f  .0" enco              2333.1.16       
               64 69 6e 67  3d 22 75 74  ding="ut              2333.1.24       
   7    OUT    ef ee ee fe  01 00 00 00  ........              2334.1.0        
               03 00 00 00               ....                  2334.1.8        
  27    OUT    ef ee ee fe  01 00 00 00  ........              2335.1.0        
               03 00 00 00               ....                  2335.1.8        
   7    OUT    4f 4b 00                  OK.                   2336.1.0        
  27    OUT    4f 4b 00                  OK.                   2337.1.0        
   7    IN     ef ee ee fe  01 00 00 00  ........              2338.1.0        
               09 00 00 00               ....                  2338.1.8        
   7    IN     4f 4b 40 30  78 32 31 33  OK@0x213              2339.1.0        
               00                        .                     2339.1.8        
  27    IN     ef ee ee fe  01 00 00 00  ........              2340.1.0        
               09 00 00 00               ....                  2340.1.8        
  27    IN     4f 4b 40 30  78 32 31 33  OK@0x213              2341.1.0        
               00                        .                     2341.1.8        
   7    OUT    ef ee ee fe  01 00 00 00  ........              2342.1.0        
               03 00 00 00               ....                  2342.1.8        
  27    OUT    ef ee ee fe  01 00 00 00  ........              2343.1.0        
               03 00 00 00               ....                  2343.1.8        
   7    OUT    4f 4b 00                  OK.                   2344.1.0        
  27    OUT    4f 4b 00                  OK.                   2345.1.0        
   7    IN     ef ee ee fe  01 00 00 00  ........              2346.1.0        
               03 00 00 00               ....                  2346.1.8        
   7    IN     4f 4b 00                  OK.                   2347.1.0        
  27    IN     ef ee ee fe  01 00 00 00  ........              2348.1.0        
               03 00 00 00               ....                  2348.1.8        
  27    IN     4f 4b 00                  OK.                   2349.1.0        
   7    OUT    ef ee ee fe  01 00 00 00  ........              2350.1.0        
               03 00 00 00               ....                  2350.1.8        
  27    OUT    ef ee ee fe  01 00 00 00  ........              2351.1.0        
               03 00 00 00               ....                  2351.1.8        
   7    OUT    4f 4b 00                  OK.                   2352.1.0        
  27    OUT    4f 4b 00                  OK.                   2353.1.0        
   7    IN     ef ee ee fe  01 00 00 00  ........              2354.1.0        
               13 02 00 00               ....                  2354.1.8        
   7    IN     3c 3f 78 6d  6c 20 76 65  <?xml ve              2355.1.0        
               72 73 69 6f  6e 3d 22 31  rsion="1              2355.1.8        
               2e 30 22 20  65 6e 63 6f  .0" enco              2355.1.16       
               64 69 6e 67  3d 22 75 74  ding="ut              2355.1.24       
  27    IN     ef ee ee fe  01 00 00 00  ........              2356.1.0        
               13 02 00 00               ....                  2356.1.8        
  27    IN     3c 3f 78 6d  6c 20 76 65  <?xml ve              2357.1.0        
               72 73 69 6f  6e 3d 22 31  rsion="1              2357.1.8        
               2e 30 22 20  65 6e 63 6f  .0" enco              2357.1.16       
               64 69 6e 67  3d 22 75 74  ding="ut              2357.1.24       
   7    OUT    ef ee ee fe  01 00 00 00  ........              2358.1.0        
               03 00 00 00               ....                  2358.1.8        
  27    OUT    ef ee ee fe  01 00 00 00  ........              2359.1.0        
               03 00 00 00               ....                  2359.1.8        
   7    OUT    4f 4b 00                  OK.                   2360.1.0        
  27    OUT    4f 4b 00                  OK.                   2361.1.0        
   7    IN     ef ee ee fe  01 00 00 00  ........              2362.1.0        
               95 00 00 00               ....                  2362.1.8        
   7    IN     3c 3f 78 6d  6c 20 76 65  <?xml ve              2363.1.0        
               72 73 69 6f  6e 3d 22 31  rsion="1              2363.1.8        
               2e 30 22 20  65 6e 63 6f  .0" enco              2363.1.16       
               64 69 6e 67  3d 22 75 74  ding="ut              2363.1.24       
  27    IN     ef ee ee fe  01 00 00 00  ........              2364.1.0        
               95 00 00 00               ....                  2364.1.8        
  27    IN     3c 3f 78 6d  6c 20 76 65  <?xml ve              2365.1.0        
               72 73 69 6f  6e 3d 22 31  rsion="1              2365.1.8        
               2e 30 22 20  65 6e 63 6f  .0" enco              2365.1.16       
               64 69 6e 67  3d 22 75 74  ding="ut              2365.1.24       
   7    OUT    ef ee ee fe  01 00 00 00  ........              2366.1.0        
               03 00 00 00               ....                  2366.1.8        
  27    OUT    ef ee ee fe  01 00 00 00  ........              2367.1.0        
               03 00 00 00               ....                  2367.1.8        
   7    OUT    4f 4b 00                  OK.                   2368.1.0        
  27    OUT    4f 4b 00                  OK.                   2369.1.0        
   7    IN     ef ee ee fe  01 00 00 00  ........              2370.1.0        
               66 00 00 00               f...                  2370.1.8        
   7    IN     3c 3f 78 6d  6c 20 76 65  <?xml ve              2371.1.0        
               72 73 69 6f  6e 3d 22 31  rsion="1              2371.1.8        
               2e 30 22 20  65 6e 63 6f  .0" enco              2371.1.16       
               64 69 6e 67  3d 22 75 74  ding="ut              2371.1.24       
  27    IN     ef ee ee fe  01 00 00 00  ........              2372.1.0        
               66 00 00 00               f...                  2372.1.8        
  27    IN     3c 3f 78 6d  6c 20 76 65  <?xml ve              2373.1.0        
               72 73 69 6f  6e 3d 22 31  rsion="1              2373.1.8        
               2e 30 22 20  65 6e 63 6f  .0" enco              2373.1.16       
               64 69 6e 67  3d 22 75 74  ding="ut              2373.1.24       
   7    OUT    ef ee ee fe  01 00 00 00  ........              2374.1.0        
               03 00 00 00               ....                  2374.1.8        
  27    OUT    ef ee ee fe  01 00 00 00  ........              2375.1.0        
               03 00 00 00               ....                  2375.1.8        
   7    OUT    4f 4b 00                  OK.                   2376.1.0        
  27    OUT    4f 4b 00                  OK.                   2377.1.0        
   7    OUT    ef ee ee fe  01 00 00 00  ........              2378.1.0        
               bb 00 00 00               ....                  2378.1.8        
  27    OUT    ef ee ee fe  01 00 00 00  ........              2379.1.0        
               bb 00 00 00               ....                  2379.1.8        
   7    OUT    3c 3f 78 6d  6c 20 76 65  <?xml ve              2380.1.0        
               72 73 69 6f  6e 3d 22 31  rsion="1              2380.1.8        
               2e 30 22 20  65 6e 63 6f  .0" enco              2380.1.16       
               64 69 6e 67  3d 22 75 74  ding="ut              2380.1.24       
  27    OUT    3c 3f 78 6d  6c 20 76 65  <?xml ve              2381.1.0        
               72 73 69 6f  6e 3d 22 31  rsion="1              2381.1.8        
               2e 30 22 20  65 6e 63 6f  .0" enco              2381.1.16       
               64 69 6e 67  3d 22 75 74  ding="ut              2381.1.24       
   7    IN     ef ee ee fe  01 00 00 00  ........              2382.1.0        
               10 00 00 00               ....                  2382.1.8        
   7    IN     45 52 52 21  55 4e 53 55  ERR!UNSU              2383.1.0        
               50 50 4f 52  54 45 44 00  PPORTED.              2383.1.8        
  27    IN     ef ee ee fe  01 00 00 00  ........              2384.1.0        
               10 00 00 00               ....                  2384.1.8        
  27    IN     45 52 52 21  55 4e 53 55  ERR!UNSU              2385.1.0        
               50 50 4f 52  54 45 44 00  PPORTED.              2385.1.8        
   7    IN     ef ee ee fe  01 00 00 00  ........              2386.1.0        
               b6 00 00 00               ....                  2386.1.8        
   7    IN     3c 3f 78 6d  6c 20 76 65  <?xml ve              2387.1.0        
               72 73 69 6f  6e 3d 22 31  rsion="1              2387.1.8        
               2e 30 22 20  65 6e 63 6f  .0" enco              2387.1.16       
               64 69 6e 67  3d 22 75 74  ding="ut              2387.1.24       
  27    IN     ef ee ee fe  01 00 00 00  ........              2388.1.0        
               b6 00 00 00               ....                  2388.1.8        
  27    IN     3c 3f 78 6d  6c 20 76 65  <?xml ve              2389.1.0        
               72 73 69 6f  6e 3d 22 31  rsion="1              2389.1.8        
               2e 30 22 20  65 6e 63 6f  .0" enco              2389.1.16       
               64 69 6e 67  3d 22 75 74  ding="ut              2389.1.24       
   7    OUT    ef ee ee fe  01 00 00 00  ........              2390.1.0        
               03 00 00 00               ....                  2390.1.8        
  27    OUT    ef ee ee fe  01 00 00 00  ........              2391.1.0        
               03 00 00 00               ....                  2391.1.8        
   7    OUT    4f 4b 00                  OK.                   2392.1.0        
  27    OUT    4f 4b 00                  OK.                   2393.1.0        
   7    IN     ef ee ee fe  01 00 00 00  ........              2394.1.0        
               66 00 00 00               f...                  2394.1.8        
   7    IN     3c 3f 78 6d  6c 20 76 65  <?xml ve              2395.1.0        
               72 73 69 6f  6e 3d 22 31  rsion="1              2395.1.8        
               2e 30 22 20  65 6e 63 6f  .0" enco              2395.1.16       
               64 69 6e 67  3d 22 75 74  ding="ut              2395.1.24       
  27    IN     ef ee ee fe  01 00 00 00  ........              2396.1.0        
               66 00 00 00               f...                  2396.1.8        
  27    IN     3c 3f 78 6d  6c 20 76 65  <?xml ve              2397.1.0        
               72 73 69 6f  6e 3d 22 31  rsion="1              2397.1.8        
               2e 30 22 20  65 6e 63 6f  .0" enco              2397.1.16       
               64 69 6e 67  3d 22 75 74  ding="ut              2397.1.24       
   7    OUT    ef ee ee fe  01 00 00 00  ........              2398.1.0        
               03 00 00 00               ....                  2398.1.8        
  27    OUT    ef ee ee fe  01 00 00 00  ........              2399.1.0        
               03 00 00 00               ....                  2399.1.8        
   7    OUT    4f 4b 00                  OK.                   2400.1.0        
  27    OUT    4f 4b 00                  OK.                   2401.1.0        
   7    OUT    ef ee ee fe  01 00 00 00  ........              2402.1.0        
               d0 00 00 00               ....                  2402.1.8        
  27    OUT    ef ee ee fe  01 00 00 00  ........              2403.1.0        
               d0 00 00 00               ....                  2403.1.8        
   7    OUT    3c 3f 78 6d  6c 20 76 65  <?xml ve              2404.1.0        
               72 73 69 6f  6e 3d 22 31  rsion="1              2404.1.8        
               2e 30 22 20  65 6e 63 6f  .0" enco              2404.1.16       
               64 69 6e 67  3d 22 75 74  ding="ut              2404.1.24       
  27    OUT    3c 3f 78 6d  6c 20 76 65  <?xml ve              2405.1.0        
               72 73 69 6f  6e 3d 22 31  rsion="1              2405.1.8        
               2e 30 22 20  65 6e 63 6f  .0" enco              2405.1.16       
               64 69 6e 67  3d 22 75 74  ding="ut              2405.1.24       
   7    IN     ef ee ee fe  01 00 00 00  ........              2406.1.0        
               03 00 00 00               ....                  2406.1.8        
   7    IN     4f 4b 00                  OK.                   2407.1.0        
  27    IN     ef ee ee fe  01 00 00 00  ........              2408.1.0        
               03 00 00 00               ....                  2408.1.8        
  27    IN     4f 4b 00                  OK.                   2409.1.0        
   7    IN     ef ee ee fe  01 00 00 00  ........              2410.1.0        
               09 01 00 00               ....                  2410.1.8        
   7    IN     3c 3f 78 6d  6c 20 76 65  <?xml ve              2411.1.0        
               72 73 69 6f  6e 3d 22 31  rsion="1              2411.1.8        
               2e 30 22 20  65 6e 63 6f  .0" enco              2411.1.16       
               64 69 6e 67  3d 22 75 74  ding="ut              2411.1.24       
  27    IN     ef ee ee fe  01 00 00 00  ........              2412.1.0        
               09 01 00 00               ....                  2412.1.8        
  27    IN     3c 3f 78 6d  6c 20 76 65  <?xml ve              2413.1.0        
               72 73 69 6f  6e 3d 22 31  rsion="1              2413.1.8        
               2e 30 22 20  65 6e 63 6f  .0" enco              2413.1.16       
               64 69 6e 67  3d 22 75 74  ding="ut              2413.1.24       
   7    OUT    ef ee ee fe  01 00 00 00  ........              2414.1.0        
               03 00 00 00               ....                  2414.1.8        
  27    OUT    ef ee ee fe  01 00 00 00  ........              2415.1.0        
               03 00 00 00               ....                  2415.1.8        
   7    OUT    4f 4b 00                  OK.                   2416.1.0        
  27    OUT    4f 4b 00                  OK.                   2417.1.0        
   7    IN     ef ee ee fe  01 00 00 00  ........              2418.1.0        
               0a 00 00 00               ....                  2418.1.8        
   7    IN     4f 4b 40 30  78 31 38 34  OK@0x184              2419.1.0        
               32 00                     2.                    2419.1.8        
  27    IN     ef ee ee fe  01 00 00 00  ........              2420.1.0        
               0a 00 00 00               ....                  2420.1.8        
  27    IN     4f 4b 40 30  78 31 38 34  OK@0x184              2421.1.0        
               32 00                     2.                    2421.1.8        
   7    OUT    ef ee ee fe  01 00 00 00  ........              2422.1.0        
               03 00 00 00               ....                  2422.1.8        
  27    OUT    ef ee ee fe  01 00 00 00  ........              2423.1.0        
               03 00 00 00               ....                  2423.1.8        
   7    OUT    4f 4b 00                  OK.                   2424.1.0        
  27    OUT    4f 4b 00                  OK.                   2425.1.0        
   7    IN     ef ee ee fe  01 00 00 00  ........              2426.1.0        
               03 00 00 00               ....                  2426.1.8        
   7    IN     4f 4b 00                  OK.                   2427.1.0        
  27    IN     ef ee ee fe  01 00 00 00  ........              2428.1.0        
               03 00 00 00               ....                  2428.1.8        
  27    IN     4f 4b 00                  OK.                   2429.1.0        
   7    OUT    ef ee ee fe  01 00 00 00  ........              2430.1.0        
               03 00 00 00               ....                  2430.1.8        
  27    OUT    ef ee ee fe  01 00 00 00  ........              2431.1.0        
               03 00 00 00               ....                  2431.1.8        
   7    OUT    4f 4b 00                  OK.                   2432.1.0        
  27    OUT    4f 4b 00                  OK.                   2433.1.0        
   7    IN     ef ee ee fe  01 00 00 00  ........              2434.1.0        
               42 18 00 00               B...                  2434.1.8        
  27    IN     ef ee ee fe  01 00 00 00  ........              2435.1.0        
               42 18 00 00               B...                  2435.1.8        
   7    IN     3c 3f 78 6d  6c 20 76 65  <?xml ve              2436.1.0        
               72 73 69 6f  6e 3d 22 31  rsion="1              2436.1.8        
               2e 30 22 20  65 6e 63 6f  .0" enco              2436.1.16       
               64 69 6e 67  3d 22 75 74  ding="ut              2436.1.24       
   7    IN     7a 65 3e 30  78 31 66 30  ze>0x1f0              2437.1.0        
               30 30 30 30  3c 2f 73 69  0000</si              2437.1.8        
               7a 65 3e 3c  2f 70 74 3e  ze></pt>              2437.1.16       
               3c 70 74 3e  3c 6e 61 6d  <pt><nam              2437.1.24       
  27    IN     3c 3f 78 6d  6c 20 76 65  <?xml ve              2438.1.0        
               72 73 69 6f  6e 3d 22 31  rsion="1              2438.1.8        
               2e 30 22 20  65 6e 63 6f  .0" enco              2438.1.16       
               64 69 6e 67  3d 22 75 74  ding="ut              2438.1.24       
   7    OUT    ef ee ee fe  01 00 00 00  ........              2439.1.0        
               03 00 00 00               ....                  2439.1.8        
  27    OUT    ef ee ee fe  01 00 00 00  ........              2440.1.0        
               03 00 00 00               ....                  2440.1.8        
   7    OUT    4f 4b 00                  OK.                   2441.1.0        
  27    OUT    4f 4b 00                  OK.                   2442.1.0        
   7    IN     ef ee ee fe  01 00 00 00  ........              2443.1.0        
               95 00 00 00               ....                  2443.1.8        
   7    IN     3c 3f 78 6d  6c 20 76 65  <?xml ve              2444.1.0        
               72 73 69 6f  6e 3d 22 31  rsion="1              2444.1.8        
               2e 30 22 20  65 6e 63 6f  .0" enco              2444.1.16       
               64 69 6e 67  3d 22 75 74  ding="ut              2444.1.24       
  27    IN     ef ee ee fe  01 00 00 00  ........              2445.1.0        
               95 00 00 00               ....                  2445.1.8        
  27    IN     3c 3f 78 6d  6c 20 76 65  <?xml ve              2446.1.0        
               72 73 69 6f  6e 3d 22 31  rsion="1              2446.1.8        
               2e 30 22 20  65 6e 63 6f  .0" enco              2446.1.16       
               64 69 6e 67  3d 22 75 74  ding="ut              2446.1.24       
   7    OUT    ef ee ee fe  01 00 00 00  ........              2447.1.0        
               03 00 00 00               ....                  2447.1.8        
  27    OUT    ef ee ee fe  01 00 00 00  ........              2448.1.0        
               03 00 00 00               ....                  2448.1.8        
   7    OUT    4f 4b 00                  OK.                   2449.1.0        
  27    OUT    4f 4b 00                  OK.                   2450.1.0        
   7    IN     ef ee ee fe  01 00 00 00  ........              2451.1.0        
               66 00 00 00               f...                  2451.1.8        
   7    IN     3c 3f 78 6d  6c 20 76 65  <?xml ve              2452.1.0        
               72 73 69 6f  6e 3d 22 31  rsion="1              2452.1.8        
               2e 30 22 20  65 6e 63 6f  .0" enco              2452.1.16       
               64 69 6e 67  3d 22 75 74  ding="ut              2452.1.24       
  27    IN     ef ee ee fe  01 00 00 00  ........              2453.1.0        
               66 00 00 00               f...                  2453.1.8        
  27    IN     3c 3f 78 6d  6c 20 76 65  <?xml ve              2454.1.0        
               72 73 69 6f  6e 3d 22 31  rsion="1              2454.1.8        
               2e 30 22 20  65 6e 63 6f  .0" enco              2454.1.16       
               64 69 6e 67  3d 22 75 74  ding="ut              2454.1.24       
   7    OUT    ef ee ee fe  01 00 00 00  ........              2455.1.0        
               03 00 00 00               ....                  2455.1.8        
  27    OUT    ef ee ee fe  01 00 00 00  ........              2456.1.0        
               03 00 00 00               ....                  2456.1.8        
   7    OUT    4f 4b 00                  OK.                   2457.1.0        
  27    OUT    4f 4b 00                  OK.                   2458.1.0        
   7    OUT    ef ee ee fe  01 00 00 00  ........              2459.1.0        
               34 01 00 00               4...                  2459.1.8        
  27    OUT    ef ee ee fe  01 00 00 00  ........              2460.1.0        
               34 01 00 00               4...                  2460.1.8        
   7    OUT    3c 3f 78 6d  6c 20 76 65  <?xml ve              2461.1.0        
               72 73 69 6f  6e 3d 22 31  rsion="1              2461.1.8        
               2e 30 22 20  65 6e 63 6f  .0" enco              2461.1.16       
               64 69 6e 67  3d 22 75 74  ding="ut              2461.1.24       
  27    OUT    3c 3f 78 6d  6c 20 76 65  <?xml ve              2462.1.0        
               72 73 69 6f  6e 3d 22 31  rsion="1              2462.1.8        
               2e 30 22 20  65 6e 63 6f  .0" enco              2462.1.16       
               64 69 6e 67  3d 22 75 74  ding="ut              2462.1.24       
   7    IN     ef ee ee fe  01 00 00 00  ........              2463.1.0        
               03 00 00 00               ....                  2463.1.8        
   7    IN     4f 4b 00                  OK.                   2464.1.0        
  27    IN     ef ee ee fe  01 00 00 00  ........              2465.1.0        
               03 00 00 00               ....                  2465.1.8        
  27    IN     4f 4b 00                  OK.                   2466.1.0        
   7    IN     ef ee ee fe  01 00 00 00  ........              2467.1.0        
               02 01 00 00               ....                  2467.1.8        
   7    IN     3c 3f 78 6d  6c 20 76 65  <?xml ve              2468.1.0        
               72 73 69 6f  6e 3d 22 31  rsion="1              2468.1.8        
               2e 30 22 20  65 6e 63 6f  .0" enco              2468.1.16       
               64 69 6e 67  3d 22 75 74  ding="ut              2468.1.24       
  27    IN     ef ee ee fe  01 00 00 00  ........              2469.1.0        
               02 01 00 00               ....                  2469.1.8        
  27    IN     3c 3f 78 6d  6c 20 76 65  <?xml ve              2470.1.0        
               72 73 69 6f  6e 3d 22 31  rsion="1              2470.1.8        
               2e 30 22 20  65 6e 63 6f  .0" enco              2470.1.16       
               64 69 6e 67  3d 22 75 74  ding="ut              2470.1.24       
   7    OUT    ef ee ee fe  01 00 00 00  ........              2471.1.0        
               03 00 00 00               ....                  2471.1.8        
  27    OUT    ef ee ee fe  01 00 00 00  ........              2472.1.0        
               03 00 00 00               ....                  2472.1.8        
   7    OUT    4f 4b 00                  OK.                   2473.1.0        
  27    OUT    4f 4b 00                  OK.                   2474.1.0        
   7    IN     ef ee ee fe  01 00 00 00  ........              2475.1.0        
               16 00 00 00               ....                  2475.1.8        
   7    IN     4f 4b 40 30  78 30 30 30  OK@0x000              2476.1.0        
               30 30 30 30  30 30 30 38  00000008              2476.1.8        
               30 30 30 30  30 00        00000.                2476.1.16       
  27    IN     ef ee ee fe  01 00 00 00  ........              2477.1.0        
               16 00 00 00               ....                  2477.1.8        
  27    IN     4f 4b 40 30  78 30 30 30  OK@0x000              2478.1.0        
               30 30 30 30  30 30 30 38  00000008              2478.1.8        
               30 30 30 30  30 00        00000.                2478.1.16       
   7    OUT    ef ee ee fe  01 00 00 00  ........              2479.1.0        
               03 00 00 00               ....                  2479.1.8        
  27    OUT    ef ee ee fe  01 00 00 00  ........              2480.1.0        
               03 00 00 00               ....                  2480.1.8        
   7    OUT    4f 4b 00                  OK.                   2481.1.0        
  27    OUT    4f 4b 00                  OK.                   2482.1.0        
   7    IN     ef ee ee fe  01 00 00 00  ........              2483.1.0        
               07 00 00 00               ....                  2483.1.8        
   7    IN     4f 4b 40 30  78 30 00     OK@0x0.               2484.1.0        
  27    IN     ef ee ee fe  01 00 00 00  ........              2485.1.0        
               07 00 00 00               ....                  2485.1.8        
  27    IN     4f 4b 40 30  78 30 00     OK@0x0.               2486.1.0        
   7    OUT    ef ee ee fe  01 00 00 00  ........              2487.1.0        
               03 00 00 00               ....                  2487.1.8        
  27    OUT    ef ee ee fe  01 00 00 00  ........              2488.1.0        
               03 00 00 00               ....                  2488.1.8        
   7    OUT    4f 4b 00                  OK.                   2489.1.0        
  27    OUT    4f 4b 00                  OK.                   2490.1.0        
   7    IN     ef ee ee fe  01 00 00 00  ........              2491.1.0        
               00 00 20 00               .. .                  2491.1.8        
  27    IN     ef ee ee fe  01 00 00 00  ........              2492.1.0        
               00 00 20 00               .. .                  2492.1.8        
   7    IN     54 44 43 4f  01 00 00 00  TDCO....              2493.1.0        
               10 00 00 00  16 00 00 00  ........              2493.1.8        
               35 93 97 96  c4 92 56 76  5.....Vv              2493.1.16       
               15 52 96 87  57 56 76 56  .R..WVvV              2493.1.24       
   7    IN     00 00 00 00  00 00 00 00  ........              2494.1.0(519)   
               00 00 00 00  00 00 00 00  ........              2494.1.8        
               00 00 00 00  00 00 00 00  ........              2494.1.16       
               00 00 00 00  00 00 00 00  ........              2494.1.24       
   7    IN                                                     3013.1.0        
  27    IN     54 44 43 4f  01 00 00 00  TDCO....              3014.1.0        
               10 00 00 00  16 00 00 00  ........              3014.1.8        
               35 93 97 96  c4 92 56 76  5.....Vv              3014.1.16       
               15 52 96 87  57 56 76 56  .R..WVvV              3014.1.24       
   7    OUT    ef ee ee fe  01 00 00 00  ........              3015.1.0        
               03 00 00 00               ....                  3015.1.8        
  27    OUT    ef ee ee fe  01 00 00 00  ........              3016.1.0        
               03 00 00 00               ....                  3016.1.8        
   7    OUT    4f 4b 00                  OK.                   3017.1.0        
  27    OUT    4f 4b 00                  OK.                   3018.1.0        
   7    IN     ef ee ee fe  01 00 00 00  ........              3019.1.0        
               07 00 00 00               ....                  3019.1.8        
   7    IN     4f 4b 40 30  78 30 00     OK@0x0.               3020.1.0        
  27    IN     ef ee ee fe  01 00 00 00  ........              3021.1.0        
               07 00 00 00               ....                  3021.1.8        
  27    IN     4f 4b 40 30  78 30 00     OK@0x0.               3022.1.0        
   7    OUT    ef ee ee fe  01 00 00 00  ........              3023.1.0        
               03 00 00 00               ....                  3023.1.8        
  27    OUT    ef ee ee fe  01 00 00 00  ........              3024.1.0        
               03 00 00 00               ....                  3024.1.8        
   7    OUT    4f 4b 00                  OK.                   3025.1.0        
  27    OUT    4f 4b 00                  OK.                   3026.1.0        
   7    IN     ef ee ee fe  01 00 00 00  ........              3027.1.0        
               00 00 20 00               .. .                  3027.1.8        
  27    IN     ef ee ee fe  01 00 00 00  ........              3028.1.0        
               00 00 20 00               .. .                  3028.1.8        
   7    IN     00 00 00 00  00 00 00 00  ........              3029.1.0(520)   
               00 00 00 00  00 00 00 00  ........              3029.1.8        
               00 00 00 00  00 00 00 00  ........              3029.1.16       
               00 00 00 00  00 00 00 00  ........              3029.1.24       
   7    IN                                                     3549.1.0        
  27    IN     00 00 00 00  00 00 00 00  ........              3550.1.0        
               00 00 00 00  00 00 00 00  ........              3550.1.8        
               00 00 00 00  00 00 00 00  ........              3550.1.16       
               00 00 00 00  00 00 00 00  ........              3550.1.24       
   7    OUT    ef ee ee fe  01 00 00 00  ........              3551.1.0        
               03 00 00 00               ....                  3551.1.8        
  27    OUT    ef ee ee fe  01 00 00 00  ........              3552.1.0        
               03 00 00 00               ....                  3552.1.8        
   7    OUT    4f 4b 00                  OK.                   3553.1.0        
  27    OUT    4f 4b 00                  OK.                   3554.1.0        
   7    IN     ef ee ee fe  01 00 00 00  ........              3555.1.0        
               07 00 00 00               ....                  3555.1.8        
   7    IN     4f 4b 40 30  78 30 00     OK@0x0.               3556.1.0        
  27    IN     ef ee ee fe  01 00 00 00  ........              3557.1.0        
               07 00 00 00               ....                  3557.1.8        
  27    IN     4f 4b 40 30  78 30 00     OK@0x0.               3558.1.0        
   7    OUT    ef ee ee fe  01 00 00 00  ........              3559.1.0        
               03 00 00 00               ....                  3559.1.8        
  27    OUT    ef ee ee fe  01 00 00 00  ........              3560.1.0        
               03 00 00 00               ....                  3560.1.8        
   7    OUT    4f 4b 00                  OK.                   3561.1.0        
  27    OUT    4f 4b 00                  OK.                   3562.1.0        
   7    IN     ef ee ee fe  01 00 00 00  ........              3563.1.0        
               00 00 20 00               .. .                  3563.1.8        
  27    IN     ef ee ee fe  01 00 00 00  ........              3564.1.0        
               00 00 20 00               .. .                  3564.1.8        
   7    IN     00 00 00 00  00 00 00 00  ........              3565.1.0(520)   
               00 00 00 00  00 00 00 00  ........              3565.1.8        
               00 00 00 00  00 00 00 00  ........              3565.1.16       
               00 00 00 00  00 00 00 00  ........              3565.1.24       
   7    IN                                                     4085.1.0        
  27    IN     00 00 00 00  00 00 00 00  ........              4086.1.0        
               00 00 00 00  00 00 00 00  ........              4086.1.8        
               00 00 00 00  00 00 00 00  ........              4086.1.16       
               00 00 00 00  00 00 00 00  ........              4086.1.24       
   7    OUT    ef ee ee fe  01 00 00 00  ........              4087.1.0        
               03 00 00 00               ....                  4087.1.8        
  27    OUT    ef ee ee fe  01 00 00 00  ........              4088.1.0        
               03 00 00 00               ....                  4088.1.8        
   7    OUT    4f 4b 00                  OK.                   4089.1.0        
  27    OUT    4f 4b 00                  OK.                   4090.1.0        
   7    IN     ef ee ee fe  01 00 00 00  ........              4091.1.0        
               07 00 00 00               ....                  4091.1.8        
   7    IN     4f 4b 40 30  78 30 00     OK@0x0.               4092.1.0        
  27    IN     ef ee ee fe  01 00 00 00  ........              4093.1.0        
               07 00 00 00               ....                  4093.1.8        
  27    IN     4f 4b 40 30  78 30 00     OK@0x0.               4094.1.0        
   7    OUT    ef ee ee fe  01 00 00 00  ........              4095.1.0        
               03 00 00 00               ....                  4095.1.8        
  27    OUT    ef ee ee fe  01 00 00 00  ........              4096.1.0        
               03 00 00 00               ....                  4096.1.8        
   7    OUT    4f 4b 00                  OK.                   4097.1.0        
  27    OUT    4f 4b 00                  OK.                   4098.1.0        
   7    IN     ef ee ee fe  01 00 00 00  ........              4099.1.0        
               00 00 20 00               .. .                  4099.1.8        
  27    IN     ef ee ee fe  01 00 00 00  ........              4100.1.0        
               00 00 20 00               .. .                  4100.1.8        
   7    IN     00 00 00 00  00 00 00 00  ........              4101.1.0(520)   
               00 00 00 00  00 00 00 00  ........              4101.1.8        
               00 00 00 00  00 00 00 00  ........              4101.1.16       
               00 00 00 00  00 00 00 00  ........              4101.1.24       
   7    IN                                                     4621.1.0        
  27    IN     00 00 00 00  00 00 00 00  ........              4622.1.0        
               00 00 00 00  00 00 00 00  ........              4622.1.8        
               00 00 00 00  00 00 00 00  ........              4622.1.16       
               00 00 00 00  00 00 00 00  ........              4622.1.24       
   7    OUT    ef ee ee fe  01 00 00 00  ........              4623.1.0        
               03 00 00 00               ....                  4623.1.8        
  27    OUT    ef ee ee fe  01 00 00 00  ........              4624.1.0        
               03 00 00 00               ....                  4624.1.8        
   7    OUT    4f 4b 00                  OK.                   4625.1.0        
  27    OUT    4f 4b 00                  OK.                   4626.1.0        
   7    IN     ef ee ee fe  01 00 00 00  ........              4627.1.0        
               95 00 00 00               ....                  4627.1.8        
   7    IN     3c 3f 78 6d  6c 20 76 65  <?xml ve              4628.1.0        
               72 73 69 6f  6e 3d 22 31  rsion="1              4628.1.8        
               2e 30 22 20  65 6e 63 6f  .0" enco              4628.1.16       
               64 69 6e 67  3d 22 75 74  ding="ut              4628.1.24       
  27    IN     ef ee ee fe  01 00 00 00  ........              4629.1.0        
               95 00 00 00               ....                  4629.1.8        
  27    IN     3c 3f 78 6d  6c 20 76 65  <?xml ve              4630.1.0        
               72 73 69 6f  6e 3d 22 31  rsion="1              4630.1.8        
               2e 30 22 20  65 6e 63 6f  .0" enco              4630.1.16       
               64 69 6e 67  3d 22 75 74  ding="ut              4630.1.24       
   7    OUT    ef ee ee fe  01 00 00 00  ........              4631.1.0        
               03 00 00 00               ....                  4631.1.8        
  27    OUT    ef ee ee fe  01 00 00 00  ........              4632.1.0        
               03 00 00 00               ....                  4632.1.8        
   7    OUT    4f 4b 00                  OK.                   4633.1.0        
  27    OUT    4f 4b 00                  OK.                   4634.1.0        
   7    IN     ef ee ee fe  01 00 00 00  ........              4635.1.0        
               66 00 00 00               f...                  4635.1.8        
   7    IN     3c 3f 78 6d  6c 20 76 65  <?xml ve              4636.1.0        
               72 73 69 6f  6e 3d 22 31  rsion="1              4636.1.8        
               2e 30 22 20  65 6e 63 6f  .0" enco              4636.1.16       
               64 69 6e 67  3d 22 75 74  ding="ut              4636.1.24       
  27    IN     ef ee ee fe  01 00 00 00  ........              4637.1.0        
               66 00 00 00               f...                  4637.1.8        
  27    IN     3c 3f 78 6d  6c 20 76 65  <?xml ve              4638.1.0        
               72 73 69 6f  6e 3d 22 31  rsion="1              4638.1.8        
               2e 30 22 20  65 6e 63 6f  .0" enco              4638.1.16       
               64 69 6e 67  3d 22 75 74  ding="ut              4638.1.24       
   7    OUT    ef ee ee fe  01 00 00 00  ........              4639.1.0        
               03 00 00 00               ....                  4639.1.8        
  27    OUT    ef ee ee fe  01 00 00 00  ........              4640.1.0        
               03 00 00 00               ....                  4640.1.8        
   7    OUT    4f 4b 00                  OK.                   4641.1.0        
  27    OUT    4f 4b 00                  OK.                   4642.1.0        
   7    OUT    ef ee ee fe  01 00 00 00  ........              4643.1.0        
               d0 00 00 00               ....                  4643.1.8        
  27    OUT    ef ee ee fe  01 00 00 00  ........              4644.1.0        
               d0 00 00 00               ....                  4644.1.8        
   7    OUT    3c 3f 78 6d  6c 20 76 65  <?xml ve              4645.1.0        
               72 73 69 6f  6e 3d 22 31  rsion="1              4645.1.8        
               2e 30 22 20  65 6e 63 6f  .0" enco              4645.1.16       
               64 69 6e 67  3d 22 75 74  ding="ut              4645.1.24       
  27    OUT    3c 3f 78 6d  6c 20 76 65  <?xml ve              4646.1.0        
               72 73 69 6f  6e 3d 22 31  rsion="1              4646.1.8        
               2e 30 22 20  65 6e 63 6f  .0" enco              4646.1.16       
               64 69 6e 67  3d 22 75 74  ding="ut              4646.1.24       
   7    IN     ef ee ee fe  01 00 00 00  ........              4647.1.0        
               03 00 00 00               ....                  4647.1.8        
   7    IN     4f 4b 00                  OK.                   4648.1.0        
  27    IN     ef ee ee fe  01 00 00 00  ........              4649.1.0        
               03 00 00 00               ....                  4649.1.8        
  27    IN     4f 4b 00                  OK.                   4650.1.0        
   7    IN     ef ee ee fe  01 00 00 00  ........              4651.1.0        
               09 01 00 00               ....                  4651.1.8        
   7    IN     3c 3f 78 6d  6c 20 76 65  <?xml ve              4652.1.0        
               72 73 69 6f  6e 3d 22 31  rsion="1              4652.1.8        
               2e 30 22 20  65 6e 63 6f  .0" enco              4652.1.16       
               64 69 6e 67  3d 22 75 74  ding="ut              4652.1.24       
  27    IN     ef ee ee fe  01 00 00 00  ........              4653.1.0        
               09 01 00 00               ....                  4653.1.8        
  27    IN     3c 3f 78 6d  6c 20 76 65  <?xml ve              4654.1.0        
               72 73 69 6f  6e 3d 22 31  rsion="1              4654.1.8        
               2e 30 22 20  65 6e 63 6f  .0" enco              4654.1.16       
               64 69 6e 67  3d 22 75 74  ding="ut              4654.1.24       
   7    OUT    ef ee ee fe  01 00 00 00  ........              4655.1.0        
               03 00 00 00               ....                  4655.1.8        
  27    OUT    ef ee ee fe  01 00 00 00  ........              4656.1.0        
               03 00 00 00               ....                  4656.1.8        
   7    OUT    4f 4b 00                  OK.                   4657.1.0        
  27    OUT    4f 4b 00                  OK.                   4658.1.0        
   7    IN     ef ee ee fe  01 00 00 00  ........              4659.1.0        
               0a 00 00 00               ....                  4659.1.8        
   7    IN     4f 4b 40 30  78 31 38 34  OK@0x184              4660.1.0        
               32 00                     2.                    4660.1.8        
  27    IN     ef ee ee fe  01 00 00 00  ........              4661.1.0        
               0a 00 00 00               ....                  4661.1.8        
  27    IN     4f 4b 40 30  78 31 38 34  OK@0x184              4662.1.0        
               32 00                     2.                    4662.1.8        
   7    OUT    ef ee ee fe  01 00 00 00  ........              4663.1.0        
               03 00 00 00               ....                  4663.1.8        
  27    OUT    ef ee ee fe  01 00 00 00  ........              4664.1.0        
               03 00 00 00               ....                  4664.1.8        
   7    OUT    4f 4b 00                  OK.                   4665.1.0        
  27    OUT    4f 4b 00                  OK.                   4666.1.0        
   7    IN     ef ee ee fe  01 00 00 00  ........              4667.1.0        
               03 00 00 00               ....                  4667.1.8        
   7    IN     4f 4b 00                  OK.                   4668.1.0        
  27    IN     ef ee ee fe  01 00 00 00  ........              4669.1.0        
               03 00 00 00               ....                  4669.1.8        
  27    IN     4f 4b 00                  OK.                   4670.1.0        
   7    OUT    ef ee ee fe  01 00 00 00  ........              4671.1.0        
               03 00 00 00               ....                  4671.1.8        
  27    OUT    ef ee ee fe  01 00 00 00  ........              4672.1.0        
               03 00 00 00               ....                  4672.1.8        
   7    OUT    4f 4b 00                  OK.                   4673.1.0        
  27    OUT    4f 4b 00                  OK.                   4674.1.0        
   7    IN     ef ee ee fe  01 00 00 00  ........              4675.1.0        
               42 18 00 00               B...                  4675.1.8        
  27    IN     ef ee ee fe  01 00 00 00  ........              4676.1.0        
               42 18 00 00               B...                  4676.1.8        
   7    IN     3c 3f 78 6d  6c 20 76 65  <?xml ve              4677.1.0        
               72 73 69 6f  6e 3d 22 31  rsion="1              4677.1.8        
               2e 30 22 20  65 6e 63 6f  .0" enco              4677.1.16       
               64 69 6e 67  3d 22 75 74  ding="ut              4677.1.24       
   7    IN     7a 65 3e 30  78 31 66 30  ze>0x1f0              4678.1.0        
               30 30 30 30  3c 2f 73 69  0000</si              4678.1.8        
               7a 65 3e 3c  2f 70 74 3e  ze></pt>              4678.1.16       
               3c 70 74 3e  3c 6e 61 6d  <pt><nam              4678.1.24       
  27    IN     3c 3f 78 6d  6c 20 76 65  <?xml ve              4679.1.0        
               72 73 69 6f  6e 3d 22 31  rsion="1              4679.1.8        
               2e 30 22 20  65 6e 63 6f  .0" enco              4679.1.16       
               64 69 6e 67  3d 22 75 74  ding="ut              4679.1.24       
   7    OUT    ef ee ee fe  01 00 00 00  ........              4680.1.0        
               03 00 00 00               ....                  4680.1.8        
  27    OUT    ef ee ee fe  01 00 00 00  ........              4681.1.0        
               03 00 00 00               ....                  4681.1.8        
   7    OUT    4f 4b 00                  OK.                   4682.1.0        
  27    OUT    4f 4b 00                  OK.                   4683.1.0        
   7    IN     ef ee ee fe  01 00 00 00  ........              4684.1.0        
               95 00 00 00               ....                  4684.1.8        
   7    IN     3c 3f 78 6d  6c 20 76 65  <?xml ve              4685.1.0        
               72 73 69 6f  6e 3d 22 31  rsion="1              4685.1.8        
               2e 30 22 20  65 6e 63 6f  .0" enco              4685.1.16       
               64 69 6e 67  3d 22 75 74  ding="ut              4685.1.24       
  27    IN     ef ee ee fe  01 00 00 00  ........              4686.1.0        
               95 00 00 00               ....                  4686.1.8        
  27    IN     3c 3f 78 6d  6c 20 76 65  <?xml ve              4687.1.0        
               72 73 69 6f  6e 3d 22 31  rsion="1              4687.1.8        
               2e 30 22 20  65 6e 63 6f  .0" enco              4687.1.16       
               64 69 6e 67  3d 22 75 74  ding="ut              4687.1.24       
   7    OUT    ef ee ee fe  01 00 00 00  ........              4688.1.0        
               03 00 00 00               ....                  4688.1.8        
  27    OUT    ef ee ee fe  01 00 00 00  ........              4689.1.0        
               03 00 00 00               ....                  4689.1.8        
   7    OUT    4f 4b 00                  OK.                   4690.1.0        
  27    OUT    4f 4b 00                  OK.                   4691.1.0        
   7    IN     ef ee ee fe  01 00 00 00  ........              4692.1.0        
               66 00 00 00               f...                  4692.1.8        
   7    IN     3c 3f 78 6d  6c 20 76 65  <?xml ve              4693.1.0        
               72 73 69 6f  6e 3d 22 31  rsion="1              4693.1.8        
               2e 30 22 20  65 6e 63 6f  .0" enco              4693.1.16       
               64 69 6e 67  3d 22 75 74  ding="ut              4693.1.24       
  27    IN     ef ee ee fe  01 00 00 00  ........              4694.1.0        
               66 00 00 00               f...                  4694.1.8        
  27    IN     3c 3f 78 6d  6c 20 76 65  <?xml ve              4695.1.0        
               72 73 69 6f  6e 3d 22 31  rsion="1              4695.1.8        
               2e 30 22 20  65 6e 63 6f  .0" enco              4695.1.16       
               64 69 6e 67  3d 22 75 74  ding="ut              4695.1.24       
   7    OUT    ef ee ee fe  01 00 00 00  ........              4696.1.0        
               03 00 00 00               ....                  4696.1.8        
  27    OUT    ef ee ee fe  01 00 00 00  ........              4697.1.0        
               03 00 00 00               ....                  4697.1.8        
   7    OUT    4f 4b 00                  OK.                   4698.1.0        
  27    OUT    4f 4b 00                  OK.                   4699.1.0        
   7    OUT    ef ee ee fe  01 00 00 00  ........              4700.1.0        
               32 01 00 00               2...                  4700.1.8        
  27    OUT    ef ee ee fe  01 00 00 00  ........              4701.1.0        
               32 01 00 00               2...                  4701.1.8        
   7    OUT    3c 3f 78 6d  6c 20 76 65  <?xml ve              4702.1.0        
               72 73 69 6f  6e 3d 22 31  rsion="1              4702.1.8        
               2e 30 22 20  65 6e 63 6f  .0" enco              4702.1.16       
               64 69 6e 67  3d 22 75 74  ding="ut              4702.1.24       
  27    OUT    3c 3f 78 6d  6c 20 76 65  <?xml ve              4703.1.0        
               72 73 69 6f  6e 3d 22 31  rsion="1              4703.1.8        
               2e 30 22 20  65 6e 63 6f  .0" enco              4703.1.16       
               64 69 6e 67  3d 22 75 74  ding="ut              4703.1.24       
   7    IN     ef ee ee fe  01 00 00 00  ........              4704.1.0        
               03 00 00 00               ....                  4704.1.8        
   7    IN     4f 4b 00                  OK.                   4705.1.0        
  27    IN     ef ee ee fe  01 00 00 00  ........              4706.1.0        
               03 00 00 00               ....                  4706.1.8        
  27    IN     4f 4b 00                  OK.                   4707.1.0        
   7    IN     ef ee ee fe  01 00 00 00  ........              4708.1.0        
               01 01 00 00               ....                  4708.1.8        
   7    IN     3c 3f 78 6d  6c 20 76 65  <?xml ve              4709.1.0        
               72 73 69 6f  6e 3d 22 31  rsion="1              4709.1.8        
               2e 30 22 20  65 6e 63 6f  .0" enco              4709.1.16       
               64 69 6e 67  3d 22 75 74  ding="ut              4709.1.24       
  27    IN     ef ee ee fe  01 00 00 00  ........              4710.1.0        
               01 01 00 00               ....                  4710.1.8        
  27    IN     3c 3f 78 6d  6c 20 76 65  <?xml ve              4711.1.0        
               72 73 69 6f  6e 3d 22 31  rsion="1              4711.1.8        
               2e 30 22 20  65 6e 63 6f  .0" enco              4711.1.16       
               64 69 6e 67  3d 22 75 74  ding="ut              4711.1.24       
   7    OUT    ef ee ee fe  01 00 00 00  ........              4712.1.0        
               03 00 00 00               ....                  4712.1.8        
  27    OUT    ef ee ee fe  01 00 00 00  ........              4713.1.0        
               03 00 00 00               ....                  4713.1.8        
   7    OUT    4f 4b 00                  OK.                   4714.1.0        
  27    OUT    4f 4b 00                  OK.                   4715.1.0        
   7    IN     ef ee ee fe  01 00 00 00  ........              4716.1.0        
               16 00 00 00               ....                  4716.1.8        
   7    IN     4f 4b 40 30  78 30 30 30  OK@0x000              4717.1.0        
               30 30 30 30  30 30 30 30  00000000              4717.1.8        
               32 38 30 30  30 00        28000.                4717.1.16       
  27    IN     ef ee ee fe  01 00 00 00  ........              4718.1.0        
               16 00 00 00               ....                  4718.1.8        
  27    IN     4f 4b 40 30  78 30 30 30  OK@0x000              4719.1.0        
               30 30 30 30  30 30 30 30  00000000              4719.1.8        
               32 38 30 30  30 00        28000.                4719.1.16       
   7    OUT    ef ee ee fe  01 00 00 00  ........              4720.1.0        
               03 00 00 00               ....                  4720.1.8        
  27    OUT    ef ee ee fe  01 00 00 00  ........              4721.1.0        
               03 00 00 00               ....                  4721.1.8        
   7    OUT    4f 4b 00                  OK.                   4722.1.0        
  27    OUT    4f 4b 00                  OK.                   4723.1.0        
   7    IN     ef ee ee fe  01 00 00 00  ........              4724.1.0        
               07 00 00 00               ....                  4724.1.8        
   7    IN     4f 4b 40 30  78 30 00     OK@0x0.               4725.1.0        
  27    IN     ef ee ee fe  01 00 00 00  ........              4726.1.0        
               07 00 00 00               ....                  4726.1.8        
  27    IN     4f 4b 40 30  78 30 00     OK@0x0.               4727.1.0        
   7    OUT    ef ee ee fe  01 00 00 00  ........              4728.1.0        
               03 00 00 00               ....                  4728.1.8        
  27    OUT    ef ee ee fe  01 00 00 00  ........              4729.1.0        
               03 00 00 00               ....                  4729.1.8        
   7    OUT    4f 4b 00                  OK.                   4730.1.0        
  27    OUT    4f 4b 00                  OK.                   4731.1.0        
   7    IN     ef ee ee fe  01 00 00 00  ........              4732.1.0        
               00 80 02 00               ....                  4732.1.8        
  27    IN     ef ee ee fe  01 00 00 00  ........              4733.1.0        
               00 80 02 00               ....                  4733.1.8        
   7    IN     24 51 00 00  2e 81 46 00  $Q....F.              4734.1.0        
               ff ff ff ff  0a bb 65 0a  ......e.              4734.1.8        
               33 00 00 00  20 00 00 00  3... ...              4734.1.16       
               08 00 04 00  05 00 83 00  ........              4734.1.24       
   7    IN     00 00 00 00  00 00 00 00  ........              4735.1.0        
               00 00 00 00  00 00 00 00  ........              4735.1.8        
               00 00 00 00  00 00 00 00  ........              4735.1.16       
               00 00 00 00  07 00 00 00  ........              4735.1.24       
   7    IN     c8 36 0d 00  2f 6d 6e 74  .6../mnt              4736.1.0        
               2f 76 65 6e  64 6f 72 2f  /vendor/              4736.1.8        
               6e 76 64 61  74 61 2f 6d  nvdata/m              4736.1.16       
               64 2f 4e 56  52 41 4d 2f  d/NVRAM/              4736.1.24       
   7    IN     42 52 41 54  2f 48 4c 31  BRAT/HL1              4737.1.0        
               31 5f 30 30  31 00 49 4e  1_001.IN              4737.1.8        
               46 4f 00 00  00 00 00 00  FO......              4737.1.16       
               00 00 00 00  00 00 00 00  ........              4737.1.24       
   7    IN     00 00 00 00  00 00 00 00  ........              4738.1.0        
               00 00 00 00  00 00 00 00  ........              4738.1.8        
               00 00 00 00  00 00 00 00  ........              4738.1.16       
               00 00 00 00  00 00 00 00  ........              4738.1.24       
   7    IN     00 00 00 00  00 00 00 00  ........              4739.1.0        
               00 00 00 00  00 00 00 00  ........              4739.1.8        
               00 00 00 00  00 00 00 00  ........              4739.1.16       
               07 00 00 00  ee 6e 46 00  .....nF.              4739.1.24       
   7    IN     00 00 00 00  00 00 00 00  ........              4740.1.0(28)    
               00 00 00 00  00 00 00 00  ........              4740.1.8        
               00 00 00 00  00 00 00 00  ........              4740.1.16       
               00 00 00 00  00 00 00 00  ........              4740.1.24       
   7    IN     00 00 00 00  00 00 00 00  ........              4768.1.0        
               00 00 00 00  00 00 00 00  ........              4768.1.8        
               00 00 00 00  00 00 00 00  ........              4768.1.16       
               00 00 00 00  00 30 30 30  .....000              4768.1.24       
   7    IN     00 00 00 30  30 30 00 52  ...000.R              4769.1.0        
               69 6e 67 54  6f 6e 65 44  ingToneD              4769.1.8        
               52 43 5f 43  6f 6d 70 46  RC_CompF              4769.1.16       
               6c 74 00 00  00 00 00 00  lt......              4769.1.24       
   7    IN     00 00 0c 29  66 ac e0 f8  ...)f...              4770.1.0        
               ff ff ff ff  f6 df ad 66  .......f              4770.1.8        
               28 0d 00 00  00 00 00 00  (.......              4770.1.16       
               00 00 00 00  00 00 00 00  ........              4770.1.24       
   7    IN     99 a1 4e f3  34 00 00 00  ..N.4...              4771.1.0        
               00 00 00 00  00 00 00 00  ........              4771.1.8        
               00 00 00 00  00 00 00 00  ........              4771.1.16       
               00 00 00 00  00 00 00 00  ........              4771.1.24       
   7    IN     00 80 00 00  00 00 14 00  ........              4772.1.0        
               00 00 00 00  00 00 00 00  ........              4772.1.8        
               00 00 00 00  00 00 00 00  ........              4772.1.16       
               00 00 00 00  00 00 00 00  ........              4772.1.24       
   7    IN     00 36 00 24  00 1e 00 21  .6.$...!              4773.1.0        
               00 30 00 48  00 24 00 24  .0.H.$.$              4773.1.8        
               00 00 00 00  00 00 00 00  ........              4773.1.16       
               00 00 00 21  00 30 00 39  ...!.0.9              4773.1.24       
   7    IN     00 00 00 00  00 00 00 00  ........              4774.1.0        
               00 00 00 00  00 00 00 00  ........              4774.1.8        
               00 00 00 00  00 00 00 00  ........              4774.1.16       
               00 00 00 00  00 00 00 00  ........              4774.1.24       
  27    IN     24 51 00 00  2e 81 46 00  $Q....F.              4775.1.0        
               ff ff ff ff  0a bb 65 0a  ......e.              4775.1.8        
               33 00 00 00  20 00 00 00  3... ...              4775.1.16       
               08 00 04 00  05 00 83 00  ........              4775.1.24       
   7    OUT    ef ee ee fe  01 00 00 00  ........              4776.1.0        
               03 00 00 00               ....                  4776.1.8        
  27    OUT    ef ee ee fe  01 00 00 00  ........              4777.1.0        
               03 00 00 00               ....                  4777.1.8        
   7    OUT    4f 4b 00                  OK.                   4778.1.0        
  27    OUT    4f 4b 00                  OK.                   4779.1.0        
   7    IN     ef ee ee fe  01 00 00 00  ........              4780.1.0        
               95 00 00 00               ....                  4780.1.8        
   7    IN     3c 3f 78 6d  6c 20 76 65  <?xml ve              4781.1.0        
               72 73 69 6f  6e 3d 22 31  rsion="1              4781.1.8        
               2e 30 22 20  65 6e 63 6f  .0" enco              4781.1.16       
               64 69 6e 67  3d 22 75 74  ding="ut              4781.1.24       
  27    IN     ef ee ee fe  01 00 00 00  ........              4782.1.0        
               95 00 00 00               ....                  4782.1.8        
  27    IN     3c 3f 78 6d  6c 20 76 65  <?xml ve              4783.1.0        
               72 73 69 6f  6e 3d 22 31  rsion="1              4783.1.8        
               2e 30 22 20  65 6e 63 6f  .0" enco              4783.1.16       
               64 69 6e 67  3d 22 75 74  ding="ut              4783.1.24       
   7    OUT    ef ee ee fe  01 00 00 00  ........              4784.1.0        
               03 00 00 00               ....                  4784.1.8        
  27    OUT    ef ee ee fe  01 00 00 00  ........              4785.1.0        
               03 00 00 00               ....                  4785.1.8        
   7    OUT    4f 4b 00                  OK.                   4786.1.0        
  27    OUT    4f 4b 00                  OK.                   4787.1.0        
   7    IN     ef ee ee fe  01 00 00 00  ........              4788.1.0        
               66 00 00 00               f...                  4788.1.8        
   7    IN     3c 3f 78 6d  6c 20 76 65  <?xml ve              4789.1.0        
               72 73 69 6f  6e 3d 22 31  rsion="1              4789.1.8        
               2e 30 22 20  65 6e 63 6f  .0" enco              4789.1.16       
               64 69 6e 67  3d 22 75 74  ding="ut              4789.1.24       
  27    IN     ef ee ee fe  01 00 00 00  ........              4790.1.0        
               66 00 00 00               f...                  4790.1.8        
  27    IN     3c 3f 78 6d  6c 20 76 65  <?xml ve              4791.1.0        
               72 73 69 6f  6e 3d 22 31  rsion="1              4791.1.8        
               2e 30 22 20  65 6e 63 6f  .0" enco              4791.1.16       
               64 69 6e 67  3d 22 75 74  ding="ut              4791.1.24       
   7    USTS   c0010000                  canceled              4792.1.0(9)     
